122449983151669248	Negative	intanto la partita per via nazionale si complica #saccomanni dice che mica tutti sono mario #monti via
125485104863780865	Negative	false illusioni sgradevoli realtà mario monti via
125513454315507712	Negative	false illusioni sgradevoli realtà #editoriale di mario monti sul corriere della sera #rassegna stampa
125524238290522113	Negative	mario monti berlusconi risparmi all'italia il biasimo per aver causato un disastro #mariomontipremier
125527933224886272	Negative	mario monti berlusconi risparmi all'italia il biasimo per aver causato un disastro i giudizi di usa e europa
125533343482789889	Negative	l'attacco di mario monti al governo berlusconi false illusioni sgradevoli realtà corriere della sera
125642756147265536	Negative	le 5 sgradevoli realtà di cui berlusconi dovrebbe rendersi personalmente conto mario monti non usa mezzi termini
125692702145785856	Negative	false illusioni sgradevoli realtà l'editoriale di mario monti sul fallimento di berlusconi oggi sul corriere
125695266887184384	Negative	mario monti c'è il rischio di trasformare l'italia da stato fondatore in stato affondatore dell'unione europea
125838624670490624	Negative	ma a quanta gente democratica rode che la borsa non ne voglia sapere di continuare a crollare povero mario monti sara' disperato
125949521627840512	Negative	mario monti false illusioni sgradevoli realtà dall'italia la possibile disintegrazione dell'unione europea
126527896218107904	Negative	l'ho letto quell'articolo in treno sul corriere della sera parole durissime ed e' mario monti un moderato siam messi male
127100968415395841	Negative	ascolti mario monti e ti chiedi perché disperdere un capitale e continuare a farsi rappresentare da questi pezzi di merda #ottoemezzo
127137847491821568	Negative	#la7 ma perche' mario monti non fa il premier che persona competente e per bene
128787344999460865	Negative	perché non ha senso parlare di governo monti casini o bersani
129143970163990528	Negative	mario monti è conosciuto dal 60% degli intervistati che però preferiscono chiamarlo gamberi e zucchine serena gandhi
130592030031228929	Negative	mario #monti la lira non era una moneta strana ma era il più' delle volte una moneta debole perche rifletteva caratteristiche dell'italia
131426878245437440	Negative	ma quanto ce vuole affinchè mario monti arrivi a palazzo chigi sarà impanicato nel traffico festivo del ponte
131759065108979712	Negative	bossi risponde con una pernacchia a un ipotetico governo monti e con il dito medio a misure destinate alle pensioni un signor ministro
132357470214565888	Negative	siamo agli sgoccioli però penso al dopo se piazzano un mario monti non credo che per lavoratori e pensionati cambierà tanto
133547585985191937	Negative	governo tecnico attentato alla costituzione un governo tecnico magari presieduto da mario monti sarebbe un
133647423804420096	Negative	mario monti non conosce i politici e la politica per questo avrebbe molte difficoltà a fare il premier (g pasquino) #dimissioni #aeiouy
133822129773879297	Negative	mario monti a capo del governo tecnico come avere un marziano a roma voci insistenti danno l'ex commissario ue
133831591234502656	Negative	mario monti for president che fatica essere di sinistra dalla jena di oggi
133841919162851329	Negative	sta partendo il fuoco di fila contro il voto anticipato così ci siamo giocati anche la cartazapatero e se non si fa il governo monti
133849038243110912	Negative	[news] mario monti a capo del governo tecnico come avere un marziano a roma
133954931982991360	Negative	cmq mario monti è come carlo d'inghilterra poverino non sarà mai re #trcentootto
134019183733256192	Negative	meglio una lenta agonia firmata casini/bersani o una morte rapida ma dolorosa con il governo monti io dico #revolution #laresadeiconti#fb
134284176378703872	Negative	_blog verso l'implosione farebbero meglio a pensare pragmaticamente alle condizioni da porre per un governo #monti
134334950777438208	Negative	mario monti nominato senatore a vita della repubblica italiana moribonda #elezioni #308
134335814531416064	Negative	napolitano bisogna agire ora magari a cazzo di cane ma ora mario monti senatore a vita frappa
134338555727187969	Negative	mario monti è famoso per il modello di klein monti l'ho appena letto su wikipedia qualcuno vuole che glielo spieghi
134340171075301377	Negative	diventa anche tu #ministroavita come mario monti potrai far cadere governi e salvare patrie dalla crisi economica #laresadeiconti #acasa
134341884591083521	Negative	secondo me nel governo #monti ci mettono pure bini smaghi così sarkozy e' contento e poi basta pero'
134344682896494592	Negative	mario monti nominato senatore a vita i primi momenti del post berlusconi mi fanno terrore
134345642494537728	Negative	governo monti napolitano sa tanto di padre che toglie il giocattolo al pupo che sennò rischia di sfasciarlo #elezioni #308
134346792639803392	Negative	quello del cav è un passo indietro quello di #napolitano con #mario monti sembra un doppio passo anzi una rabona #fullmonti #colle
134347732520415232	Negative	l'italia confida in mario monti anche se bene che va siamo rovinati
134352182316244992	Negative	governo monti il nome giusto per un paese che ha il destino in salita
134368471311065089	Negative	berlusconi ha dato il via libera a mario monti e' impazzito cosa c'e' sotto
134375354855997440	Negative	governo monti python
134383612698181633	Negative	governo monti scenario molto simile al governo ribaltonesco di dini nel '95
134388495497179136	Negative	ah dimenticavo ma tutta sta caciara per fare un governo #monti mai na sorpresa dentro sto paese
134388731259006976	Negative	mario monti non era il nome di un antipasto #fullmonti #laresadeiconti #elezioni #308
134389183128145923	Negative	che nel governo monti l'economia vada indifferentemente a siniscalco bini smaghi o saccomanni e' demenziale #fullmonti #stamoagioca'
134400875954315264	Negative	merkel sarkozy ti sorridono i #mario monti merkel sarkozy le caprette ti fanno ciao
134401591263494145	Negative	mario monti membro della commissione spaventa sul debito pubblico a me spaventa più lui a dire il vero
134403213712560128	Negative	vedo che la gente sta accogliendo mario monti come fosse il messia chissà se sarà lo stesso quando toccherà pesantemente i loro portafogli
134404634012950528	Negative	mario monti commissario europeo presidente della trilaterale membro del gruppo bilderberg advisor di goldman sachs non è una bella notizia
134404946811551744	Negative	chi vuole mario #monti twitti #fullmonti
134412990308036608	Negative	oggi ho letto di mario #monti (italia 1943) e parag #khanna (usa 1977) e ho pensato bel rinnovamento e quanta fiducia ai giovani
134413154544390144	Negative	mario monti appena c'arrivi metti una legge per far vestire da cristiano oscar giannino sembra un test per daltonici
134423558553219072	Negative	mario monti presidente della trilaterale membro del gruppobilderberg advisor di goldmansachs non è 1 bella notizia #fullmonti
134429795860758530	Negative	si è già assistito a porta a porta alla simulazione di un governo monti con ministri la russa e bindi aberrazione audiovisiva
134437467142107136	Negative	c'è anche mario monti burns smiley
134499785251098624	Negative	mario monti massone (live at
134499788208091136	Negative	mario monti massone (live at
134507265997799426	Negative	passare da berlusconi a mario monti è un salto troppo grosso ci vorrebbe almeno un governo di transizione presieduto da checco zalone
134515315420831745	Negative	male male male un governo monti con letta vice palma e frattini riconfermati ichino (pd) al welfare per fare cosa #elezionisubito
134517816014540800	Negative	controlla questo video il grande golpe globale chi sono mario monti e luca papademos via
134527907820339200	Negative	napolitano servono scelte severe e nomina mario monti senatore a vita prepariamoci al golpe e correte a
134532075050119168	Negative	mai tardi per mandare il paese giù per lo sciacquone vediamo ora chi si assume la responsabilità di far saltare il governo monti
134544501988524032	Negative	qui ci vuole l'uomo forte qui ci vuole l'uomo forte direbbe il borghese piccolo piccolo ma non mario monti
134553624654258176	Negative	da mesi protestiamo e chiediamo mari e monti non mario #monti capo del governo #elezioni
134554634210639872	Negative	berlusconi governo monti scelta ineludibile strano non succede mai che cambi idea da un giorno all'altro
134555103293227008	Negative	controlla questo video il grande golpe globale chi sono mario monti e luca papademos via da ascoltare )
134556260380053504	Negative	mario monti ennesimo regalo alle banche
134557222494666752	Negative	per unire politica e nerdate mario monti è quello dei 497 milioni di euro di multa a microsoft
134558780712161280	Negative	sarà ma io ho come l'impressione che il governo monti non interverrà sulla spesa pubblica (vedi la casta )
134559259382910976	Negative	ma alto profilo de che chi è davvero mario monti #fullmonti #crisi #lacrisiancoradevearrivare
134559601046716416	Negative	la lega va all'opposizione il pd si suicida in un governo con udc e pdl silvio risorge proprio un'ottima idea il governo monti
134559889413509120	Negative	arriva mario #monti pronti a mettere tutti il grembiulino
134562616398983169	Negative	governo monti di pietro dice no risponde a banche e speculatori via
134563814925549568	Negative	di pietro dice no al governo monti mi sembra già di rivedere l'ulivo e la sua simpatica caciara #fullmonti
134569480788516865	Negative	mario monti alfano no saranno i muppet a salvare il governo dalla crisi voi li votereste
134570254985728000	Negative	ma poi ad un certo punto i giochi di parole su #mario monti hanno una fine vero
134570389690003456	Negative	mario monti sulla #cadrega
134571873047560192	Negative	gli inquietanti sponsor di mario monti
134573374155403264	Negative	tutti a gridare al miracolo per l'avvento di mario monti non gioisco perchè so che le banche le salveremo noi con il nostro sangue futuro
134578734555611137	Negative	con il no ad un possibile governo di mario #monti lega nord e italia dei valori stanno dimostrando tutta la loro cultura politica
134585500118958080	Negative	maroni conferma governo monti noi fuori roma – ''se il presidente della repubblica napolitano dara' l'inca
134591331665321984	Negative	crisi economica sempre più grave governo tecnico incarico probabile a mario monti editoriali e commenti di oggi
134591348656447488	Negative	comunque a me non convince nemmeno il governo #monti uomo che non ha idea di com'è la società essendo cresciuto alla #bocconi
134591510334275584	Negative	di pietro chiude al governo monti risponde al sistema bancario
134591511454158848	Negative	lega nord maroni dice no al governo monti
134593217491513344	Negative	mario #monti da goldman sachs ad aspen institute passando per la trilateral nazisti & massoni esultano
134595959492587520	Negative	si parla tanto di governo monti il governo superpartes e poi ci vogliono mettere il presidente di una banca all'economia #308 #fatepresto
134599140071059457	Negative	governo monti un inutile accanimento terapeutico in europa lo temono
134600925070368768	Negative	berlusconi dice sì al governo monti del resto è un'ammucchiata #fb
134601409986437121	Negative	il grande golpe globale chi sono mario monti e luca papademos via
134601830117294081	Negative	goldman sachs innesca la crisi e poi piazza mario monti a risolverla via
134603762361843713	Negative	ma perchè scegliere mario monti quando ci sarebbe chuck norris
134604963061039105	Negative	da mesi protestiamo e chiediamo mari e monti non mario #monti capo del governo #elezioni subito
134606130147106816	Negative	di pietro ha detto no a mario monti presidente del consiglio ma ha detto sì a mannagggiament ( ebook o libro cartaceo )
134606241824653312	Negative	se #dipietro non vota a favore del governo #monti è un'irresponsabile demagogo
134608206537306113	Negative	non mi fido di mario monti mai fidarsi di chi non è stato coinvolto in uno scandalo sessuale
134613359151693826	Negative	gelmini brunetta sacconi rotondi gli ex an uscirebbero dal pdl in caso governo monti il solito culo di b che se ne libererebbe finalmente
134613705697660928	Negative	poi mi spiegate perché bisognerebbe essere felici di mario monti
134615291106828288	Negative	spero di cuore che confermi di non voler entrare nel governo monti tutti voti che andranno al #cinismoapalate
134626113023524864	Negative	un governo #monti penalizzerebbe più l'intesa del pd con vendola che con di pietro a penalizzare di pietro basterà il ritiro di berlusconi
