458577671652646912	Negative	#lawinenunglück ruhe auf dem berg
449585168136028160	Negative	rt passend zu unserer reihe fakten gegen vorurteile von wegen invasion nach europa #gemeinsamgegenrass…
451963804226953216	Negative	rt _tages totalüberwachung und kontrolle des autofahrers
450917308102619136	Negative	das plakat ist so oder so schlecht ob mit pulli oder bh macht das gar keinen unterschied
457167433556447232	Negative	_ das weiß ich leider nicht eventuell hat dort jemand illegal müll entsorgt sad /mi
449584219711602688	Negative	_max geht leider nur am desktop
457522912074137601	Negative	koch du arsch warum niemand mehr koch werden will
450024191564460033	Negative	rt _ffm apple ingenieur packt aus so entstand das iphone
451631350593097728	Negative	ich krieg die tür nicht zu im sinne von ich kann es nicht fassen
449910147687936000	Negative	dinko weiter und diese unterstützung kann ich mir auch unter so einem vorstand nicht vorstellen #osvwahl
435341809938874368	Negative	jens weidmann geldpolitik darf nicht zum gefangenen der märkte werden
449856822992982016	Negative	kettcar/wiebusch singt ein seltsames lied über homonegativität ähm war bestimmt nett gemeint
449704888080285696	Negative	300€ mit auf'n friedhof müssen nekrophile jetzt auch zahlen #domian
449938964141850624	Negative	dem peter gagelmann seine mutter #skybuli #wobsge
457176986189066240	Negative	komisch dass eure linkleiste vorschaubilder zeigt
449964246823337985	Negative	wurde irgendwo die szene gezeigt bei der 5 eintrachtler handelfmeter forderten bei #skybuli gabs leider keine wiederholung #wobsge
435171072829566976	Negative	du sagst dass ich dir immer wichtig bin und was wenn nicht dann verliere ich dich
451728660878602240	Negative	tatsächlich mal schuhe in meiner größe zu finden ist so wie gegen die bayern zu gewinnen ziemlich schwer aber nicht unmöglich d
451319426521235456	Negative	frankfurt ist wenn selbst der tf im nichtraucherbereich auf dem bahnsteig raucht *seufz* #bahn
458231584299036672	Negative	südsudan rebellen massakrieren hunderte menschen
435455934861545474	Negative	ne sollte eher zeigen dass man auch unter neuem label wieder probleme bekommen wird
457926796596744192	Negative	zum pech kam auch noch pech #vfbs04
435350712503922688	Negative	bei mir normalerweise schon jep es gibt genug dinge auf der welt die man sich einfach sparen kann lbm gehört jetzt dazu x'd
451647921298358272	Negative	#ditech sanierung gescheitert antrag auf schließung und abverkauf lt austria presse agentur #apa #handel #computer via
450862888702730240	Negative	rt jede wahrheit braucht einen mutigen der sie ausspricht und jeder tweet braucht einen dummen der ihn sendet
451254350774800384	Negative	ja wann wenn der chupa seinen hai will dann geht eh nix anderes
457088414488465409	Negative	die frau von cnn london verspricht sich echt oft war gestern auch schon so
449471709306171393	Negative	rt bist du deppat die stadt will in den nächsten jahren 15 mio qm neue grünflächen schaffen in #rust14
457848098287796224	Negative	wenn du sheiss schreibst kann ich diese aussage nicht ernst nehmen 😂😂😂
457942831215423489	Negative	jugendorganisation der afd unter der bikinilinie (von denise peikert)
451430228330819584	Negative	sie sagte familie geht vor ich dachte nur ich fühle mich noch immer alleine
450966447595216896	Negative	rt der beste aprilscherz ist wie immer das überwiesene gehalt vom chef
450372270033485824	Negative	rt das kann nicht echt sein oder so patschert kann niemand sein (via )
457634811864428544	Negative	die komödie tap schließt das finden wir sehr traurig
458529989072535552	Negative	rt nicht verpassen mies um 21 05 die köpfe des jungen architekturbüros abraha achermann sprechen heute u a über ma…
458518677210816512	Negative	fussball 24 manchester united trennt sich von trainer moyes
449496437785886720	Negative	zeigt sich in dieser essl sache gar dass österreichische kunst nix wert ist
449554004163706880	Negative	was verstehen die autofahrerinnen nicht wenn es dort steht geschwindigkeitobergrenze ist 30kmh
435063249898577920	Negative	habe ja nur bommes im ard zitiert wie die genauen statuten beim frauen eishockey sind weiß ich nicht
457035156424257536	Negative	rt _politik #nigeria weiterhin über 100 mädchen in der gewalt von terroristen
449516448738979840	Negative	abschiedsschmerz im büro na bravo ich bin drei wochen weg nicht drei jahre hilfe
458364616847155200	Negative	rt heute zum 1 mal die tribute von panem gesehen kids schlachten sich gegenseitig ab brutalität statt handlung war mein…
457432055916138496	Negative	abgebrannter berg wird per heli aufgepflanzt
435124517497995264	Negative	oh sergej konnste wenigstens nach sochi fahren #sv
450756813844410368	Negative	rt antwortet der düringer auch auf fragen oder beleidigt er einfach nur #procontra
450373321830727680	Negative	heutiges #imzentrum leider ganz so wie erwartet #undtäglichgrüßtdasmurmeltier
449652507917418498	Negative	rt homöopathische mittel zurückgezogen weil sie wirkstoffe enthalten #esoteriktrottel
451330861355765760	Negative	rt _austria birgit schatz 12 stunden arbeitstag bringt uns zurück ins 19 jhdt spö ak u gewerkschaften schweigen dazu
450375954570174464	Negative	sumpf doch eher eine kloake
458696793971515394	Negative	was ist da denn wieder los d
458492950797103104	Negative	dann scheint's bei ihnen entweder am sinnerfassenden lesen zu scheitern oder am zahlenverständnis krimstat sagt gegenteil aus
457214228857122816	Negative	rt unser dauerläufer mit einem akku der deinen stressigsten tag überdauert das #blackberry z30
450725746626269184	Negative	mir faellt die starke stellg des umlagefinanz rentensystems ein sonst wenig und dessen image bröckelt seit den 80ern
450376869595324416	Negative	oje ich hab grad den fehler gemacht zu #imzentrum zu wechseln #strache #strolz #nachbaur uff jetzt schalt ich aus
458568123990687744	Negative	ja wow stars die sind auch alle hässlich d
435554022515544064	Negative	es sei denn man will heulend zusammenbrechen…
435000446416338947	Negative	rt hörst du dir eigentlich selber zu bei dem bullshit den du labert
450624688352681984	Negative	gestohlen
435350977818791936	Negative	die wollen mir weil bei ihnen irgendein timeout war einfach mein geld zurückgeben und ich soll mir dann das teurere ticket
458575518691250176	Negative	wie gesagt sorry wollte niemanden damit ärgern nur ein bisschen aufklären hm nicht so gut gelungen
451299836340736000	Negative	surprise^^ rt steinbacherika kein anderer bk hat so häufig an wichtigen veranstaltungen des bdv teilgenommen wie bk merkel
449488661663711233	Negative	ma 35 wie du weißt du bist scheiße
435688496716476416	Negative	_net brötchen aus dem automaten wie aldi mit seinen backöfen die bäcker ärgert #faz
457122274437382145	Negative	tödliche brandstiftung verdächtiger festgenommen
451958747813146624	Negative	10 stunden geschlafen und immer noch keine lust aufzustehen wenn ich erstmal mit was angefangen habe mag ich nicht damit aufhören
457175666652229633	Negative	krise in der ostukraine separatisten widersetzen sich genfer einigung via
458695317756866560	Negative	ich bin registriert trotzdem fehlanzeige /
451866271165198336	Negative	rt er sagt ich soll mir mühe geben ich finde davon hab ich schon genug
457586745610366977	Negative	arg ohne singen zu können schafft mans bei diesem #dsds ganz schön weit
435565432842362881	Negative	muss meine jugend grade nachholen definitiv zu viel alkohol
451597145074700288	Negative	rt #einserkastl und wer kann was schreiben zum thema 'hitler war gar nicht so'
435074887636774913	Negative	hätte nicht gedacht das slomka so stark unter selbstüberschätzung leidet und sich den kleinen #hsv antut
435344518284861440	Negative	die sucht des gaumens geht über leichen da der verstand außer kontrolle geraten ist
435096679247663104	Negative	berliner datenschutzbeauftragter wikipedias datenschutz ungenügend
458691698567434240	Negative	rt solidarität gibt es nicht da treffen sich die öffi gewerkschafter gar um 4 uhr in der früh und der wiener hält es für eine fre…
457824504191156224	Negative	hahahahhaah ach du scheiße
457177625656836097	Negative	#einkommenssteuer machen alleine nervt schon dann aber auch noch mit so einer schlecht programmierten software o_o #elsterformular
458530115740512256	Negative	_daniel wozu braucht man zum leitartikel schreiben eine maske
435412984765349888	Negative	von meinem account wurden spam mails gesendet bitte löschen sorry
449464852936142848	Negative	rt _hausbichler kommentar v die neos und die zahnspange wen schiefe zähne am fliegen hindern der ist selber schuld ht…
435500411919671296	Negative	bin ja immer skeptischer mit diesen #xmoocs trotzdem das thema #ecommerce lockt
449553333867405312	Negative	gratisnachhilfe ist armutszeugnis für die geplante gratis nachhilfe erntet d #bildung #news
435475497149947905	Negative	_susanne was der wohl dazu sagt #shitstormanzettel
457695831110733824	Negative	spätuhr ausm office gekommen herumgezappt über voice of switzerland gestolpert ich dachte lustige parodie
451678825865547776	Negative	und ronaldo ist ihr neo
457587648073564160	Negative	in öffentlicher debatte gibt es die verschiebung nicht im gegenteil neoliberal ist kampfbegriff // _lindner
450330664186179584	Negative	und ich weiß ja nicht was die für miniblasen haben aber dauernd is wer am häusl ugh nicht mal in ruhe pinkeln kann man hier ^^''''
450292482279231489	Negative	philosophie kann man nur ernst nehmen solange sie sich fröhlich gibt
458509174612439040	Negative	❯ … dann schafft dies eher den charakter von werbung und verkaufen
449630885445636096	Negative	höre jetzt seit 8 23std hr info bald kann ich alles auswendig
451637023489933312	Negative	von scooter höre ich ja zum ersten mal diese woche
457288009164259329	Negative	rt _j_vox ich mag münchen auch nicht das haben franken und hessen gemein^^
435681163005681664	Negative	jetzt wird's ernst so ein audit erinnert mich stark an die mündliche diplomprüfung nur dauerte keinen ganzen tag
458502475016704000	Negative	mpc anlegern droht totalverlust hilfe von unerwarteter seite
457488999616348160	Negative	hund is heute auch eher mehr schaf als hund
457793427879772160	Negative	rt bin ich der einzige mit akismet problemen spam hat sich im april verdreifacht und wird nicht mehr automatisch aussortiert #w…
458547039543238657	Negative	uff mein beileid ich würde ihr echt klar machen das dass außerhalb von gut und böse ist x x
451300600131911680	Negative	rt _net fdp warnt „bauernhofromantik“ mehr geld für hessische ökobauern
457079607486078976	Negative	deja vue genau das gleiche problem hatte ich beim letzten #ubuntu upgrade auch schon
457904207375237121	Negative	viele fritzbox user weiterhin ungeschützt
435157973170933760	Negative	jaja immer dieser #verschmähtestecher
450016984273788928	Negative	@_maeander versteh ich nicht x)
450726050931425280	Negative	muhahaha “ _xaoticca eine illumination erklärerin und ich denke mir nur halt doch einfach das maul”
458244938598465536	Negative	die sind genauso taub und blind wie die von barca
450376565386670083	Negative	“ _horan *ajla das soll nur so wirken ich bin eh fett ich zu nur so als hätte ich sport gemacht* verräterin _
451584306989658112	Negative	wäre ich erst um 3 uhr schlafen gegangen hätte ich jetzt keine ahnung *wer ich bin *wo ich bin *und warum los ich brauche antworten
449488201032667136	Negative	aktuell weder internet noch telefon in frankfurt enkheim…
457024501189201920	Negative	rt amtsverschwiegenheit schrems es ist einfach lächerlich wie das bei uns abläuft facebook kläger max sch http…
435324438088015872	Negative	die chance montagmorgen bei einem französischen film einzuschlafen ist sehr hoch
435326354041487360	Negative	arbeiten ich habe keine lust zu arbeiten ich will weiter überarbeiten
450646507705081856	Negative	wenn ihre bilder vom handy besser aussehen als die ihres mannes von der spiegelreflex jaaa fail #facebook
435679954152730624	Negative	war dann gestern doch mal beim arzt eitr bronchitis und stirnhöhlen dicht doof
450567535755554816	Negative	fussball 24 bvb mit rumpfelf nach madrid lewandowski gesperrt
458530183679864832	Negative	der „next episode“ button auf netflix ist ja gemeingefährlich kann ich den für mehr geld im monat sperren oder sowas
457795502013440000	Negative	#fettsucht in schwellenländern die dicken kinder von #schanghai (von hendrik ankenbrand und dennis kremer)
457581355761954816	Negative	yep werde der gleich entflogen
458702175422525440	Negative	rt schafft endlich diese bundesländer ab #zib2
457230462990438400	Negative	habsch keine
457922902382628864	Negative	den ganzen tag ueber habe ich schon so ein komisches gefuehl
449888753340125184	Negative	2010 hat die green bay uni schon auf century gothic statt arial gesetzt um druckkosten zu sparen pr halt
458123724332359680	Negative	geheimdienste russen spionieren deutsche bei eisernen treffs aus strawnews de
451739073049554944	Negative	was dachtest du denn
451459923390763008	Negative	ist sehr amüsant wenn nichtdeutsche deutsch singen aber miw ist sowieso awesome
450398151971991553	Negative	rt die angebl schlepper waren ohne jeden ernsthaften grund monate lang im gefängnis als entschuldigung sollten sie sofort…
435316130228764672	Negative	ein griff zum strohhalm #hsv #slomka
450323810466926593	Negative	ne mein chef muss erst mal 1 5 stunden nach frankfurt mit dem zug fahren der hat auf keinen fall bock smiley
458701585343053824	Negative	rt niessl das fleisch gewordene argument für die abschaffung der bundesländer #zib2
450756878436270080	Negative	general motors ruft weitere 1 3 millionen wagen zurück
457637088683642881	Negative	hm doof /
451744557320110080	Negative	zu krank sein sich mit medikamenten vollstopfen um die eine stunde referat zu überstehen endet dann mit vorne stehen und umkippen
450657856808054784	Negative	ich würd mir ja endlich mal wieder eine pizza bestellen aber ughhh ich bin ungeschminkt und kann grade keinen soziale aktivität gebrauchen
450543735638470656	Negative	sieht nicht so gut aus für in 3 von 4 umfragen nur auf 1% #euwahl14
451694477686878208	Negative	sybille #lewitscharoffs misslungener krimi katzen tragen keine karos #faz
451592911763685376	Negative	bestochene ärzte gefälschte daten in arzneistudien manipulation in werbung pharma alltag diesmal in japan
451093434670252033	Negative	ausschließlich emotionale gründe ich glaub sie ist ein guter mensch nur das bin ich auch das ist kein asset
450378120978108416	Negative	im zentrum ohne blaufränkisch wäre mir zu trocken
450361605197684736	Negative	der war mal richtig schlecht
457893440102346752	Negative	achja und ich poste ganz normal und schon heisst es ich tu es extra so neidisch meine hater
450274325216501760	Negative	ich brauche dann wohl doch mal einen brauchbareren e mail client cc
450526450844987392	Negative	wir werden alle nicht jünger
457891800716673024	Negative	es ist so das gewalt manchmal der einzige weg ist gewalt zu verhindern aber die usa wegen irakkrieg zu glorifizieren sad
435152328904429568	Negative	rt _b was hat er denn im dschungel bewiesen das er ein weichflötenjammerlappenwarmduscherdeluxe ist '#ibes
458617716128382976	Negative	echt ist der r2251 heut das erste mal seit wochen pünktlich keine freunde u abholen bitten kein taxi rufen wow
458635638066012161	Negative	_stgt diese info liegt mir nicht vor sorry /ni
451344481217183744	Negative	ach leute ist whatsapp schon wieder down &gt &lt
450599366970327041	Negative	du fragst warum ich immer unzufrieden bin mit itvs ich hab dir ehrlich geantwortet u das grün rot hick hack ödet most
457547624883978240	Negative	😂😂😂😂😂😂😂😂😂😂😂😂😂😂😂😂😂😂😂 bitte ich hasse alle dort
451198649327173632	Negative	sag das nicht
450183262812766208	Negative	ich bin aufgedreht und mir ist langweilig o o #fuuu
457297539461812224	Negative	und immer diese frage ob jetzt eigentlich frauen oder männer high heels geiler finden
451264818688032768	Negative	ruinieren kann man so etwas sehr schnell interview m rektor engl #wissenschaftistzukunft
458495383111733248	Negative	_ipp was hab ich verpasst worum gehts
451971669037703168	Negative	grauslich und weiter unpackbar online seite einer ö zeitung zeigt seit 2 tagen video von strangulation eines hundes im aufzug
457582322414800896	Negative	ohne sex will ich heute eben tanzen
457862225773207552	Negative	nicht unbedingt nervenschonend #lfc
450357000548130816	Negative	wenn die #regierung am meisten vom #lobbying profitiert ist das leben in der lobbykratie
457231209232211968	Negative	danke meinen besten freund dominic mainka für das gespräch hat mir etwas geholfen aber bin noch immer schlecht drauf allein
435201946493149184	Negative	@_candykisa_ ich stopfe den petti in so eine reißverschluss tüte dann ist er zusammengequetscht
458491732439887872	Negative	#parodontitis kann nicht nur die mund und zahngesundheit beeinträchtigen sondern auch den gesamten organismus
450985836537208832	Negative	ich find es eh ok muss ja nicht jeder ne aufregende webseite hinzaubern aber diese grundlosen huldigungen versteh ich nicht
450286710010937344	Negative	das unglaubliche wurde wahr eben hat mich am donaukanal ein anderer läufer überholt und dann sogar noch abgehängt
458545195018387456	Negative	#faymann länder an lehrerverwaltung beteiligen ideen einbringen die wollen ihren einfluss nicht verlieren grund &gt
450547802213732352	Negative	“#hypo ist ein symptom für die krankheit macht und geldgier düringer bei pk #tatorthypo
458651576073482240	Negative	rt _he falls du am 25 mai betrunken sein wirst kannst du jetzt briefwahlunterlagen zur europawahl beantragen und vorher schon die…
457158444588728320	Negative	bei der #eintracht ist die stimmung nach der niederlage gegen #h96 am tiefpunkt
450625102590533633	Negative	geht mir weg mit diesen kack rap
449493853742317568	Negative	rt _pusch was ist das für ein datenschutz kunden schicken mit ihrer ip adresse unwissend namen und adresse mit wer br…
458529228087390208	Negative	_grobsen echt huch ich les noch mal den inhalt nach die habe ich wirklich vergessen
458497775874113536	Negative	stimmt weil sie damit wohl radio hören sonst täte es ja ein wecker alleine auch
451232318926376960	Negative	rt _ist_geil alle so yeah in den ferien fahr ich nach xy und mach xy ich so yeah 2 wochen bett und langweilen weil alle bessere…
457964326553661440	Negative	bist ja nur 4 tage weg brauchst die usb soundkarte nicht mitnehmen ich so immer sad
450375016497315840	Negative	rt unfassbar sind die spin doktoren von sp +vp eigentlich alle zusammen auf urlaub wie kann man sich so schlecht präsentier…
451274273815273472	Negative	rt der vfgh hebt das facebookverbot für den orf auf ist „ein unverhältnismäßiger eingriff in die meinungsäußerungs und rund…
451222896787341312	Negative	agentur nato setzt militärische kooperation mit russland aus
458315408966447104	Negative	zu was hab ich da wieder 'ja' gesagt /o\ das is ja arbeit
449866286160674816	Negative	schwarz empfiehlt den vorstand nicht zu entlasten der vorstand verzichtet daraufhin freiwillig auf eine entlastung #osvwahl
435696506503319552	Negative	habe gerade meine nagellacke gezählt ihr findet mich beim schämen in der ecke
458317235850084352	Negative	oh die kommissarin spielt offensichtlich das erste mal squash #schlägerhaltung #tatort
458722929329831936	Negative	wieder mal was unfassbares aus dem land #schweiz schweiz macht rettungskräfte zu temposündern via
450191279104995328	Negative	indes soll der fuel flow sensor bei ricciardo erneut defekt sein hat das wieder ein böses nachspiel für rbr #malaysiangp
451467397443362816	Negative	's selbstgespräche zur selbstbefriedigung *gnihihi* #albernertweet
457988189605883904	Negative	ist mumble tot oder komme nur ich nicht mehr rein irgendwas mit verweigert ^^
457815732244738048	Negative	und du fährst im spinnerbus mit protipp ganze fahrt schlafen
451309573828517888	Negative	_dicke_ was hab ich darauf schon gekotzt der ganzen vw bulli musste geputzt werden #teufelszeug
449882136192253953	Negative	die bei apple sagen auch dass es spots sind man sollte das nicht vergessen
435514223800889344	Negative	ko kaputt und fertig (@ homebase)
435408210653347840	Negative	deutsch ist ja ma so langweilig heute… (immer ^^ ) aber naja nur noch 25min ))
450033552147873792	Negative	rt okay so schlimm hab ichs mir nicht vorgestellt aus der mailbox von sie haben echt nerven usw http /…
449820219998224385	Negative	#rust #spoe #spö fordert im #kurier jeder wiener soll 2 sprachen sprechen da werden stammwähler problem haben auch gratis nachhilfe
457460480270143488	Negative	der mitbewohner ist mal wieder zu gut drauf nach dem aufstehen
457975748226461697	Negative	_ was den war ja nur ein vorschlag smiley
449570643085115392	Negative	vassilakou sollte bei grüner klausur neues wohnbauprogramm der stadt präsentieren mal schauen ob sp das lustig finden würde
457423366027108352	Negative	gold ist gift für die wirtschaft
457256296346300416	Negative	#arohrer bringts auf den punkt #faymann und #spindelegger sollten es mit ihrer eigenen entfesselung probieren
457283656248459264	Negative	weil sie ein idiot sind nun kucken sie nicht so das ist praktisch jeder #sherlock
457246823976280064	Negative	die rückkehr der achselhaare örrrgs
457122126546620416	Negative	bei asos gibt's so schöne bikinis aber es ist so blöd dass man den rückversand aus ö selber zahlen muss sad
449644681086128128	Negative	ist ernähre mich heute nur von schnaps und kippen
450305687214514176	Negative	der populist in mir (und in euch) via
450762591137464320	Negative	wo ist die garderobe bei der ich mein gehirn abgeben darf #asksonja
451799819653111808	Negative	ok also mit chrome benötigt die suche bei mir nicht so lang wie bei ihnen / ich weiß leider nicht woran es liegen kann /fi
457555887994175489	Negative	mach ruhig weiter diese rösner/lindner/bahr attitüde war bei der fdp schon sehr erfolgreich😜
449881881019187200	Negative	rt absurd republik haftet für kredite der baumarktkette baumax und alles unterliegt der amtsverschwiegenheit
451015562362372096	Negative	fdp herr lenders will schluss machen mit ökoschwindel in der landwirtschaft da weiß man wo man dran ist
435330000045092864	Negative	endstation athen wie miserabel flüchtlinge dort leben
435469542824095744	Negative	also ob irgendwer einen ganzen abend an so einer dose erdnüsse essen würde tz
450597823319666688	Negative	rt roman freigaßners inszenierung moussiert wie frisch gezapfter kindersekt #wtf
449585530343534593	Negative	da spricht das pure elend soviele themen hat die #oevp in den letzten 10 jahren nicht durchdiskutiert und entschieden
457990199021408257	Negative	traurig aber wahr selbst der antagonist aus cars 2 hat bessere beweggründe
449524823522553856	Negative	geht bei meiner frage nicht um die arbeitsrechte sondern ob es faktisch eine arbeit ist und ich bezweifle dass du das für dich
457180931603038208	Negative	tja doof gelaufen ne
451668398247002112	Negative	geh nicht deswegen outrage
458249471944847360	Negative	vül verkehr auf da a2 richtung wien #servicetweet
457653306664685568	Negative	mein name ist wolfe ich löse probleme problem willst du probleme nein ich löse probleme wir kaufen nichts *rumms*
457184977126686720	Negative	die zeit bringt es auf den punkt in diesem satz steckt das ganze elend der spd ``europa steht am scheideweg
457474968029106176	Negative	da geh ich nicht mehr hin die verlangen immer daß ich mir ein papiersackerl über den kopf zieh sad
435317699355635712	Negative	c++ mo bis fr von 9 bis 18 uhr ich will das nicht /o\
451729487068004353	Negative	rt _de hinten schläfrig vorne fahrlässig der hadert mit dem spiel bei #real #realbvb
449811679099252736	Negative	das erdöl kehrt zurück sad
450664279642214400	Negative	rt doppel sad “ sad rt der politikwissenschafter herbert gottweis ist 56 jährig gestorben
451275010397978624	Negative	der homophobe ceo von mozilla hält sich für die beste person auf dem posten das bringt sicher extra sympathiepunkte
458248879277084672	Negative	habe herrn schaffett angesprochen auf den aspekt grenzen erkennen und erweitern denn wir haben angst vor dem fremden
457820489181040640	Negative	existenzkrise bei facebook #facebook
458193104517201920	Negative	früher hab ich dem bushido immer die schuld gegeben ich dachte er wäre der kranke dabei kay
451067575469101056	Negative	rt meine strebsame studienkollegin hat auf ihrem organisierten computer einen ordner mit dem titel fun klingt wild
457768778936647680	Negative	überfall auf spielhalle pistolenmann macht keine beute
449553376549031936	Negative	heise forum gibt's das noch ist da noch was los
449596503762673664	Negative	rt mit allfälligem rücktritt von #mölzer möchte sich #uhbp #fischer nicht auseinandersetzen #hypoua gehe ihn nichts an …
435672975871070208	Negative	im park jogger anschauen und denken heute abend hetzt man sich selbst wieder so
435504494839726080	Negative	@_moppi_ kindisch ist doch das wort das unglückliche normalos für uns verwenden
458614013493272577	Negative	alte deutsche subs sind wirklich grauenhaft
451040633952935936	Negative	die tickets sind leider nicht übertragbar playful
451446226643607552	Negative	geben sie nicht auf bitte sad
449587880558882816	Negative	rt im krone frorum wirbt jemand für die arbeiterpartei mit arbeit macht frei foto
451829833085890561	Negative	ein rückzug des orf aus der co finanzierung österr filmproduktionen hätte katastrophale auswirkungen auf die
451597026237489152	Negative	lesen sie zb hier zu tun als sei das gegenteil der fall ist in der tat populismus
457805760291168256	Negative	sieht aus wie so ne raupe mit giftigen abstehenden haaren #fischgrätenzopf #alamama
458543283950850048	Negative	es geht mir um die tonalität man kann standpunkte auch ohne plakative negativbeispiele vertreten
