493720030761472000	Negative	@mefiblogger fél év szabi meg ilyenek. Alapbér megvonás, jogsibevonás, elbocsátás van.
493720747555426304	Negative	Basszus amikor nem kéri el az ember a beszélgetőpartnerek a mail címét #sysadminday
493720998068629505	Negative	A BVB is nyílt levélben üzent Schweinsteigernek:  "Kedes Bastian Schweinsteiger!  Ha valaki egy sikeres... http://t.co/9wPHRpcluY
493721508603527168	Negative	mindennap sírok amikor rájövök hogy tesom elvitte az osszes sminkemet
493721817027473408	Negative	@mefiblogger igazából ha a BKV elbocsátja akkor mindegy hogy vezethet-e buszt vagy sem, nem fogják felvenni sehová ilyen múlttal.
493721832298528768	Negative	Kommunikációban is csődöt mondott az U19-es labdarúgó válogatott... http://t.co/lSPCwgx5gT
493721902457061376	Negative	Helikopteres szívhullatós http://t.co/iq7qurrThU
493724681351233537	Negative	"Egy magas vérnyomás esetében sem keressük soha az okokat." Én kérek elnézést.
493724705443311616	Negative	egy szot mondanek: fos
493725174781706240	Negative	Miért nem mondtátok, hogy a munkahelyi orvosi vizsgálaton vércukorszintet is mérnek? Szegény-szegény ujjam... :(
493725287968800769	Negative	Citromsárgába borult az ország - Hir24 http://t.co/IgJUXFPlFt
493729886352064513	Negative	Azért, hogy nektek ne kelljen okádnotok, olvassátok és terjesszétek a Kidma által megosztott híreket és cikkeket.... http://t.co/xtQ50F5CkZ
493730154792112128	Negative	Épp Arrow maratonozunk itthon. A magyar szinkron felér egy katasztrófával, a nevek kiejtéséről már nem is beszélek... "Málkolm Merlin"
493730342982135808	Negative	Fizikailag inzultálta a Magyar Nemzet munkatársát Havasi Bertalan, a miniszterelnök közvetlen sajtósa Tusnádfürdőn. http://t.co/7m6dcrOW28
493730522758410240	Negative	@csakiistvan De mar feldugtad, szoval nincs gaz...
493732356403245056	Negative	Elkisertem a baratnomet nogyogyaszhoz, mar tenyleg olyanok vagyunk, mint egy boldog leszbi par!
493734709139365888	Negative	Nem jutnak el az illetékesek a maláj gép roncsaihoz http://t.co/WAFYSTLqdB
493736517152800768	Negative	@hubudibu viccelsz? Most jön a 13...:(
493736616692031488	Negative	@hubudibu de fogy a kávém és így minden nehezebb :(
493737184458182657	Negative	14.13 - emmahulyeseg: zsir: valogataskazi: meme916: a pillanat, amikor rájövök, hogy ma még nem ittam... http://t.co/xp2dhE3xVL
493737649484476416	Negative	@sportpotdom te jó ég! Ez horror!
493738837974470656	Negative	A késésről - így http://t.co/Nmphb8LjpD
493740172488364034	Negative	#Baleset Szigetszentmiklós - baleset: 51101 - baleset, baleset, lezárva http://t.co/p6i2fGTYdI
493740204663255040	Negative	Aztakurva, ennyi mellebeszelest…
493740814343098368	Negative	Per pillanat egy nagy kaki a tumblr úgyhogy inkább sorozatot nézek 📺
493741479534530560	Negative	egy vizilabdas jatek sincs pc-re, egy c64-eset talaltam osszvissz meg egy ultragagyit ios-re. :(
493742114141114368	Negative	tegnap ellopták a telefonomat, felírom akkor a működő bringa mellé, hogy mit kérek a sorstól vissza.  -"kettő" - mondta joe.
493742668762349568	Negative	Tök happy, mikor a vénasszonyok próbálnak egymásra licitálni, hogy kinek halt meg több gyereke.
493743244782874624	Negative	Egyre többször bugzik a wunderlist szinkron Chrome-ban :-(
493743501029695489	Negative	Stalker krónika I. – elhagyott kórházak http://t.co/lyfIFQ6cDa http://t.co/mD9KwKiivm
493744266502758400	Negative	Inez a kis mixünk nagyon félős, nem ismeri a simogatást, össze van a kis lelke törve. Hosszú rehabilitáció vár... http://t.co/rdI7024KIO
493744410212175873	Negative	Ritkàn mobdok ki olyat, amit nem úgy gondolok. Jóó ritkàn!
493744612494675968	Negative	fogalmam sincs mit csinálnék a fény nélkül. fogalmam sincs mihez kezdenék, ha nem lennének kamerák. szeretném,... http://t.co/oSlFqnD5uj
493745022626709505	Negative	ELVESZETT! http://t.co/oyWXfabLRQ
493750348981735424	Negative	@pozzone pls nincs pénzem wowra
493751385289400320	Negative	A főpolgármester állítólag nem igazán örült a fővárosi önkormányzati választások reformjának, és személyesen... http://t.co/8KIpmmzp1W
493751485143191552	Negative	@chiliscsokolade @CharlotteLesko ugye? Én is nézem h nem most ballagott szoval valószínűleg már gimis . Hát nagyon beneztem
493753393278885889	Negative	RT @ndavid42: tudjátok hogy hívják a gyilkos és emberevő kézirat elbíráló szakértőt?  Hannibal Lektor :(((((
493757644977741827	Negative	Elhunyt Dobos László Kossuth-díjas író http://t.co/5r59FBWmN9
493757783939223552	Negative	Újabb dizájnerdrog került  A dizájnerdrogok viszonylagos olcsóságuk mellett rendkívül gyorsan bukkannak fel újabb... http://t.co/d5nzztZVTZ
493758824075911169	Negative	​Miért nem csinálhat Orbán Putyinisztánt Magyarországból? http://t.co/pgnBJhPjgT
493761202971889664	Negative	"A rendőrök a polgárdi férfival szemben szexuális szolgáltatásra való felhívás tilalmának megszegése miatt helyszíni bírságot szabtak ki..."
493761506086252544	Negative	Éééééés ma is elfelejtettem enni. #éhes #szerezzvalamikaját #nemtudoméletbentartanimagam
493762151669334016	Negative	aktivitásaim: - munka: 10 % - egyéb: 90 % #hatefő
493762779182948353	Negative	Borzasztó hírt kaptunk  bár korábban az állapota jelentősen javult, illetve az agykamra tágulata csökkent, ma... http://t.co/GV2kzR1Nkg
493767311338135552	Negative	#Baleset Perkupa - baleset: 27 - baleset, enyhülo forgalom, baleseti helyszínelés, balesetveszély http://t.co/0zjBroOJsm
493768979765137408	Negative	Hazudozással vádolják Orbánt http://t.co/5lld27Bx3i
493771288151076865	Negative	@CharlotteLesko hat janos haragudni fog
493773054624153600	Negative	@Magicc210 tudom csak picit rossz
493773891719168002	Negative	@g96isti apa megszüntette a 240-es netet. 😶
493775775561048064	Negative	Közölték hogy a szintre költözik az online marketing mindenkinek ilyen feje volt *___* mmm csajok. Ehhez képest amilyen arcok jöttek... :/
493778950511136768	Negative	Öt tanév alatt 17 ezerrel kevesebb középiskolai jelentkező. http://t.co/bPd0HCbdAi
493782647433613312	Negative	Szomorú olvasmány...... http://t.co/kqtwBq2VHl
493783485694636032	Negative	"Jónak már nyoma sincs Magas lett a fal"! .
493784194594922496	Negative	nemmmmm en ma semmit nem akarok csak fetrengeni #hiszti
493784745432875008	Negative	Imádom ezeket a "művészien" túl filterezett, fekete fehér vagy szépia képeket... FUCK THAT SHIT!
493786669049315328	Negative	Rászálltak a kínai hatóságok a Microsoftra: Megszállták a Microsoft irodáit Kína négy… http://t.co/4RkVNrQq7D
493787175524499456	Negative	Baleset történt a XXII. kerületi Tájkép utcában, ezért a 135-ös busz mindkét irányban módosított útvonalon, a... http://t.co/1Ehq0EcXQq
493788249455079424	Negative	"NGM egy megbeszélést szeretne összehívni, amin szeretnék megvitatni a pénztárgépek szoftvereivel kapcsolatos problémákat." időben, bzmg.
493788589000777728	Negative	@g96isti AZERT MERT ELKÖLTÖZÖK!!4!4! (meg amugy is csak 1 hónapban egyszer volt max 230:( )
493788717874548736	Negative	leszek a szem, amibe belehazudsz..
493789992406499328	Negative	Elhunyt Remsey Flóra textilművész http://t.co/DatyT6LBKm
493791352929656833	Negative	nemaaar :-[ levagta a kutyajat ea eladta disznohuskent .... a fejet es a boret megtalaltak a rendorok az udvaron :-[  hogy lehet ilyet tenni
493791569263468544	Negative	gusztustalan emberek vannak a vilagon ... az ilyeneknek kene a halalbuntetes
493792008822345728	Negative	@Lali_21_ szarok bele ... abbol a 20%bol pedig 10% mamiatt kaphatna a halalbuntetest .. nem maradnank sokan
493794201801617408	Negative	Július 29-én 255 éve hunyt el ÅRVA BETHLEN KATA írónő. Jeles család sarja volt, apja küküllői főispánként nagy... http://t.co/dksTqq9Yi6
493796375097012224	Negative	Esernyő nélkül már ne indulj sehova. Jelenleg 22°C van s Budapest egyes részein már esik.
493796980146311170	Negative	Július 29-én 40 éve halott MAMA CASS. Volt egyszer egy zenekar, egyenesen hippiálom - Mamas and Papas-nak hívták... http://t.co/WciotLQn7l
493797070395170816	Negative	Necsináld… “@beny9512: RT @Home_X: ómájgád RT @fmark_mark: az korrekt... http://t.co/bD5nqlPZv1”
493798118895276032	Negative	Halálközeli élmény a 18. században http://t.co/jp3JqKNmGT via @feedly
493799991191031808	Negative	"Én egy végtelenségig türelmes ember voltam."
493801207191048193	Negative	@Inzume hát, lusta az összes fordító... szóval azt várhatjuk :((((((((((
493802840293642240	Negative	RT @_cattitude_: "annak van a legkonnyebb dolga a munkaeropiacon, aki keresett szakmaval rendelkezik" a Tenyekben ma is megmondtak a tutit
493803164337192960	Negative	Két hete 110 milliárdos zárolást jelentettek be. Most pedig... http://t.co/NvZtqEs8UK
493803646887284736	Negative	Az iraki hadsereg a lázadók állásait bombázta - http://t.co/n9xNLhI78g
493803700612509696	Negative	Egymásnak esett a Magyar Nemzet és Orbán Viktor sajtósa. A lap állítja: Havasi Bertalan fizikailag inzultálta... http://t.co/Ii8yJiLPnt
493803827339210752	Negative	@chetory mikor legutobb voltam, csak mersekelten sokan voltak :/
493804094944198656	Negative	Itt meg fel oraja bezart a nemzetkozi :/ #eletem (@ Déli pályaudvar w/ 11 others) http://t.co/UsAqw21Q6n
493804259163770880	Negative	RT @QFPinfo: Nos, ma el lett temetve a demokrácia, közlöm. Ez lesz holnaptól, készüljünk fel. Orbán megmondta. - Vezérlő... http://t.co/WZ3…
493805355076681728	Negative	Kíméletlenül folytatja a Fidesz-kabinet a évi százmilliárdos pluszkiadást jelentő rezsicsökkentést. http://t.co/JchpiZOUsa
493808028840656896	Negative	"Magyarországon a sajtószabadság addig tart, amíg Lázár János nem lesz szomorú" - (via orulunkvincent) Da.... http://t.co/Gfcz8Xda3d
493809411568451584	Negative	Kitaláltam egy epic magyar címet a 2x03-nak, erre elfelejtettem. -.-
493811088392466433	Negative	@Inzume Majd lesz rajongói szinkron :((((((((
493813564239806464	Negative	nem ertem
493815776525434880	Negative	Ha nem autóra, hanem egy robogóra vágyik http://t.co/S6rc9xTZz5
493815941470621696	Negative	akkor most kérek mindenkitől elnézést, akit kéretlen üzenetekkel halmoztam el :(
493817246687723520	Negative	nem mindenkinek barátja a Google. http://t.co/1JrsL6EjUq
493817777053270016	Negative	@kedves_vezeto "Akasszátok föl a királyokat!" - Petőfi Sándor
493818077277351936	Negative	még mindig idegesít olivér része ahogy elbaszták
493818240930701312	Negative	hianyoznak az emberek :-[  foleg Bazsiek , de penteken talalkozunk , megyunk bulizni Csengehez
493819120140713984	Negative	@ZotoWitch hat jo lett volna, de akkor nem megyek kedden
493819264160522240	Negative	285 devizahiteles peres eljárást függesztettek fel ma soron kívül http://t.co/HIOvKaOJTp
493820608304918529	Negative	ha ma se ir visszaeskuszom hulyet kapok ....
493821214474113026	Negative	a posztok, amik pár év után törlésre kerülnek
493823629747302401	Negative	RTL Hírek: Hat év alatt összesen 23 évet késett a MÁV http://t.co/2pFwxGQhxK
493825617675436032	Negative	uuuugy elmondanam neki is hogy hianyzik , de kurvara le se szarna ....
493830169522896898	Negative	@fuggoo ne már, hogy lesz harmadik rész….
493830545730985984	Negative	Fürdetés után közvetlenül pelenkázóasztalról lepisilés achievment unlocked.
493831612900335616	Negative	Nah, Noir gazdikereső stádiumba lépett. Sajnos, nem tökéletes a gyerek, ezért szeretnénk olyan helyre adni,... http://t.co/gwoBQFJ4GF
493832403694395392	Negative	Itt van, erről beszélgetünk évek óta, de stadion az köll, állami pénzből. Kisfaxom.. Ez a mérkőzésenként 1000... http://t.co/9NXpHeiSmy
493832915856277504	Negative	Orbán ezt benézte. http://t.co/V4vh1TkJl2
493833832437940226	Negative	apámék gépének lassan lekéne szállniuk, de még el sem indult londonból, mert ferihegynél állítólag szar az idő...
493834975062794240	Negative	https://t.co/myCFuemIjf – szemmel láthatólag a 3. Hobbit is ugyanolyan kurvaronda lesz mint az első kettő
493835423626854400	Negative	RT @gklka: Az iOS 8 annyira király, hogy neki már a deprecation fázisokat sem kell kivárnia, egyszerűen egyből nem megy néhány függvény, jee
493836049047883776	Negative	@briangatwood köszi az infót, "jó tudni", hogy nem csak mi vagyunk ennyire pórul járva
493836748754272256	Negative	Ezekben a percekben hozták nyilvánosságra, hogy egy alagúton keresztül terroristák törtek be Izraelbe. 5 izraeli... http://t.co/uRAAYnYE3f
493836892467900416	Negative	Annyira fáradt vagyok.  De nem fizikailag
493837821871149057	Negative	RT @RTL_Klub: RTL Hírek: Hat év alatt összesen 23 évet késett a MÁV http://t.co/2pFwxGQhxK
493838115275292673	Negative	mindjart atmegyek a Tibihez es kap tolem egy olyan pofont amekkorat megerdemel
493838186200969218	Negative	tweetbot 3 ipaden, iphonra meg kene vennem megint. ezt meg hogy kepzelik?
493838812494462977	Negative	@cinnamonboi nekem iszonyú volt látni, nagy törés volt számomra (is) :(
493839349604425728	Negative	szanalmas vagyok .. itt sirankozom nektek , es kozben ez senkit nem erdekel
493840242617880576	Negative	Tuti hogy krisztiannak amputalni kellet az egyik labat
493842192021352448	Negative	A Sin City a 300 nyomában, erőtlen folytatást kiizzadva jelentkezik http://t.co/17EMUTzCzO
493844673690357760	Negative	"Személyi sérüléssel járó balesetet okoz annak következtében, ahogy a járművét vezeti, majd ezt észre sem veszi,... http://t.co/fW4RBs4wze
493846431309258752	Negative	Sajt, sör, miért ilyen elbaszott helyre születtem, ahol ezekből pont nincs? jó, tudom, kézműves, de én csak úgy a polcról akarom lekapni
493849288846606336	Negative	​A hely, ahol ingyen teniszezhet Orbán Viktor államférfi http://t.co/WakWzN5icL
493851696989478913	Negative	Menekülnek a jobboldalon Orbán szavainak értelmezése elől - sronti: kgyst: borcsok: Csak egy jobboldali... http://t.co/ploSFcIehS
493852062099468290	Negative	Beázás, nav-levél, jó újra itthon...
493852470649831424	Negative	Orbán megcsókolja saját seggét http://t.co/roZqeJsdK2
493853192703475712	Negative	Vége... http://t.co/gys00gJror
493853544521687040	Negative	@Jamsheed91 nyilván nem, hibázhattak is. Azt már megszokhattuk, hogy Messi minden szempontból más lapra tartozik mint bárki más.
493854029865558016	Negative	@deinoerd @mrscottpilgrim de nincs adás már hetek óta...
493855257093734400	Negative	Nem igaz, hogy találtam a zoknimban egy fenyőtüskét.. ezektől sose fogok megszabadulni?!
493855424425119744	Negative	Brüsszel szerint nagy veszélyben van a magyar sajtó http://t.co/tihNe6yd1f
493855598715232258	Negative	168 Óra Online - A kényszermunka országa http://t.co/LkcfsLnFcv
493855823010209792	Negative	Dr Janus a kínai faszi??? Obaz... Nem, fordítvaaa!!! Ehh... #SouthPark
493856603880570880	Negative	Meg fog őrülni a nyestünk: betettem egy kis rádiót az autó motorterébe, ahol kedvesen, a belső szigetelés... http://t.co/QyOv4FoKyt
493857835198193665	Negative	@gklka Vicces hogy mindig kiírják hogy "from the director of…" Mintha mentegetnék, hogy "jó jó tudjuk hogy sz*r de látod ki rendezte"
493858158914584576	Negative	@barichan úristen, hova fajult ez a világ? mert aztán történelemből tényleg annyi minden történt azóta
493859633774460928	Negative	nem szeretem mikor anyu ilyen sokaig itthon ven , mert akkor egy ido utan megkattan ...
493860420089020416	Negative	megint leálltam szerepezést írni, mikor egyáltalán nem azt kéne x__x
493861546335170560	Negative	miért van az, hogy a rossz dolgokra jobban emlékszünk, mint a jókra? :( #napiköltőikérdés
493863800744202240	Negative	Bogyesz meg megint lelepett ithonrol .. :-[
493864835441242112	Negative	Aztán meg múltkor megtaláltam azt a bárt ahol az itallapon volt Sambuca... hát nyilván nem volt! Egy csepp se!!!
493865879373754368	Negative	Király dolog ez a hegedű, korábban kellett volna elkezdenem tanulni. Egy tanárt sem ártana keresni. #hegedű
493868617298350081	Negative	@gulyas_adam megártott a sok shake
493868703021551617	Negative	@Szabo90Szabo mire befizetsz, én fittebb leszek mint Tigris a Micimackóból :D
493870520207962112	Negative	Baszki holnap még csak kedd... :(
493871077685460992	Negative	13 evesen cigivel a szadba pozol es liter szamra pialsz Gratulalok✋👏👏
493873485819965440	Negative	Lehet, hogy nem volt jo otlet kint hagyni a ruhakat ma reggel az erkelyen...
493875832973447168	Negative	es meg a kislabujjam is bevertem az asztal lababa :((((
493876227854585856	Negative	RT @chiliscsokolade: Apaval sutit sutunk  Csak halkan anya ne keljen fel Odavagom a izet a szekrenyhez,bevagom a hutoajtot,levagok egy dobo…
493879102462787584	Negative	Hihetetlen... Azert nem tudok aludni, mert nem ertem a passé composé visszahato igekkel tuzdelt mondatait. Grrrr... https://t.co/BwjTzXGNFx
493885646520324096	Negative	Gondban a Lions. Nem sikerült megegyezni Ndamakong Suh-hal, így a csapat jövőre könnyen elveszítheti a... http://t.co/I61OKE6hJE
493886241642139648	Negative	Ilyenkor miért nincs semmi nézhető a tv-ben? :(
493893272931422208	Negative	tapsot érdemelnek emberek akik netes társkeresőről ismerkednek. bátor. modern.
493903928225177600	Negative	kene mar az az 1ooo kovetoo :-[
493917872440098819	Negative	@szolnokinelli akkor hogy tudunk beszélni ha nem követsz? :(
493918244374212608	Negative	@szolnokinelli de nem tudunk szabadon beszélni,mert mindenki tud olvasni :((((
493921821750595586	Negative	amikor valaki ír neked és ilyenkor szoktál vele beszélni. és nem ő  szopás.
493949422074888193	Negative	Esernyő nélkül már ne indulj sehova. Jelenleg 18°C van s Budapest egyes részein már esik.
493960259653103617	Negative	A tegnapi úton lehet, hogy sok volt a légkondi, picit fáj a torkom. :( Sok pálinkát kell innom, hogy rendbejöjjön, mert hétfőtöl szabi #fb
493972282591952896	Negative	Fizikai fájdalmat okoz, hogy Cher Lloyd új albuma május 23-án jött ki és tegnap vettem észre. Ami ráadásul a szülinapom! 😰 #zenefüggő
493977208721903617	Negative	Megbuktak a szaúdi férfiak a párkapcsolati piacon- már saját asszonyaiknak se kellenek http://t.co/L8ReU86Fkj
493979853369401344	Negative	@alie404 a BSG zse-ni-á-lis és egy napon említeni a SGU-val súlyosan büntetendő! :O
493984205123383297	Negative	nem aludtam se sokat, se jol, erre anyam bejon es szekeres Adriennt boget kurva hangosan a fejhallgatojan keresztul #kurvaelet
493988052642320384	Negative	"A feleségem ötven méterről is észrevesz egy szőke hajszálat a kabátomon, de parkolás közben mindig nekifarol a garázsajtónak."
493988952672845825	Negative	Belémrúg, ramnéz és annyit sem mondd, h bocsánat... Utálom az embereket -.-
493990061730705408	Negative	[4-es, 6-os villamos] 4-es, 6-os villamos Oktogon M és Széll Kálmán tér M között nem közlekedik, a kimaradt szakaszon http://t.co/riyItylBKa
493990341700091904	Negative	Az Oktogon M és a Széll Kálmán tér M között pótlóbusz jár a 4-es és a 6-os villamos helyett, egy meghibásodott... http://t.co/vsXB0OiBTI
493993339931226113	Negative	Elképesztő mennyiségű víz tűnt el a Coloradóból - Origo http://t.co/CllQ0SBNY4
493994095296380928	Negative	Még egy nyomorult Martin Garrix nóta és megmártom a kedvenc ismerősöm arccal egy mocsárban...nem bííírom mán
493994309931520000	Negative	Most éppen jár de szakaszosan... #bkvlive jászai oktogon között nincs.
493995970544152576	Negative	A Hortobágyot kettészelő 33-as út túloldalán is megjelent a lépfene. A gazda szerint állatai nem érintkeztek az... http://t.co/AK9AW22ZSW
493997188511719424	Negative	Szar időben milyen is lehetne http://t.co/VXkhm3gR3j
494000189225840640	Negative	Low-end Lumiával alázzák az Apple csúcskészülékét http://t.co/N91X7gcbdB
494000332934897664	Negative	RT @bruzsy: Aki ez után a videó után képes azt mondani, h a Lost elvett az életéből akár egy másodpercet is, AZ EGY FASZ. http://t.co/xafUx…
494002435997044736	Negative	@dude75 abból nekem mindig bőgés van
494004831703818240	Negative	@egyetlenniki az hagyjan de nalam teljesen befagyott, nem tolt be es allandoan olvasatlan + ott az egyes is 😩
494006467675320320	Negative	@_c41 @egyetlenniki szomoru, lemaradsz csodas eletunk megcsodasabb kepeirol :( (de en mar nem is szoktam kuldeni neked ezert)
494006883502817280	Negative	Photo: soha ennél rosszabb reggelt!!!!! http://t.co/NK82vN0DyW
494007151850184704	Negative	@_c41 de ennek mi a franc ertelme van? ocsmany is raadasul :(
494007339276451841	Negative	Samsung Z – a premier elnapolva: A dél-koreai vállalat törölte a moszkvai fejlesztői konferenciáját és ezzel e... http://t.co/svexRKIno7
494008726635151360	Negative	@nyussziful az ilyen guess jatekok lenyege, hogy a buta fasz buszke magara, ha kitalalja, hogy _im _arrey az jim carrey es nem tom hanks.
494011083036688385	Negative	#ki Áramszünet az OSZK-ban a hét második felében http://t.co/L8U1uqB9EY
494012144967766016	Negative	Upsz, elkések....
494012259463876608	Negative	Nem az a durva, hogy van egy film, ami égből potyogó cápákról szól... hanem, hogy jön a 2. része is! D: http://t.co/8JxP3jgGA9
494013053600804864	Negative	@xab83 jo hát vannak emberek akik BKV-val járnak szóval én már semmin se csodálkozom.
494014215188127744	Negative	[153-as autóbusz] 153-as autóbusz Neumann János utca és Gazdagréti tér között megnövekedett menetidővel közlekedik. 0 http://t.co/9Kj6wS6h0c
494015606354489345	Negative	Volt, aki nem mert eljönni a bloggertalálkozóra http://t.co/yyRcHyEmad via @feedly
494016823848091649	Negative	Jól megszopatta a magyarokat a Facebook, most megszopatja az egész világot! http://t.co/eXeyneYKre
494016975316606977	Negative	#Almalap blog: Aki baltával megy neki... http://t.co/vAUCwGBQqK
494017281647996928	Negative	Magyar vállalatokat is érintenek az oroszokkal szembeni szankciók http://t.co/bA2mJ9pbPb
494017663090565120	Negative	@0kgy sajnos ez az AirRouter most bukott el: 150Mbit WiFi-n nem fog átmenni a 100Mbit-es internetem. :(
494017695562891264	Negative	@pancakespeedy @Godem @csibeagy azért csináltuk a különböző szűrési opciókat hogy használják az emberek, aki béna az így járt
494018004938940416	Negative	A vádlottat 14 évnél fiatalabb gyerekek sérelmére elkövetett ötrendbeli bűntett terhelte. http://t.co/MMNt3ICkLO
494021140617379840	Negative	Móricz Zsigmond körtér, aluljáró: várakozik egy tinédzserlány, apró tréningsortban, az a típus, amelyik egyik pillanatról a másikra eltűnik.
494021351196602368	Negative	Tudod mit, facebook? Akkor a k..va anyádat!
494021453529243648	Negative	Az Orbán-kormány és az offshore-miniszter http://t.co/3cnUXOZlMb
494022197300985856	Negative	Szuperhülye táblák Veszprémből http://t.co/vQ3vvHuOXw #streetart #veszprém #Hungary http://t.co/OE4AtGLf90
494022687937662976	Negative	Kivégeztek egy ugandai kábítószercsempészt Kínában  http://t.co/7FQx38kyOx
494023137475194880	Negative	RT @szucsitg: Fire level BKV RT @ezme1914: Széll Kálmán és oktogon között nincs 4-6-os, mivel KIGYULLADT.
494023410494603265	Negative	A gyermekfüggő nyugdíj margójára... http://t.co/2ZGjhjGv2q
494023450017947648	Negative	A tegnap esti görkorizás margójára: ku-u-u-u-u-u-u-u-u-u-u-ur-vá-á-á-á-á-á-á-á-ra-a-a-a-a-a rá-á-á-á-z a ma-a-a-cska-a-a-a-kő-ő-ő-ő
494023804339773441	Negative	mi ez az idő, most már tényleg
494024019612426240	Negative	#Torlódás Budapest - torlódás, átlagsebesség 10 km/h: József Attila utca: Roosevelt tér -&gt; Bajcsy-Zsilinszky ú... http://t.co/l2g06IcZzj
494024108984655873	Negative	Menekülnek Líbiából az európaiak  http://t.co/8t354pDi8W
494024221002317824	Negative	RT @szucsitg: Fire level BKV RT @ezme1914: Széll Kálmán és oktogon között nincs 4-6-os, mivel KIGYULLADT.
494025414701232128	Negative	212-es buszra varni idegtepobb elmeny, mint Kolumbusznak lehetett athajozni az oceant
494025646750724096	Negative	Egy ragadozó átharapta a lány lábát! http://t.co/aOwV91Da80
494026650615824384	Negative	Ez komoly, bazmeg, hogy a BKV szép új honlapján már egy link sincs a menetrendekre? http://t.co/yadu9Tpd8b (tudom, @bkkbudapest meg minden)
494027377350283264	Negative	91% páratartalom #sírok
494027656107929600	Negative	Kedves vásárlónk! Felhívjuk figyelmed, hogy technikai okok miatt 2014.08.09.-én szombaton,  várhatóan csak... http://t.co/xvcVSBNOR7
494028709285072896	Negative	RT @szcsaba: Tudod mit, facebook? Akkor a k..va anyádat!
494029281329430528	Negative	Balázs: Következményei lesznek az Orbán-beszédnek http://t.co/A6UuQRa5oi
494029674046291968	Negative	Amikor a to-do listen fent van, hogy végezni a mai to-do listtel akkor a tennivalók kígyója a sajàt farkàba harap.
494031135798616064	Negative	ELHAGYOTT VASSZÖRNYEK, A CCCP HAGYATÉK! | Made in CCCP http://t.co/ggoRVulVNv
494031548329771008	Negative	Az adataikat felhasználva ad ajánlatokat a Cortana http://t.co/2Q0blY3TdH
494032324216897539	Negative	Nincsnalamesernyojaj
494034486678392832	Negative	Így nyúlják le a pénzt a bankkártyádról, pillanatok alatt + fotók http://t.co/2rHXmFknlW
494035510462251008	Negative	@idavid_hu nem ad vissza ezernél többet.
494038164861091840	Negative	Ami biztosan tudható, jelenleg meglehetősen siralmas képet nyújt a magyarországi nyugdíjasok helyzete. http://t.co/27FdVYZQvS
494038471280168960	Negative	Szokasos napi melo... Mar megint csak a malmozas megy. (@ Airport City Logisztikai Park) http://t.co/tcCsEhjnyh
494038719704625152	Negative	Elmondom milyen idő lesz ma: rohadt meleg, mert hosszú nadrágban jöttem.
