489260019175919616	Negative	Szomorú vasárnap http://t.co/82GVOytO7K
489273442735489024	Negative	DAGONYA 50 EZERÉRT! http://t.co/KWxRs3OQlj
489282740530196480	Negative	A magyarok 64 százaléka a munkanélküliséget sorolja az ország három legnagyobb problémája közé.
489282949029036032	Negative	56%-nyian tartják aggasztónak a szegénységet, a szociális egyenlőtlenséget és 46% említette a legjelentősebb gondok sorában a korrupciót.
489283208975241216	Negative	Ezt követően a bűnözés és az egészségügyi helyzet iránti aggodalmak fogalmazódnak meg a magyar lakosságban.
489284300425420801	Negative	[4-es, 6-os villamos] 4-es, 6-os villamos Jászai Mari tér és Széll Kálmán tér M között nem közlekedik, a kimaradt sza http://t.co/tINUmcr9wO
489288640611491841	Negative	EZ KÉPTELENSÉG! JAPÁNBAN WC-KIÁLLÍTÁS IS VAN! http://t.co/folcTERLcT
489289226912272385	Negative	Valaki hazudik Orbánról http://t.co/IGbw1UVbaT
489291639295574016	Negative	RT @IpsosHU: A magyarok 64 százaléka a munkanélküliséget sorolja az ország három legnagyobb problémája közé.
489292991744323584	Negative	Halmozódik a szemét a tunéziai Dzserba szigetén   http://t.co/l9eyKFNNPY
489293209218981890	Negative	A részeg Pistoriust kidobták egy diszkóból  http://t.co/ARUqjpkgfo
489293685696516096	Negative	a nagymamám kórházba került, és alig tud magáról, nekem meg a szívem szakad meg
489296564901642240	Negative	Nem akarok pánikot kelteni, de túl vagyunk a nyár felén.
489301543787954179	Negative	@illmatic_baby hat aterzem, nem voltam mindig szerencses :c
489301717608321025	Negative	% eszre magat :/
489301944184213506	Negative	Gáspár kálváriája elkerülhető. Tóta W. Árpád írása. http://t.co/eUGp5a5zlv
489302134387515393	Negative	Pedig az a kisebb kár, amikor nem. http://t.co/rqDUJOtuLc
491499326062202880	Negative	Oké. Befejezem. Most. Azt a. Tetves. Fejezetet. Ha beledöglök is.
491500723008729088	Negative	"nem vagy faradt?" A NEM DEHOGY 12 ORA EJSZAKAZAS UTAN UGYANMAR
491501562586730496	Negative	A háború apoteózisa
491502362196860929	Negative	Eladtam a dobomat. Időszerű és jó döntés volt, de attól még szarul esik, 14 éve nem voltam dob nélkül. :(
491503021374058496	Negative	Hmm, csak 4-5 percet késett a vonat (@ Déli pályaudvar w/ 4 others) https://t.co/CSpbgFO3dA
491505190907150336	Negative	[59-es villamos] 59-es villamos Farkasréti temető és Márton Áron tér között nem közlekedik. 07/22 10:48:19 http://t.co/RJhrhbIQFl
491505929477980160	Negative	@jugaroni erre bezzeg van pénz!
491507204030484480	Negative	@stocking alkoholt ekkora "sebre" nem tennek :\
491508197354917888	Negative	Gyerekként érte a tragédia! A magyar énekesnő egymás után vesztette el a szüleit | femina.hu http://t.co/naWtWDPapq
491509832210722817	Negative	Kedves vett a manónak un. fordulásgátló párnát, ami úgy néz ki, mint egy tégla. Először én basztam le érte, aztán meg a szülésznő.
491510247773974528	Negative	@bepsiboi hat mar kitagult, csak most vettem eszre, ahogy kivettem a csigat, hogy bedagadt :\
491510824125861889	Negative	Egyetlen fillér sem jött április óta Brüsszelből - !!444!!! http://t.co/H2BR8f2V1y
491510841095634945	Negative	Egyetlen fillér sem jött április óta Brüsszelből http://t.co/iy1m0PG2Jj
491511174102810624	Negative	utálom. nagyon utálom. utálom, hogy érzéseket vált ki belőlem. utálom, hogy ha neki jó, nekem is. utálom,... http://t.co/7dMHy8Tssv
491512725496139776	Negative	Sokan nem tudnak félretenni gyermekeik jövőjére - zsir: borcsok: A válaszadók közel fele már most... http://t.co/jbS6Hu78fb
491514573561004033	Negative	A magyar gép, amit talán szintén lelőttek - !!444!!! http://t.co/NDlQkWmS27
491515098075131904	Negative	Újabb iPhone (6) fika a Samsungtól http://t.co/Scb1a8evoa http://t.co/BFiSgDgX96
491515305256951809	Negative	Baj lehet a szabadságolásból - mindenkinek ki kell venni, ami jár http://t.co/7UkUzjIbQu
491515495695151104	Negative	A magyar gép, amit talán szintén lelőttek http://t.co/pb9eLsbJri
491515547524141057	Negative	Bevándorlók fulladtak a tengerbe az olasz partoknál http://t.co/9PGkHeOUQU
491515596924674049	Negative	Kongói lázadók pere Dél-Afrikában http://t.co/9Wk4uDJEx5
491515652017225728	Negative	Így nem lehet dolgozni.... http://t.co/acNEE4xMlT
491515701073432578	Negative	Bezárták a dzsihádra buzdító mecseteket Tunéziában http://t.co/oNW2pYpBda
491516258668781568	Negative	az a rohadt nagy baj velem hogy túl korán beleélem magam mindenbe http://t.co/EszMDVOSih
491516393775697920	Negative	megettem alvas elott egy labos tojaslevest hivjatok a sirasot
491516468367212544	Negative	Ügyfélszolgálati irodánk elköltözik!  2014.07.25-én pénteken költözés miatt az ügyfélszolgálat zárva tart, nyitás... http://t.co/QXNYeKs7qQ
491519859260653569	Negative	@_fega_ :/ jobbulást
491519991662247936	Negative	Nincs kegyelem, az internet kalandorai a tragédiák idején sem állnak le http://t.co/0FhqxKzai1
491520951507763200	Negative	@FeherAnna_ Anthony, kérlek, nagyon fàj hogy elveszítettem Harryt.
491521742293446656	Negative	Sajnos úgy fest, hogy a Samsungtól már monitort sem ajánlott venni.
491524163538939904	Negative	Másfél évet adtak az olaszok a Google-nak: A franciák után az olaszok is elmeszelték a… http://t.co/kh7UyT0G99
491525080095027200	Negative	Egy óra, ami azt mutatja, mikor hullott Izraelre az utolsó rakéta.  Hátborzongató...... http://t.co/wgPwHbGKnZ
491525172152008704	Negative	@giivk először magukat csapják be, hogy aztán őszintén hülyíthessenek.
491525367262613504	Negative	@eszement Audacity (free). De ntfs legyen a partíció, különben 2GB-nál megszívtad.
491525605373259776	Negative	A rossz időre való tekintettel ma 16:00-tól nyitunk! Megértéseteket köszönjük!
491525688156250112	Negative	http://t.co/G4noTMYH7b - roppant kellemetlen, de majd biztos megmagyarázzák, hogy ez a felhasználó biztonsága miatt szükséges.
491526972258787328	Negative	Egy tragédia, amely talán elkerülhető lett volna: miközben családja itthon a biztosítóval hadakozott, elhunyt a... http://t.co/jsoKqMk733
491527587756507136	Negative	Hamasz minden lehetséges eszköz bevet, hogy gyilkoljon:   * Robbanóanyaggal megtöltött övvel felszerelkezett... http://t.co/p3CbIfxflf
491528367192420352	Negative	Ha tisztességesen köszönök a felnőtteknek, miért nem képesek legalább annyit odanyögni, hogy 'lófasz' ? http://t.co/cXxFsq64QW
491528883498668032	Negative	Nagy elmeny szandalban, pant nelkuli felsoben es miniszoknyaban a szakado eso #nem #azottkutya
491529014574477312	Negative	Putyin ismét hazudott. RosszPutyin :( http://t.co/ZJ5DDn9t65
491530039251697666	Negative	Hoppá, fake a reggeli cikkünkben közzétett videó! http://t.co/3niblw9Vj2
491530512134324224	Negative	Hate toplist: 1. cigizés liftben, 2. csikk kikúrása autóból forgalomban, és az új: 3. szotyizás liftben. Emberek, mi a fasz van veletek?
491531988592250880	Negative	- mennyibe kerül a felvágott dániában? - nem tudom, mert nem veszünk, mert drága. anyám érvel, miért itthonról küldet magának szalámit...
491532326330191872	Negative	garanciális ügyintézések hete úgy tűnik... előbb az iphone most meg az órám :S
491532617461022720	Negative	Körözött magyart kaptak el Thaiföldön http://t.co/vf0xN9ChS0
491534929214586880	Negative	a Pécsi Megyei Kórházban a nővérek olyan undorítóan viselkednek a betegekkel, hogy az összeset jól arcon kéne rúgni. #fact
491535236774498304	Negative	Kiderült: Hamilton fájós háttal lett 3. - de végül milyen fékeket is használt a Mercedes a versenyen? http://t.co/mPY2LVwUFf
491535649171079168	Negative	Àtbaszások és csalódások...remek
491535705873842176	Negative	@sziszko máglyára az összessel
491536496885633024	Negative	És a 444.hu folytatja, kitartóan, koncepciózusan: "Kórházat lőttek az izraeliek Gáza mellett". Ilyenek ezek, na. Alighanem a vérükben van.
491541146917941248	Negative	Eltüntetnek a bankok, de az is elképzelhető hogy nem... hát ti is sokat mondtatok... vagy nem http://t.co/ixhDiJVS6P
491542061829853184	Negative	mert miből állna az Instapapert beépíteni?! https://t.co/YeGionrN5c
491542246940889088	Negative	Elsüllyedt egy menekülthajó Lampedusánál, közel 200 halott  http://t.co/m1psAXu2ON
491543162029367297	Negative	@noee_mii sajnos tud ilyet. :( huzattól és hideg vizes "borogatástól" is
491544466059427841	Negative	Avicii majdnem 11 évvel fiatalabb nálam - :-((( http://t.co/HnxWwcP4kj
491545185500024832	Negative	@noee_mii vagy törcsit, vagy ilyesmit. Nekem amúgy 1-2 nap alatt magától elmúlik
491546435276800002	Negative	@noee_mii a pénteki súlyzózás után ezt teljesen átérzem :(
491546892564979712	Negative	@terdelyi azért mert a kalap kaki feliratnak semmi értelme...
491546902417408000	Negative	"Egyeztetés nélkül ne érj már hozzám"
491547928025391105	Negative	Toto Wolff szerint így még nehezebb lesz feldolgozni a vesztes félnek a bajnoki vereséget. Szerintetek kétes... http://t.co/umHPgXFZjo
491549571957678080	Negative	RT @shopmarket: A nyári meleg kedvez a kórokozók szaporodásának, ami különböző fertőzésekhez vezethet, melynek az egyik... http://t.co/qc9x…
491549815428612096	Negative	@marco_subs @terdelyi ha valaki "néha jó" akkor már régen rossz az egész...
491550075256975360	Negative	Nem épp a megbékélés jeleit észlelni Ukrajnában. http://t.co/Y1vwqlLmV1
491550267004174336	Negative	@varsanyimartina folyton átdobál, úh töröltem azt is.
491550498567516160	Negative	Ukrajnában egyre aggasztóbb lépésekről döntenek. Bár az is lehet, hogy van benne egy adag tudatos hangulatkeltés is http://t.co/FOPF3WKVgS
491550536089739266	Negative	"Egy kezemen meg tudom számolni azokat az embereket, akikben megbízom. És itt nem olyan fajta bizalomról... http://t.co/ee3F4H20aS
491551126530297857	Negative	@amborsine milyen amugy a balcsi? mert itt botrány az ido ☔️☁️☁️
491551484601851905	Negative	​Így néz ki, ha rengeteg szlovák autója ég egyszerre http://t.co/GboZgpst9t
491551582937694208	Negative	Fura, hogy tumblin ismeretlen emberek többet törődnek velem, mint a saját barátaim. http://t.co/T3lYTfdYFe
491553355227877377	Negative	Bezárták a dzsihádra buzdító mecseteket Tunéziában  http://t.co/oNW2pYpBda
491554389426180096	Negative	"Mert ha jön a zivatar, két szárnyad betakar!" http://t.co/HnlvtnSVMS
491554441641095170	Negative	@terdelyi De ez még mindig hobbikategória. Hiába lenne rá igény, itt gyakori a besértődés, sárdobálás minden ok nélkül.
491555745641398272	Negative	@miszterti ÚRISTEN ez milyen lény?!?!
491557560198365185	Negative	@sportpotdom szomorú, de igaz :(
491557751722479616	Negative	A török elnök szerint "a zsidók, akik nap mint nap elítélik Hitlert, felülmúlják őt barbárságban" http://t.co/fheeaQVBNl
491558152106553345	Negative	A meddőség terápiája: a mínusz 1. szint http://t.co/ptdtZxFfR7
491558804216348672	Negative	EURUSD daily 2014.07.22.  1.3500 alá süllyedt az EURUSD értéke…. http://t.co/C5odB7NjXZ
491560605531115520	Negative	​Ez a kamuzó ingatlanos bukott le a leghamarabb http://t.co/VkjALOeBG0
491564491457724416	Negative	Unalom a köbön
491565281211592705	Negative	Eperjes Károly távozik a Nemzeti Színháztól http://t.co/AHQubdAz2e
491565490930999298	Negative	Ehes vagyok
491566263299104768	Negative	Az érkezőkről, távozókról, a felkészülésről és célokról Elek Gábort, az FTC-Rail Cargo Hungaria vezetőedzőjét... http://t.co/15fLbqzi2H
491567543996280832	Negative	Érsekújvár: a zsidó hitközség beszól a magyar kormánynak http://t.co/w1wALq6ZdF
491567611134500864	Negative	#Magyarország Úgy megrúgták a kismamát, hogy meghalt a magzat http://t.co/iB2V6kay3b #Hungary
491570618325037058	Negative	@strob nekünk egy nappal korábban fájt.
491571248711741443	Negative	#Baleset Érd - baleset: M6 - baleset, egy sáv lezárva http://t.co/ucEt5ChNxq
491571439108386816	Negative	Nektek is szokott lenni ilyen bénázós, leejtem-összetöröm-ráejtem napotok? Nnna. Még jó, h a létráról nem estem le.
491571614472220672	Negative	@aji_trancy es vajon ezt miko fogjak megerteni?.-. *6 ismerosnek felkeres csaveszoktol*
491572243038994432	Negative	@abagoly ez rosszabb mint a reggeli kiskacsás...
491572575878021120	Negative	Inkabb hugyozzak ossze magukat, mert en elobb teszek bennuk kart, mint ok bennem... #kinosigazsaglevelszundy
491575854414454784	Negative	https://t.co/MoetMlvZ2v -  TE TUDTAD? Aki az elmúlt félévben nappali tagozaton #végzett,... http://t.co/KSEQ1mN1ge
491575946005069826	Negative	@crystalroar define majdnem szüz
491576583707459584	Negative	Na jó, a Lidl-ös kávé után eldöntöttem: soha többé ilyen fűrészpor, nem érdekel, ha sokba kerül, inkább normális kávét veszek.
491576791153516544	Negative	@kepszakadas á, az egy majom!
491576815341682690	Negative	Oroszország a Boeinggal kapcsolatos ügyben hamisítványok ... - Oroszország Hangja http://t.co/DnN7alDVhg
491577033722699776	Negative	szerintem tudom miért nem szeretem az almát, kicsis savas a fogaimnak
491578473497239554	Negative	Mi ez az esős idő egész nap? Elvileg nyár van és kánikulának kéne lennie.
491579358969331713	Negative	gondoltam h ez lesz :-\
491579526770860032	Negative	tibi viszont mar nagyon hianyzik :-\
491580124434010112	Negative	Nagyon súlyos szavakkal ment saját kollégáinak az Alkotmánybíróság elnöke - !!444!!! http://t.co/F4Dzrfx2MS
491580137083637761	Negative	Nagyon súlyos szavakkal ment saját kollégáinak az Alkotmánybíróság elnöke http://t.co/vcqBaYY0kv
491580179114758144	Negative	Másfél évet adtak az olaszok a Google-nak: A vállalatnak az adatkezelés gyakorlatát kell megváltoztatnia. http://t.co/GT6U25854C
491582480303259648	Negative	Nem csak a fogamzásgátlóktól lehet trombózisa - Bizonyára tisztában van azzal, hogy a hormonális fogamzásgátlók je... http://t.co/THa0hFKowT
491582563392421888	Negative	Köszönöm Putyin úr, hogy megölted a lányom http://t.co/8pMOCNjsSn #MH17
491583050703450112	Negative	Gegeszetre soha, soha, sohatobbet!!!
491583331297792000	Negative	Észtország nem kér Steven Seagalből http://t.co/lckJAZ4cCa via @feedly
491584054253592577	Negative	nem vagyok benne teljesen biztos hogy ma meg Orsi ideer..
491584584963084288	Negative	Az orvosok szerint is szar Magyarországon a rendszer, a betegek szerint is. Mi tartja fent ezt a szar rendszert?... http://t.co/bsghkxxh4U
491586956959043584	Negative	Elsüllyedt egy menekülthajó Lampedusánál, közel 200 halott  .... http://t.co/m1psAXu2ON
491587490831433728	Negative	A Boko Haram elfoglalt egy várost Nigériában    http://t.co/p4hn01LXQ1
491588132815765504	Negative	jajj, majdnem elfelejtettem kiírni, h esik az eső
491588692511707136	Negative	Meglepő hatása is lehet egy szürkehályog-műtétnek http://t.co/Kfd0qOE2bj
491590746861240320	Negative	[105-ös autóbusz] 105-ös autóbusz Apor Vilmos tér és Gyöngyösi utca M között megnövekedett menetidővel közlekedik. 07 http://t.co/RRNGmTAT8p
491590858954014721	Negative	mi a túró, ha most nem érek előbb haza, lekésem a vízilabda meccs elejét? mondjuk ilyen esőben vicces lesz #eb
491592952997629952	Negative	A 4-es és a 6-os villamos helyett pótlóbuszok járnak a Jászai Mari tér és a Széll Kálmán tér M megálló között,... http://t.co/vpsKvuOHsu
491593235048181760	Negative	Orbán csúfosan elbukott in seinem Kampf. http://t.co/zXV0b0JCCt
491594012105527296	Negative	A 4-es és a 6-os villamos helyett pótlóbuszok járnak a Jászai Mari tér és a Széll Kálmán tér M megálló között,... http://t.co/wRkNunq85l
491596831332106241	Negative	Az ország negyede külföldön él http://t.co/BLQpGo3EgX
491597604669911041	Negative	6-1, ez a hidegzuhany az az oroszoknak, nem ami fentről esik #eb
491598211677949952	Negative	@nojami kicsit a kurva anyad szerintem 😒😒😒
491598705792139265	Negative	RTL Hírek előzetes:Brutális gyilkosság Debrecenben http://t.co/WpzN4IWMpX http://t.co/49XV4WXJVv
491599816628396035	Negative	"Az àlszent kurva anyàdat." - (via osszeomlottam) http://t.co/DT8F8Mn13o
491601235636936704	Negative	Jé, sikerült orrvérzésig dolgoznom. Ismét.
491601551656775680	Negative	Úgy gondolom, ahogyan minden ember életében, úgy a művészek életében is vannak sötét korszakok. Én sem tudtam... http://t.co/fG6VZ3ZuE3
491601927453822976	Negative	Este megint melo :( hajnali 4ig :( :(
491601977659252737	Negative	"A legjobb barátnőd az utolsó pillanatban mondja le a bulit. Állsz egy csillogó bár közepén, egyedül - a hajad, a... http://t.co/Nt4uEdCLim
491602650665082880	Negative	Egek, mennyire elegem van az átlátszó ruhák alatt látszódó bugyogók látványából... Csadort mindenkinek!
491602861164621825	Negative	Harcok a kongói fővárosban http://t.co/yYm1Y3PPGR http://t.co/zRxg72gdlu
491604554946195456	Negative	hazaértem x__x de sz*rrá áztam .__.
491604841870139393	Negative	[53-as, 150-es, 258-as, 258A autóbusz] 53-as autóbusz Újbuda-központ M és Mindszenty József bíboros tér között megnöv http://t.co/WwXOuiOWA9
491606262359269376	Negative	@kkovacs @terdelyi @tepi77 nem akarok palcat torni, de mar szerintem 10 eve is faszkorbacs jart erte...
491606462146162688	Negative	A brazilok beleléptek Dungával ugyanabba a folyóba http://t.co/W4LzgOfHZ0
491609435513831425	Negative	http://t.co/HJKyQBLEjQ - összességében még azt sem bánnám, ha az MTVA költségvetését inkább stadionépítésre fordítanák.
491610433959124994	Negative	Kommunikáció helyett bilincselés és előállítás http://t.co/RKHageuu0J
491611634625171456	Negative	[153-as autóbusz] 153-as autóbusz Neumann János utca és Gazdagréti tér között megnövekedett menetidővel közlekedik. 0 http://t.co/BQhagPOZqK
491611777185366016	Negative	@surrecat @abagoly @_nec @ddq @bandeszhu @kollinz @zencsaj @jugaroni @kispocok a blogolás mióta munka :_(
491612633083416577	Negative	Észak-Komárom szép hely,főleg a Klapka-tér környéke. Csak a helyi kisebbséggel gyűlt meg majdnem a bajunk. Kiszúrták,hogy turisták vagyunk.
491613486389026816	Negative	Július 23-án 40 éve hunyt el DARVAS LILI színésznő. Mindössze néhány filmszerepet vállalt, a Déry Tibor... http://t.co/5eI0lbzBrJ
491614317675315201	Negative	De az milyen már, hogy végre rászánom magam a Simpsons házra, erre bejelentik a Tumblert...
491614774795722752	Negative	A pártoknak NEM a SAJÁT, hanem a NÉP érdekeit KELL képviselniük!!!  http://t.co/LMg7yUA8qq http://t.co/bG2KeZbajV
491617634593419264	Negative	Újabb helyről tették ki Sipos Pált http://t.co/YQZ01ICr5L
491618184676782080	Negative	az eső monnyon le!
491618428697194496	Negative	[204-es autóbusz] 204-es autóbusz Budakalász, Auchan áruház és Bagaria utca között nem közlekedik. 07/22 18:18:39 http://t.co/t09IR5744W
491620010058862592	Negative	családi banzaj. #halalraunommagam
491620029839183873	Negative	Úgy szakad az eső, hogy lehet "rezsicsökkentés" címszó alatt kimegyek az utcára egy tusfürdővel...
491622251675287552	Negative	Miért van a közterület-felügyelőnél BILINCS??? #wtf
491622384789913602	Negative	@tomzorz_ @iSandor szegény pára
491622566512308224	Negative	Nem lehet elégszer elmondani, hogy mekkora nagy foszuhatag ez a Uplay.
491624636887871488	Negative	@lili_puskas CUKII!!Úgy hianyoztal csajszi!!
491627118129086466	Negative	Még szerencse, hogy nem világos színű nadrágban indultam el otthonról. #ohwait
491627239407353856	Negative	[75-ös trolibusz] 75-ös trolibusz Jászai Mari tér és Puskás Ferenc Stadion M között megnövekedett menetidővel közleke http://t.co/chazxsuwOh
491628539138281472	Negative	Milliárdok csapnak össze. http://t.co/CSRUqmRNRJ
491629256720396288	Negative	Bubi-kálvária biztonsági rémhírekkel http://t.co/fzORDuS2H3 via @feedly
491629593024278528	Negative	Sikeresen létrehoztam fb oldalam, de most elő kell keresni a különféle régi bizonyítványokat, okleveleket, amiket feleslegesnek tartottam :(
491633224360030209	Negative	@chiliscsokolade állandóan veszekszel velem..:(
491633739337068544	Negative	az a helyzet h érzelmi mosogatószivaccsá válok barátság és szülős filmek láttán ._______.
491634486929817600	Negative	@HathSzandi akkor én sem vagyok szerelmes :(((((
491635841362829313	Negative	nem tudom, mi legyen
491636956229410816	Negative	Kémkedik az Apple az iPhone-használók után? http://t.co/eT8oDbOkjK via @feedly
491637003298299904	Negative	MOSZKVA A FORRADALOM ELÖTT http://t.co/DyK2wIXo8B
491638839589740544	Negative	Amerika szerint Magyarországon „náci típusú antiszemitizmus van” http://t.co/zocO003Zt1
491638930916540416	Negative	@csiguszka jo magyar forint! dmesbol csak vaniliasat ittam, de muize volt :(
491640053605883905	Negative	Hát, az eső csak nem akar elállni, nekem viszont lassan el kéne indulnom haza... :-/
491640324226576384	Negative	Köszi rosszidő, sikerült még engem is befordítani kicsit. Most szeretethiányos kisbagoly vagyok, pedig 2 hete folyamat pörögtem. Damn.
491641590029750273	Negative	Tényleg elég röhejes feltételezés, hogy az olasz nagykövetnek kellene tudnia olaszul :_/
491642041521410049	Negative	RT @coffeeandcapote: Egek, mennyire elegem van az átlátszó ruhák alatt látszódó bugyogók látványából... Csadort mindenkinek!
491643112096563200	Negative	ajj, nem tudom rávenni magam a #NeedForSpeed -re... pedig már egy ideje leszedtem, de nem vagyok agy zsibbadt hangulatban
491643152709984256	Negative	@Ailey_ Jézus...
491644434715791360	Negative	Akkora hangulatingadozasaim vannak naprol napra, hogy komolyan elgondolkodom a a remete uzemmodon :(
491645768537997312	Negative	érzem hogy valami baj van... mondd el, tanácsot adni sosem tudtam, de meghallgatlak.
491645795243159554	Negative	A hétvége legszomorúbb híre ez.   (Egyébként nőként is érdemes kattintani, mutatunk szuper akciós Mango-lelőhelyet!) http://t.co/sLCirkGt7T
491646121417404416	Negative	jézusmaris.. mindenen bőgök ma? ! D:
491646408060329984	Negative	@tothur En is - szar gondolatokat es hasonlokaz probalom megvaltoztatni, optimistan nezni a dolgokra de valahogy nem megy :/
491647323563622400	Negative	epp kerni akartam, hogy egy 196-os is maradjon ki es negyedoraig alljak az esoben #badluckeni
491649730284621825	Negative	Anyám kapott egy noname energia italt fél éve. Ki akarom dobni, kell a hely a hűtőben, erre jön, hogy "azt még egyszer meg fogom inni" :|
491650137207615488	Negative	50 éves kor felett a csontritkulás már mindenkit érint. A testvibrációs technika az egyetlen, amelynek... http://t.co/xhACVdx5N6
491650705233440768	Negative	Csipkerózsika alussza álmát és nem ébred, pedig már rugdossák a testit nekije: http://t.co/y6hgdqUXX6 :D http://t.co/cO51u1pohN
491651842212765696	Negative	Csalódásokkal teli első fél év http://t.co/FmiCNvxneY
491651960794120192	Negative	Borul a tűzszünet http://t.co/QimqojLe9u
491652833280655361	Negative	"IMADOM HOGY MINDIG ELOTTEM VANNAK SZERELMESEK LEGSZIVESEBBEN LELONNEM OKET ENIS BOLDOG AKAROK MAR..." http://t.co/3smfztu74x
491652836842020864	Negative	Prometheus 2? Miért? Erre van pénz? Garantálni, hogy soha senki ne nyúljon többet hozzá még egy elbaszott folytatással...
491654726405353473	Negative	kifogyott a ragokeszletem :( #sad
491655023244623872	Negative	@nyilt_titok ezt most megprobalom elengedni a fulem mellett 19-én hazasodott oszze. eletem melypontja
491655132753702912	Negative	Az Uránia mozi adja azt a filmet eredeti nyelven felirattal, amit a cinema city nem képes #lol mostantól ha tehetem, csakis művészmozi
491655806526689280	Negative	@nyilt_titok sajnallak :(
491656371340070912	Negative	Itt a legújabb konteo az Ukrajnában lelőtt maláj gép kapcsán: a Magyar Honvédség is benne lehet http://t.co/qUtIXetwzx
491656998820544514	Negative	@Nor_ert nekem most se adja fel. Minden mást igen, de a Teen Wolfot nem :/
491658032175411200	Negative	kurvára megbántasz és még te vagy vérig sértődve? http://t.co/gUHoAcHiFV
491659517755924480	Negative	Mind1, akkor szakadó esőben nyomom. Időjárás prepare!
491659752854667264	Negative	MŰVÉSZET AZ EMBERÉRT-ART FOR THE MAN: Újabb zsidó manipulációról hull le a lepel: az iga... http://t.co/FtmcqBvisk
491659919087902720	Negative	Azt hinné az ember, hogy egy sima share dialog custom text-tel, saját ikonnal a 3 nagy social platforma megvan 5 perc alatt. De nem.
491660288660631552	Negative	Nagy nevű mobilgyártók miért nem terveznek ilyen randa és elavult telefonokat nekünk? http://t.co/8lUvwc3Kf2
491660445913464832	Negative	Nekimentem az uvegajtonak
491662080484073473	Negative	Ő szép.Én meg én vagyok.Ez kurvára fáj. http://t.co/nncYXEpg6M
491664521032134656	Negative	Tudjátok, Tihanyban van egy szobor-lány,aki elé kell állni, és onnan kiáltani a templom felé,aztán egy másodperc... http://t.co/3tVVku2b8p
491666883368988673	Negative	@csakiistvan mindog csak US hogy rohadna meg
491667161744953346	Negative	2014.07.22. Clyde átesett az ivartalanításon, sajnos kiderült, hogy sérve is van, a műtét során ezt is operálni... http://t.co/GZG7btXZuw
491667725669122049	Negative	Egy nap alatt egy havi csapadék. http://t.co/WI9CeOZh7C
491667941285703681	Negative	Az első gépemben 16kbyte RAM volt. Most az ablakot 256 megával támasztottam ki. #régenjobbvolt
491668267728375808	Negative	RT @idokep: Egy nap alatt egy havi csapadék. http://t.co/WI9CeOZh7C
491668386288766979	Negative	Az iOS hátsó kaput nyit az adataink eléréséhez a nemkívánatos elemeknek? http://t.co/l8qmF8DJrK
