483397181316288512	Negative	@nykiah dehogy helyes. am is egy patkanyfereg.
483402593805561857	Negative	@YoshikuniAsu Azt akartam még mondani h remélem örülsz h egyedül hagytál ebbe a viharba?!  Szóva vikun utálni fogja ezé egy darabig senpait
483404524175233026	Negative	ez az új Transzformersz eléggé vontatott vagy egy részben benne van vagy három.
483408525931315200	Negative	Sajnálom (de semmi pánik) http://t.co/n4goMCUpqC on @bloglovin
483416371993124864	Negative	Mikor rájössz valami fontosra, aztán annyira forog a fejedben hogy nem hagy aludni.. HÁTKURVAJÓ – fura
483418195978878977	Negative	Rohadt vihar miatt nem lehet aludni......
483418649076961281	Negative	[H6-os hév] H6-os hév Szigetcsép és Tököl között nem közlekedik, a kimaradt szakaszon pótló autóbusszal utazhatnak. 0 http://t.co/pYxziAHL5y
483419872081092608	Negative	ÉLET BUKAREST UTCÁI ALATT! http://t.co/JmVLF8lGLh
483454687799418881	Negative	Miert nincs fent senki?! :O (ilyenkor Emese? Gratulalok ^^")
483455954605064192	Negative	Hogy mondják... németellenesség http://t.co/1YCLMWTKXs
483457575334461440	Negative	Azért így, hogy végig dolgoztam a hétvégét is, nem őszinte a mosolyom ma reggel #fb
483463904388190208	Negative	Elhagyatva Amerikában http://t.co/SIJnB6Cr13
483477712015994881	Negative	Demcsákot laptopjáról elemelt adatokkal próbálja vádolni férje http://t.co/UqM1DgaVQs
483483122823364608	Negative	Elég szürreális álom lehetett...
483483928209424384	Negative	Miért esett kéthavi mélypontjára a forint? - Ugyanott kezdi a hétfő hajnali órákat a forint, ahol pénteken... http://t.co/Hgj621FF9y
483484224809623552	Negative	@mrs_styles7865 hey nyugi vaaan 😃
483484580058783744	Negative	Miafszomvan? Nem jár a pótló vagy mi?
483484784946315265	Negative	@vanillahs_ erre most jön...     ...  ..... .. .
483485243320463360	Negative	A H6-os hév helyett Szigetcsép és Tököl között hévpótló busz közlekedik, kábellopás miatt. Azon a szakaszon, ahol... http://t.co/Z0iviUiTo0
483485534996537345	Negative	Kiderült: titokban manipulált minket a Facebook: Valószínűleg törvényes volt, de etikai… http://t.co/Q5eJQmUzML
483485607948070912	Negative	Az állásába került az auschwitzi tanulmányút http://t.co/2p4MW4HpOa via @indexhu
483488170856939520	Negative	@pancakespeedy :( te megnézted már az összes részét?
483489269562888193	Negative	310 forint közelében az euró | TőzsdefórumTőzsdefórum: http://t.co/xtrhRh6una
483490835372453890	Negative	Nagyon kiralyak ezek a CNG-s VanHool buszok, de hogy nem europai emberre terveztek az is biztos. :/ http://t.co/Fu46sGdMfD
483491079174770688	Negative	Nyugodj Békében Elemér bácsi!Hiányozni fogsz a pályák széléről.Játékszereteted,lexikális tudásod örökre legendás marad..
483491374667673600	Negative	@strob Most már nem esik, de éjfél és 5 között szakadt, dörgött, villámlott.
483491587625091072	Negative	Tűzszünet: újabb orosz újságírót lőttek le Kelet-Ukrajnában http://t.co/XmXibIB5vd
483497626013548545	Negative	Photoset: Úgy tűnik, a #Fidesz - #kdnp kormány valamit nem szeretne megmutatni: így trükköznek az adatokkal... http://t.co/poLxKCePGa
483497976837320704	Negative	BORZALMAS FOTÓK AZ OROSZ KORHÁZAKBAN! http://t.co/HKTCMHUf62
483499252958920704	Negative	Photo: viteez: Bob szeg eldőlt. Peter szeg is fekszik. De a Steven Seagal. Sajnálom szegény Bob Saget http://t.co/ea6UB2Mlca
483499399662682114	Negative	Kedves Szűz! Tele vagy kíváncsisággal hétfőn. A kíváncsiságod kérdések formájában tör a felszínre, és ezeket a... http://t.co/sLujd4O6mk
483504882616643584	Negative	60 illegális játéktermet zártak be Kárpátalján http://t.co/cLaUpJdFcc
483505401494011905	Negative	Gondolatok http://t.co/tbN7AkDSu6
483505550324281345	Negative	#Torlódás Budapest - lassú forgalom: Népfürdo -&gt; Közraktár utca - lassú forgalom, idoveszteség http://t.co/jeziQNnEnO
483506052257030144	Negative	@BettiSzatmari h lett megoperalva? Es miert?
483508048238223360	Negative	Bajba kerülhetnek a magyar tejtermelők http://t.co/zCAhuCFrii
483509946764386304	Negative	„Átkozott minden agy, amely ezt kitervelte”  KIállításunk mellé kiváló szerzők tanulmánykötetét is ajánljuk! http://t.co/bBJIVCms9K
483509983284592640	Negative	Ilyen szart almodni..
483510605744459777	Negative	@ern0plus4 elkéstél, a Magyar Hírlap megelőzött
483511052970504193	Negative	@Kitti_1109 tényleg ._. nekem pl. eszembe se jutott, de tényleg egy csomó "vidéki" kpopper van, akiknek szállás kell meg ilyenek ._.
483511125619662848	Negative	Passzívház templom- beigazolódtak-e a plébános aggályai? http://t.co/BHZGdLmFYU
483511574720962560	Negative	Hogyan lehetne kulturáltan közölni a szomszéd nénivel, hogy kegyetlenül hangos, tőle zeng a ház, és jobb lenne, ha egyáltalán ki sem %
483511643520122880	Negative	% jönne a lakásból, aminek az ablakait sem nyitná ki, mert úgy is kihallatszik?
483511729700503552	Negative	annyit kerek, hogy ulj at masik gephez. A valasz:  -NEM! hozd ide a másik gépet.  -wtf ?
483511913276780544	Negative	@gklka birtokvédelmi eljárás
483512915098886144	Negative	@ScoTTThun @strob Mostanra meg esik is már.
483513090336489472	Negative	Seszták eltévedt a paksi útvesztőben http://t.co/sYBsWFOvyA
483513436929007617	Negative	Komolyan, már megint SZARVAS??????
483514674194153472	Negative	@wildgica Élőben is olyan csúnya, mint a képeken?
483514879723442176	Negative	@thehedgehog nem hozzám, az egész házhoz kéne igazodnia… Én örülnék ha elköltözne úgy ahogy van, úgysem bír felgyalogolni a harmadikra.
483515421262626816	Negative	@CharlotteLesko jo de en alig aludtam es azt is rosszul
483515583045304320	Negative	@gklka @TheHedgehog Hosszú évek óta pereskedünk a szomszéddal. Nem lehet vele mit csinálni, még úgy sem, hogy több állatunkat mérgezte meg.
483515730890342400	Negative	@gklka @TheHedgehog Az önkormányzat álláspontja szerint minden utcában van egy élhetetlen ember.
483516001355825152	Negative	kb. 70 cm-es fellépési távolság, Déli pályaudvar, 2014... http://t.co/hgbs6mo9pm
483516074949107712	Negative	Ismerős? Niki is ezzel küzdött: "Babát akarok! Én ezt anno rendszeresen beírtam Google-ba, talán azt reméltem... http://t.co/YGDYWnpGfv
483516118251089921	Negative	Ekkora fogyatékos vevőt
483518390687264768	Negative	Rövidnadrágban jöttem -&gt; szakad az eső.
483519491415228416	Negative	Jóslatom: a balatoni szezon idén szar lesz. #fb
483520631951360000	Negative	Ha tudom, hogy ilyen nyárral jönnek, elmegyek szavazni a baloldali összefogásra http://t.co/bhi2CSOZi8
483521177177305088	Negative	http://t.co/tAe10IuRIr A július 5-i Karthago koncert egészségi okok miatt... http://t.co/TiHg3sptwp
483522296167292929	Negative	http://t.co/kLPJQ7GGXe 2014 május 15-én itt hagyott minket egy... http://t.co/HJ1dFpUv8X
483524280135999488	Negative	Robbent aztán reggelig ütheted-rúghatod, nem érzi. "Az első félidőben magamtól estem el, nem bántottak" - mondta az okos. #focivb
483524800607158272	Negative	Rendben, akkor Guardiola miatt bukjuk Kroost. A csapatjátékot már buktuk, most jönnek a szólisták. Felkészül: Müller?
483525020938174464	Negative	@tothur @aorcsik egyre ijesztőbbek a dolgok még egy ilyen index-címlap nélkül is
483525274819371008	Negative	@AMoncz Ugyan már, ez a nyilatkozat azon nem változtat, hogy a zsebetekben van az összes bíró.
483525696091095040	Negative	Esernyő nélkül már ne indulj sehova. Jelenleg 21°C van s Budapest egyes részein már esik.
483525799610699776	Negative	@lipilee még mindig dobálja a hálózatot? :(
483526794495025152	Negative	2004. július 1-én hunyt el Marlon Brando http://t.co/T7G12ly86s
483527101489119233	Negative	Bréking: a Bem rakparton a 86-os csúnyán lezúzott egy bmw-t, oldalról telibe kapta. Elég szarul néz ki. #bkvlive
483529030042660864	Negative	csak tudnam hova megy telen-nyaron, napsutesben-esoben, hetkoznap-hetvegen ez a rengeteg oreg neni
483529486181203968	Negative	Jól látom, hogy a 2030-as BKK tervek között SEM szerepel a 4-es metró Bosnyáki hosszabbítása? Juj. Ismételten köszönjük a felelősöknek.
483529670370263040	Negative	@alcsernorbert mert nem akarok bunkó lenni.
483529724199972864	Negative	Nem ugy, mint sok csaj, aki a szoget meg a csavart nem tudja egymastol megkulonboztetni #elozo
483529818580209666	Negative	@habergowd_  tipikusan pont akkor dobja el amikor nem fogom, ez a legnagyobb bajom vele (pl. órákig offline vagyok anélkül hogy tudnám)
483529989246435328	Negative	A Facebook manipulál minket. https://t.co/A2Jm5TER8M
483530308441350144	Negative	@terdelyi 15 év alatt sok víz lefolyik még a Dunán, ezek pedig eléggé aktuálpolitikai érvek. de ha már a stratégiai tervben sincs benne...
483531261072666624	Negative	@mefiblogger @terdelyi ugyanez, a VEKE terjeszti, hogy kihalt, de én hetente ülök rá és nincsenek kevesebben, mint a 2-3 vonalon.
483531495395823616	Negative	@terdelyi @bruzsy Kökitől az Árpád hídig járok minden nap oda-vissza...nem lehet leállítani, mert az egész város megbénulna.
483531981981220864	Negative	@bruzsy @terdelyi Ügyes forgalomszervezéssel szakaszosan megoldható. De egyszerre biztosan nem. És ezt az autósok fogják megszívni sajnos.
483532144359514112	Negative	Nem kár a Quickoffice-ért, de akkoris http://t.co/4gQl03V0xP #dontbeevil
483533096256811008	Negative	"kéne menni tönkre, bár úgyis minden út kómába vezet, ugyh lehet inkább maradok itt, mert mindenhol jó, de legjobb rottyon"
483533116267843585	Negative	Óriási medúzás árasztották el Japánt! http://t.co/hGDV9WAN6k
483534776146870272	Negative	Hetfo van, eso, a honap utolso napja - ti sem siettetek el a felkelest, ugye?
483535424577474560	Negative	Amikor az időjárás okoz fejfájást  Sok migrénes érzékenyen reagál az időjárás változásaira és bizonyos időjárási... http://t.co/mHzgF3o409
483535844209618944	Negative	Mentőt kellett hívni Kunhalmi Ágneshez http://t.co/f1upEOXXrc
483536501775818752	Negative	Akár tetszik, akár nem, az Apple kimondta, hogy az iPhoto/Aperture párost már nem fejleszti tovább  http://t.co/MvKfrYZEwy #plastik
483540154322124800	Negative	Esős napon. #shoes http://t.co/TF2MMFYEka
483540422825091072	Negative	Néha beleolvastam a Penny kibeszélőbe, de a 3-4. rész alapján ez nekem szimplán csak korrekt eddig, legalábbis gyengébb, mint az első kettő.
483540551275667456	Negative	anya hívott, hogy kapott levelet, hogy megindult Mamó hagyatéki eljárása :(( Ica néniéről meg még mindig semmi hír :')
483541728092520448	Negative	Fáradékonyabb vagy, ha borús az idő? :( Ugorj be Allee-ba és pörgesd fel magad a Costa Coffee Hungary-val! http://t.co/PPT3oYEpiU
483542433066938368	Negative	hajjaj, nagyon úgy tűnik, hogy indul a Kidd éra....
483542951172509696	Negative	Nem bírtam már megnézni a hosszabbítást ... :( http://t.co/8Er3itYr8A
483543385920524288	Negative	Tegnap a metrón mellettem, anya a fiának:  - majd az Arani János utcánál szállunk le.
483543501297025024	Negative	egy szerencses flotas... https://t.co/hlS8alhURa http://t.co/ErzCJfSEt8
483543656608305152	Negative	Jahogy nem is ma éjfélkor áll le a wiw, hanem délben, azaz kb fél óra múlva?!  Ez...  ez most hirtelen jött. :'-( #fb
483543937668628480	Negative	aki még a görögöknél is alábbvaló módon képes csalni a focit, - inkeibence: MINDENKI kiszúrta, akit nem... http://t.co/lGvRosmx0k
483544144875646976	Negative	@Koronix Önmagában a túlóra nem zavaró - IT szektorban van itthon is elég - csak az, ha nincs értelme. De itt nem erről van akkor szó.
483544706224513025	Negative	aki még a görögöknél is alábbvaló módon képes csalni a focit, - kosullo: martonbede: inkeibence:... http://t.co/cfB9xO8PnR
483544775510204416	Negative	Amúgy szar volt a veszprémi sörfeszt.
483545795653042176	Negative	aki még a görögöknél is alábbvaló módon képes csalni a focit, - inkeibence: martonbede: inkeibence:... http://t.co/vBjLu0jtPx
483546223526158336	Negative	Érzelmileg manipulálta felhasználóit a Facebook: Nagy botrányt kavart múlt hét végén a… http://t.co/mG8zPIL6I7
483546277158719490	Negative	Geszti: Hetente eszembe jut a kivándorlás http://t.co/hXt7HZRvTN
483548719627763715	Negative	Jövünk-megyünk, azt annyi...
483548875673059328	Negative	Kritikát kaptam és/vagy felhívást arra, hogy az általam itt közzétett posztoknak legalább a fele jó hír legyen.... http://t.co/Zhy4KW0mRp
483549978133286912	Negative	Ha a szart felrakják a polcra, mindjárt lekvárnak képzeli magát.
483550270111363072	Negative	[M3-as metró] M3-as metró Kőbánya-Kispest és Nagyvárad tér között nem közlekedik, a kimaradt szakaszon pótló autóbuss http://t.co/ldCwZUMgWX
483551892862402561	Negative	Max beszaladt a patakba, zokniban. Max boldog. Gazdi nem. Konkrétan sírni tudna. Ideggyenge, mondom én. http://t.co/34k1nsT8a9
483552007827886082	Negative	Ma meghal az iWiW http://t.co/u9tg4jYA8F
483552459282190336	Negative	@Koronix az biztos, de Magyarországon sokszor van olyan, hogy döntésképtelenség, bizonytalanság, szervezetlenség miatt kell többet dolgozni
483552624680005632	Negative	Tovább durvul a reklámadó http://t.co/C8Ad9hvVom
483553209878065152	Negative	Sokszor van az, hogy úgy gondoljuk mindenre tudjuk a választ, viszont ebben a gondolkodásmódban nem kaphatjuk meg... http://t.co/bfrFo2QAIP
483554013544456192	Negative	NA KINEK JÖTT MEG A SAPKÁJA ÉS A KARKÖTŐI (és romlott el a gépe)????? NEKEM :3
483555388101758978	Negative	Ez nem jó jel   Mit gondoltok Button teljesítményéről? http://t.co/OWQsFRkAwl
483559464713220096	Negative	​Máris itt az újabb RTL-szívató törvénymódosítás, benne a Google-bombával http://t.co/wzCCkTPF44
483561140023492608	Negative	Tutira ki fogom törni az üveget, bakker.
483561960710340609	Negative	jajj a facebook figyel #leszarom
483565126088679424	Negative	A H6-os hév helyett Szigetcsép és Tököl között továbbra is hévpótló busz közlekedik, kábellopás miatt. Azon a... http://t.co/SVpXB9Mx2Z
483565703187140608	Negative	A faszért nem dolgoznak normálisan a Sparban? Engem ezért kirúgnának. #justsaying
483566315664588801	Negative	Németh Miklós: kaphattunk volna pénzt a határnyitásért, de nem kértünk http://t.co/39b358DgpY
483567935337033728	Negative	Várjuk a szerelőt de nem jön el. 8 óta várjuk, hosszú órák teltek el. Itt kéne már lennie?!?! A központ sem... http://t.co/jNF3Rx3vOV
483570096825462784	Negative	@angelday sajna a kis X-ek a címben Chrome-ban nem jelennek meg.
483571946563833857	Negative	@Vod4fone engem kivételesen nem, cserébe nagyon nem tetszett a cast. :(
483572419702292480	Negative	A 'Share' ikon káosz. #Design https://t.co/MER7hZtzei
486702224807325697	Negative	mekkora gyökér emberek vannak
486710880340426752	Negative	Braziliával csak az történt, ami a többi országgal ahova Orbán Viktor ellátogatott. Most már elutazhatna Észak Koreába is
486732864571330560	Negative	Egy álmatlan országban élünk: ~ Közönyöm az álmatlanság velejárója. Minden esemény olyan messzinek tűnik, mintha... http://t.co/rfHwD6Q5hC
486737425012908033	Negative	Egyébként visszanézve, még a kapus, Julio Cesar játszott a braziloktól a legjobban. Nélküle lehet nem ússzák meg egy 10es alatt....
486740539497512960	Negative	~Nem vehetik el az önbecsülésünket, ha mi nem adjuk oda.~  - Mahatma Gandhi http://t.co/AAris3AZtW
486745991685476352	Negative	A magyar modell http://t.co/HuVmW2GpQ8
486751713056264194	Negative	Ennél lassabban sem lehetne dolgozni egy pékségben...
486756163292524544	Negative	A "hétvége" legostobább nyilatkozata alighanem Laudáé. Nem értem, hogy nyilatkozhat ilyet pont ő... http://t.co/N3Kuvo2qXD #F1
486758203515211776	Negative	felporget gyak elott itt ulni egy orat. (@ Népliget autóbusz-pályaudvar w/ 4 others) http://t.co/2UM0ToGWVY
486758629639749632	Negative	Egy dolgot sajnálok csak, hogy Klose megdöntötte Fenomeno rekordját. A két csatár között min. egy klasszis különbség van a brazil javára.
486758809717596160	Negative	Ez mutatja, hogy Orbán politikája mellett miért fogunk lemaradni a környékbeli jobb országoktól. Sikerült... http://t.co/tZmSoBRTWH
486759378666942464	Negative	Németország 3 gól - 4 perc alatt.  Anglia 2 gól - az egész VB alatt.
486759906394243072	Negative	Fél óra alatt a pokolra küldték a brazil válogatottat, amely történelmi vereséget szenvedett http://t.co/h8lyDcrw2z
486761581267914753	Negative	LEMARADTUNK!! Az első oldalon jó lenne végezni, mert akkor van esélyünk a nyereményre, ami TÁP a Futrinkának!  MA... http://t.co/0IGvNND2Nm
486763112625090561	Negative	Legnépszerűbb híreink:   Kanyarban előzés okozhatta a magyar rendőr halálát 18+ http://t.co/4YCvPYy5HF http://t.co/mJmvkEZOhy
486765652183891968	Negative	Citotoxikus szerekkel tömegesen gyilkolják a tájékozatlan embereket | Bio-blog http://t.co/VUJSS2Drig
486767658734727169	Negative	olyan koran keltem :( es amikor mar majdnem visszaalszok valaki mindig bejon es hozzamszol #feladom
486768534438281216	Negative	Nagyot zuhant az Air France iránti bizalom http://t.co/He25ZwjgRC
486768625475678208	Negative	nem tudom milyen legyen a kormom az elet nagy problemai. ja nem
486768933534306305	Negative	Izraelben törhet ki az újabb közel-keleti háború http://t.co/iVrNnSMK6T via @indexhu
486769994676441088	Negative	Háromszoros árat fizettek Szombathelyen a napelemprojektért http://t.co/eTwG2neHSo
486770252290613248	Negative	#Magyarország Fegyelmi eljárás indult a romagyilkosok bírája ellen http://t.co/WsWjSJShZr #Hungary
486770727690203137	Negative	@sztyuiphoto fel van borulva a bioritmusod. Nálam is ez a helyzet, főleg esküvő szezonban. Nagyon nehéz vissza állni normálisra
486772146371563520	Negative	Apple hirek: elolvasom 9to5-on, elolvasom imagazinon, majd 2 nappal kesobb egy fos vicceskedo stilusu modoros posztban elolvasom appleblogon
486772822166212608	Negative	Ezt a tokom kavarast ami allandoan megy, inkabb haza se jovok horvatorszagbol, hat erre kivancsi a fene
486773262207442945	Negative	Az RTL-nél nem is tudták, hogy a műsorvezető a tárgyal a konkurens csatornával. http://t.co/LBWoSOwrjQ
486774194860863488	Negative	Ennél többet nem tudunk mondani a tegnap brazil-német meccsről. Hét másodpercben a világ! http://t.co/PUOxK1cMf3
486775066546700288	Negative	T Orbán Viktor úr! nem mindegy látni és látszani. ennyi http://t.co/2QcjehJXLi
486775520013852672	Negative	Egy rosszhírű környéken lelőnek három fiatalt. Kiderül, hogy faji kérdések is szerepet játszottak a vérengzésben…... http://t.co/1jcTFrD0zo
486776525325623296	Negative	majd 3 milliárd forintos GVH bünti betongyártóknak (1% az informátornak) http://t.co/lNveuIDErz
486779422398492672	Negative	Állítólag Angelina Jolie sötét korszakából került elő a videó, részletek a cikkben! http://t.co/XWfUGRHKCO
486779829841170432	Negative	Mélységesen etikátlannak tartom Stumpf András eljárását, amely szerint ő nem ott támad, ahol reagálni lehetne a... http://t.co/1Mqx7Z6Pem
486783558577840128	Negative	A tulaj is csak most jelenti be h ő majd jön 3 órakor...  Kedves... Szedd össze a maradék számlát és fizesd... 😣👎
486783786110427136	Negative	De gecire elegem van már azokból a levelekből, ahol arra panaszkodnak, hogy citromailre nem érkezett meg egy e-mail. #2014 #citromail
486784193071169536	Negative	RT @nepszava: Egy átlag magyar háztartás energiafelhasználása csaknem az uniós átlag kétszerese. http://t.co/cDw2DhcF5E
486784496994643968	Negative	Egy fiatalember a legválogatottabb kínzásoknak vetette alá a kijelzőt, rálépett, 90 fokban meghajlította, késsel... http://t.co/xWnoIm5lkq
486784726943141888	Negative	@mergenc @amon @kutpet van utána valami szellemi elégedettség... mondjuk mozogni és lélegezni viszont elég nehéz
486785679956148225	Negative	@eszement @xab83 Ez vallási kérdés. 20+ program tesztelése után a Runkeepert és az Endomondot tartom a legjobbnak, bár egyik sem tökéletes.
486785967748292608	Negative	Otthon hagytam az órám, de még az ajtóban észrevettem 👍
486787830732312576	Negative	RT @ujpeter: Kiöntött a Tiszaszipi http://t.co/PWBgdph7Yt
486789465017692160	Negative	RT @szily: A szóviccversenyt természetesen a Nemzeti Sport nyerte http://t.co/guH6kAZGSs
486789552833847296	Negative	@LittleHachii elfogult emberek, sajnos mindig lesznek... de igazából nem is ez a rossz, hanem hogy az SM ennyire nem veszi észre magát -.-"
486792919542939648	Negative	Egyelőre nagy csalódás Cliff Bleszinski új játéka: Cliff Bleszinski, avagy a Gears of War… http://t.co/SrV9j4y2K7
486795046772310017	Negative	Koitusz után minden állat szomorú - Megrázó: http://t.co/mGnwte6eoh
486795440919433216	Negative	@LittleHachii sőőőőt jobbat tudok a börtönnél~ mennek Észak-Koreába rabszolgának~ vagy valami rohadt alantas helyre, valami szar meló miatt~
486796495245418497	Negative	Gyilkossággal vádolják, Magyarország kiadta Kijevnek, most összejátszott az őrökkel és megszökött az oligarcha! http://t.co/0ri9cTh75X
486798818319400960	Negative	Hegyi Ivánban valami eltört http://t.co/XC6Ys1PXW0
486799761920786432	Negative	@LittleHachii ja -.-" pénz amit nem ők keresnek, mégis a legnagyobb része az övék, mert ők a cég "fejei" és hűű de keményen megdoloztak érte
486801913779089408	Negative	@LittleHachii nem akarom tudni OwO bár tőlük bármi kitelik -.-"
486802947918290944	Negative	De utálom a "családom"
486806972977524736	Negative	Pénisz fesztivál Japánban! Bizarr! http://t.co/RxCnJK9d9r
486807813830619136	Negative	investo hírek | MOL  Tőzsde | Részvény: Nagy pofont kapott a MOL   Napon belül jelentős esést produkál a MOL... http://t.co/2Mhl19waBp
486810138393985024	Negative	RT @olga_wagner: "Nálunk az iskolában mindenki tudja, hogy ezek a hülyék szétverték az oktatást, de senki sem meri kinyitni a... http://t.c…
486810770253312000	Negative	@eszement főleg a legutóbbi permissionváltozás-rejtő változás óta... emiatt gondolom, hogy az antivirusok kevesebbet érnek, mint PC-n
486811807617912832	Negative	@KTamas Úgy tűnt, sokan elhitték. :[
486813507510624256	Negative	Kollega ebben jött meetingre. Késve. http://t.co/UXLrmIpseH
486815041560522753	Negative	Mitől pöccensz be igazán? — sok dolog lehet http://t.co/SXcu7vNtKa
486816297712648192	Negative	@terdelyi @beny9512 meg moduláris fejlesztés. Plusz ha komplex a kód, mindig van benne "temporary" bugfix, aztán nem tudod hol a hiba
486818169559187456	Negative	@LittleHachii hát igen... ._." a hideg futkos a hátamon az SM gondolatától is :S brrrrrrrrrr~ ._.
486821209875963904	Negative	Hoppá!  #hoppá #ooops http://t.co/6TrGIakhvg
486822643921076224	Negative	@b3ck nem én, szerencsére az én életem átlagos. akkor is, ha esik az eső.
486823740324335616	Negative	Az EMMI átalakította az oktatást, de kutatást nem csinált annak hatásairól (vagy ha igen, titkolta, vagy... http://t.co/sYTOv4bVov
486825352980086784	Negative	Hajmosás 5 perc alatt...WTF???
486826203350040577	Negative	Száz éve halt meg a mesekirály http://t.co/rmAahY7tV2
486827776293732352	Negative	ez a legmegrázóbb, amit most el elhet olvasni. http://t.co/1gwhTTjXdV
486829063781507072	Negative	Ilyen még nem volt. 7 évre visszamenőleg szednének adót - !!444!!! - Már a kormány előtt az előterjesztés.... http://t.co/EWIEVj9JLs
486830239356813313	Negative	Folytatódik a csapadékos időjárás, így tömegesen megjelenhetnek az ismert kerti lakosok!  Még akcióban nálunk a... http://t.co/ZCQ5RRLQC9
486830903428390912	Negative	Utána minden állat szomorú - !!444!!! http://t.co/DbunSxQ1SR
486831886158020608	Negative	A 72-es troli helyett a teljes vonalon, a 74-es trolibusz helyett pedig az Amerikai út (Mexikói út) és az... http://t.co/LQHJXxea86
486832338601787392	Negative	Felújították, majd bezárták Gavrilo Princip szülőházát http://t.co/OmfLcVYhHo
486832933261815810	Negative	Az eső a BéSoundos fellépés miatt is zavar, a házmesteremből vice lett közben, a #444 -nek meg nem tudok így elég #swag posztokat tolni 😐
486833262921523200	Negative	RT @mazvazzeg: Azért is jó, h a mobilparkolás végre hatékony állami kezelésbe került, mert a tranzakciós díj így az eddigi 75 Ft helyett má…
486833639138009088	Negative	Miért a héten van ilyen idő? Főleg, amikor minigolfozni szeretnénk. A hosszú hétvégés Velencei-tóról nem is beszélve. #fuckweather
486834915263385600	Negative	Nem sikerült a mágia... http://t.co/kW8HIfZVgk
486835498875633665	Negative	meghalni sincs kedvem #again
486837267361964032	Negative	Két gyereket hagyott maga után az 5-ös úton meghalt motoros rendőr http://t.co/JbQ2Ys8oNn
486838324142014464	Negative	"Yahoo's Developing a Map Algorithm to Find the Most Beautiful Route" – ez olyan szomorú, soha senki sem fogja látni
486841726838267904	Negative	@justlikeyouzizi Miért jelentkeztél olyanra amit nem akarsz megkapni?
486842230754541568	Negative	ülök a kis szarból épült váramon, nem akaródzik dolgozni, pedig tudom, hogy millió és kettő feladat lenne #manemmegy
486842908931145729	Negative	Ilyen még nem volt. 7 évre visszamenőleg szednének adót http://t.co/gNrzAlqOkO
486843470053933056	Negative	RT @mazvazzeg: Azért is jó, h a mobilparkolás végre hatékony állami kezelésbe került, mert a tranzakciós díj így az eddigi 75 Ft helyett má…
486843941464313856	Negative	@sokroyg sztem elől kissebb az esély egy bukásra...de lehet, hogy a fokozott tempó/stressz miatt romlik a koncentráció
