449819028211908608	Positive	rt liegt da ein wrackteil auf meiner terrasse nein sorry doch der gartentisch #mh370
449819122936074240	Positive	jetzt hab ich dich bestimmt erschreckt der haustierneid hat mich zu dem letzten tweet veranlasst (meisterwerke )
449819500989669376	Positive	tolle neue quelle für #erythrit aus wien pro kg unter 8€ #coupon ery2014 für 10% nutzen #erythritol
449819794616090624	Positive	rt kurzes interview mit der bild von der gestrigen echo verleihung
449820125617995776	Positive	rt die ersten europäer schöner anton pelinka essay über juden kakanien u die eu leseempfehlung v…
449820358125027328	Positive	rt _sport _news „#bruchhagen ist der fels in der brandung“ sagt aufsichtsrat #bender im #faz interview
449821042643845120	Positive	rt geniales nummernschild für einen tesla ) via
449821553891745792	Positive	guten morgen und ein schönes wochenende
449821640474755072	Positive	denken ist kommerz )
449822004313882624	Positive	rt _xaoticca ein hessisches frühstück es gibt äppler
449822383135006721	Positive	vorfreude auf das kombibad bad vilbel skeptische massenheimer spd landgrebe zerstreute die bedenken
449822455558074368	Positive	rt ziemlich heftige offenbar gut recherchierte kritik im neuen profil an der pisa absage
449822513103900672	Positive	◀◉ aufwand nahezu bei null
449822910413541376	Positive	theaterstück mit viel „volkspower“ bad vilbel die schöpfung der müll und der mächtige könig kunde – „trashedy“
449823103569637376	Positive	_quer ich denke wir werden noch von ihr hören bin sogar sicher
449823296788652032	Positive	meine #adhs medikation sport twitter bier smiley
449823326702432256	Positive	rt milchstraßendämmerung über dem paranal observatorium #apod #astronomie”
449823464342319104	Positive	rapid will gegen graz erfolgslauf fortsetzen
449823556034371584	Positive	und die nächste verschiebung und zwar bis 9 35 uhr die vorhersage verspricht auch nicht unbedingt besserung #malaysiangp #quali
449823839397363712	Positive	_xaoticca _p klingt ganz gut
449824140539985920	Positive	bestimmt
449824399265628160	Positive	herzlich willkommen grüße aus rhein/main #idugbern
449824577355788288	Positive	wir fahren von hier gemeinsam hin nur geduld du bekommst noch deine semmerlfüllung )
449824609840680960	Positive	rust 3 wiener ausschuss ich bedanke mich für das herzliche willkommen freundschaft #rust14
449825135902867456	Positive	übrigens ist die arbeit mit pferden (pat parelli) extrem sensationell da pferde dich widerspiegeln viel gelernt von ihnen
449825324122251264	Positive	wer lust hat #venedig #romantik pur zu erleben dem sei das berühmte hotel #danieli empfohlen nicht nur weil
449825865472671744	Positive	eh klar dass das dann mir passieren musste #autokorrektur ))
449825895751372800	Positive	rt dieser tag trägt sonnenbrillen 😎☀️󾮗
449825999631704065	Positive	1911 keine mahlzeit ohne ankerbrot
449826104279597056	Positive	wunderschönen guten morgen &amp thx4follow
449826502751043584	Positive	ja beim startcamp in münchen bin ich dabei )
449826954771197952	Positive	die angie smiley
449827118109949952	Positive	rt das schnellste fahrrad der welt und ein innovativer und hartnäckiger österreichischer unternehmer in berlin
449827227526782976	Positive	ich würde mich über 7 stunden schlaf auch sehr freuen )
449827447765475328	Positive	schnell was für frühstück und mittag holen 😋 (@ rewe city)
449827873915162625	Positive	jetzt geht es los smiley #scms14
449828200835993600	Positive	_f1 florian könig ist auch nur am cappuccino trinken ich zähle schon den 2 großen bottich d
449828443580948480	Positive	schriftart garamond nutzen und geld sparen
449829027474571265	Positive	ahhh ich liebe spine so &lt 3 seine art stimme verhalten und er keine ahnung er und rabbit/bunny ergänzen sich einfach super smiley
449829641235480576	Positive	fast schon zu warm zum laufen ) #running
449829906185457664	Positive	du siehst super aus smiley
449830291180646401	Positive	wenn das so weiter geht meld ich mich wirklich bei diesem fanclub an wieso komm ich erst nach einem jahr auf die idee hahaha
449831024332398593	Positive	daily europa social business news wurde gerade veröffentlicht
449831466005172224	Positive	du wirst so auffalllen
449831826253963264	Positive	für allergiker und asthmatiker sicher interessant kommen sie
449831940456480768	Positive	rt besuchen sie uns bis 17 uhr auf dem börsentag in münchen wir freuen uns auf ihren besuch
449832012216823808	Positive	wird ein gemütlicher abend auf der couch das reicht auch smiley
449832383013855232	Positive	heute 20 30–21 30 uhr turn the lights off #earthhour
449832774258937856	Positive	ist es noch zu früh für den ersten schnaps
449833355056386048	Positive	der winter ist vorbei die vom designer thomas feichtner für den winter verpackten west skulpturen sind so nur
449834421961904128	Positive	kurz vor dem soundcheck zum großen auftritt smiley
449834645602201601	Positive	und heute pia uwe ethan und co treffen ♡ vorfreude ist groß #autogrammstundewiendonauzentrum
449834726229282816	Positive	_staub versuche zu schlafen oder stell dich schlafend
449834929510436864	Positive	dein optimismus find ich gut wie der schon sagte es ist cl
449836011368247296	Positive	deswegen mach ich das auch gerne
449836073536208896	Positive	_boeswarth _blubb a guada tog zum #gartln
449836220374593536	Positive	gaaaaaanz viel davon an dich zurück ♥
449838507373391872	Positive	oops gehts dir gut jürg brauchst du was
449838601397108737	Positive	bottas und alonso auch mit intermediates werden gleich auf full wets wechseln
449839231595450369	Positive	definiere deutschland gleich erst wasch ich noch mein auto
449839562744147968	Positive	schöne pläne
449839724539428864	Positive	das zauberwort heißt leicht daune federleicht und weich hält trotzdem warm und sieht in den bunten farben super
449839891502096384	Positive	ich hatte mich für #museum #socialmedia #hunde entschieden drei sind nicht viel ) #scms14
449839974129487874	Positive	bag store mit adelheid perfekt gestylt zum frühlingsbrunch am sonntag beginnt die sommerzeit uhren umstellen
449840591203860480	Positive	_chen das ist merkwürdig aber nein ausgewürfelt wird es nicht haben sie eine lösung gefunden gehabt /no
449840803301830656	Positive	fun fact mein nächster nahversorger ist der manner fabriksverkauf
449842106626887681	Positive	marius goldhammer bassist auf meinem album viel zu viel hat was neues am start
449842548178448386	Positive	_koon dann mögest du heute einen sieg der heimmannschaft erleben #scrstu
449843047539699712	Positive	eine katze &lt 3 nawwwww smiley *fav* twitter immer
449843335025676288	Positive	regionalkoordinatorentreffen der #neos nö großartige stimmung in diesem super team
449843595563261952	Positive	herzliche gratulation
449843728560439296	Positive	eine positive beschreibung von rezession )
449843880394248192	Positive	i liked a video from dinge die kein mann hören will by modekatastrophe
449844623759142913	Positive	zeit für kultur mit dem grossen kind #triolino #jeunesse #konzerthaus @ wiener konzerthaus
449844975027884033	Positive	rt man kann seitenlange essays über die identität der neos schreiben aber dieses foto drückts eigentlich auch ganz
449845209354862592	Positive	ex bayern münchen trainer louis van gaal habe meinen beitrag zum erfolg geleistet bayern münchens ex train
449845472673677312	Positive	rt dieser tag trägt sonnenbrillen 😎☀️󾮗
449845780665618432	Positive	leben soch zu begegnen vielleicht passiert das ja mal )
449846200574152704	Positive	rt vergiss nie wo du herkommst ich komme gerade aus dem rewe vergiss das nie
449846431575461888	Positive	linkedin – da kann noch was bewegt werden #infografik via quicksprout
449846985642999808	Positive	meine schwester sieht von alleine noragami an auch neu
449847072515440640	Positive	noch 24h und dann ein ganzer tag #dasschwarzeauge (pen&amp paper) smiley psychohygiene &amp #eskapismus in spielform ich freu mich )
449847169416433665	Positive	_blog_berlin die guten alten fußballzeiten im osten viel erfolg _fcm
449847243424935937	Positive	oooh singapur smiley der ausblick vom marina bay sands ist die liftfahrt wert
449847269022793728	Positive	erfreulich &amp schön formuliert ) rt gay marriage bishop of salisbury gives backing to same sex weddings
449847342544744448	Positive	gude ffm (@ frankfurt (main) hauptbahnhof w/ 7 others)
449847520089604096	Positive	noch ein bisschen mästen
449847620459298816	Positive	blick auf den zürichsee vom bürkliplatz in zürich
449847985271480320	Positive	nur zur info es sollte nun ein update im app store verfügbar sein ( wir wünschen ein schönes wochenende
449848193883189248	Positive	der kran ist da wer ihn bewundern möchte wir sind baufeld d13e
449848404097916929	Positive	_moshauer tut uns leid bei störungen bitte direkt mit automatennummer an das verkehrsunternehmen wenden /th
449848438596071424	Positive	ein app update ist nun im app store verfügbar du solltest in zukunft also nicht mehr verhungern müssen (
449848455566217216	Positive	rt ja und das heer der neuen arbeitslosen als bittsteller um ein grundeinkommen schlimme vorstellun…
449848641537454080	Positive	nur zur info es sollte nun ein update verfügbar sein du kannst die app also gleich am we ausprobieren (
449848767991148545	Positive	achja und wenn's brenzlig wird dann bundespräsident kärnten soll zukunftsfonds hergeben via
449848898862190592	Positive	wohoo ) dir auch ein schönes we
449848930592112640	Positive	weitere e flinkster in garmisch partenkirchen ab 1 4 stehen elektrische smart am marienplatz u rathausplatz bereit
449849084858605568	Positive	14 30 uhr gehts los smiley aber dafür live in farbe und (hoffentlich) mit ton ) see you later
449849396294086656	Positive	weise worte
449849455408197632	Positive	guten morgen barbara alli live on stage heute in bratislava ich freue mich auf die show d bis bald lg barbara alli
449849718555025408	Positive	update your mind mit unserem wöchentlichen gratis hermetik newsletter ► ◄
449850548981104640	Positive	liebes kommst du zum frühstück ohne worte kuss
449850697329438720	Positive	ja hallo da ist doch glatt noch ein cd review für unser im oktober veröffentlichtes album ten eingetroffen
449850872437428225	Positive	der svd der svd der svd ist wieder da
449850930339807232	Positive	wir kamen gerade darauf weil #creativeeurope projekte fördert die dazu beitragen die “wirtschaftsleistung der eu zu stärken”
449851042159919104	Positive	bald ist wieder kindle im burggarten zeit das leben ist ja doch nicht so schlecht vor allem in wien
449851122908663809	Positive	hat den #falter jetzt einmal testweise für vier wochen abonniert
449851170438524928	Positive	jap die anderen tagen kommen natürlich auch noch )) alles liebe
449851334096072704	Positive	rt warum spielt ihr eigentlich nicht mal das lied i just can't enough im stadion passt doch gut zur saison
449851420439613440	Positive	vorbereitungen für 1 #mavienna klausur &amp vergrößertes team blogging on a sunny saturday smiley
449851626480996352	Positive	leider keine zeit nächstes mal bin eher fan vom tun aber reden drüber schadet wohl auch nicht
449852340817133569	Positive	neues halsbando \o/
449852850152419330	Positive	_ nee nachts wird geschlummert smiley
449852975222378496	Positive	_veen audiovisuelles ist stark vertreten voraussetzung ist grob gesagt die kooperation mit einem anderen eu land #scms14 #creativeeurope
449853647544143872	Positive	rt _bahn gebe ich gerne weiter vielen dank für ihren hinweis /ma
449853892923502592	Positive	bitte _tanja kannst du dafür sorgen daß es grundsätzlich nach rennen oder q immer ein interview mit niki lauda und helmut marko gibt
449854064864808960	Positive	ich mache jetzt zwei tage extrem ausruh'ing
449854266966933504	Positive	hallo wochenende hallo sonnenschein unsere tipps für heute samstag *) funken hallo wochenende hallo s
449854342733258752	Positive	wenigstens nicht weltfremd die vorurteile sind bekannt aber ausnahmen bestätigen die regel smiley
449854565513711616	Positive	und ich habe bereits genug reserven eingekauft sodass ich bei diesem wetter (sonne 20 grad) nicht meine wohnung verlassen muss yeah
449855264489873408	Positive	der gute tipp fürs weekend trinken für den guten zweck das hilft garantiert dem integrationshaus wien
449855423852867584	Positive	_ko wie auch immer das rezept lauten mag der drink muss ordentlich flügel verleihen
449855461677080576	Positive	wie lange schlafen eigentlich fisvhe am stück und sinken sie immer weiter wenn sie verschlafen
449855671274864640	Positive	danke für den tipp wir freuen uns immer über restaurantvorschläge (
449857380583768064	Positive	sehr schön smiley
449858460956786688	Positive	_recruiting einschließlich samstag mail kommt am abend )
449858689726689280	Positive	#u12finals wir melden uns wieder aus innsbruck in 50min spielt unsere u12 gg die vienna tigers bitte mitfiebern und anfeuern
449858769032196096	Positive	überall app congress prämiert beste app für menschen mit behinderung validleben
449859341974122496	Positive	bis 21 uhr noch shoppen dann gemma feiern smiley
449859438502223872	Positive	aufgeregt #luminale #flashingdata
449859652386578432	Positive	kein lenkrad zugelegt fahre morgen also weiter mit gamepad _aut #f1game2013
449859738881515520	Positive	männer die ihre autos staubsaugen mit inbrunst (@ aral)
449860088636137472	Positive	ok jetzt sind mal kurze hosen angesagt …
449860123734069248	Positive	live aus nordkorea erste wortmeldungen und das chaos beginnt
449860381385961472	Positive	brienchen´s storytelling wurde gerade veröffentlicht vielen dank an
449860627067322368	Positive	und wer sind diese promis beim perfekten dinner die verdienen nicht mal ein z vor dem promi
449861050545213440	Positive	der vorteil an einer verkaufs unterstützung er schreibt auf alle schuhe die er verkauft meine verkäufer nummer drauf smiley #meinarbeitsleben
449861192798838784	Positive	_esskultur oh wunderschön mein meyerbäumchen seit 1 wo kein blatt verloren &amp 2 neue blüten #immerhin
449861292543967232	Positive	_aut daniel fährt mit einen und seine zeiten sind nicht besser macht also ned wirklich einen unterschied von rundenzeit denk ich mal
449861623390674944	Positive	_c0r3 pass auf dass du dich nicht erkältest
449862191538118656	Positive	großer schritt #klitschko verzichtet auf kandidatur und setzt sich für #poroschenko ein klasse via
449862349751844865	Positive	und zack prompt einen zauberhaften tippfehler
449862608242618368	Positive	rt _dieter großartige mölzer werden flügel verliehen genau genommen kotflügel
449863050917466112	Positive	gestern abend war die eröffnung der designmesse modepalast im wiener künstlerhaus heute und morgen können dort
449863275061469184	Positive	also ich find sie gut und praktisch )
449863422411558912	Positive	punkt für dich )
449863549041770496	Positive	kryptisch ich wär eigentlich hoch gefahren aber fuckyou körper will lieber grippe feiern also bett danke smiley
449863788448083968	Positive	so wie ich die #spö #wien kenne wird sie kurz vor der 2015er wahl die ganze #u2 in #u5 umbenennen &gt mission accomplished )martin
449864135153823744	Positive	rt _dieter großartige mölzer werden flügel verliehen genau genommen kotflügel
449864219060482048	Positive	hoffentlich wird das was den ersten fand ich herrlich | tucker and dale vs evil is getting a sequel
449864301105676288	Positive	hehe die espadrilles hat sie zu spät mitbekommen )
449864394449895424	Positive	super wir sind gespannt _migmus
449864450078941184	Positive	danke an und das gesamte samsung team für die geniale geburtstagstorte )
449864666207252480	Positive	rt der meriva 1 6 cdti im fahrbericht fazit hochvariabler diesel van
449864940732841984	Positive	weils zum sonnigen wetter heut passt #newroz im herzen wiens
449865232706326528	Positive	macht mit und erstellt mit digitalgeneration den größten computer der welt warum um eine terantische leistung
449865656784388096	Positive	warten auf die gesellschaft dann gehts nach lüneburg ob die alte dame das durchgehalten hat smiley
449866068111003648	Positive	und hier gibt's das timelapse video zum bild viel spaß bein angucken
449866471326613505	Positive	erster neuzugang beim kac #sport360 #icehockey #kac
449867226435563520	Positive	ab ins #wochenende mit der richtigen #musik gleich noch schöner
449867329933803521	Positive	ich habe ein video positiv bewertet drawing pharrell williams
449867424947793920	Positive	meine nail art pens sind endlich abgekommen und gleich mal bisschen gemalt #nailart #nailartpen
449867859330875392	Positive	rt piers morgan verabschiedet sich von cnn nochmal mit einem klaren anti gun statement
449867939663970305	Positive	mein tiefstes mitgefühl sowas sollte niemand erleben
449868401960161280	Positive	um 16 30 uhr geht es los das schlagerspiel gegen sturm beide teams mit viel s
449868433564237826	Positive	formel 1 hamilton sichert sich die pole position der engländer fuhr in malaysia #sport #news
449868509200543744	Positive	für unsereins wäre ein foodie nett gewesen ob man die bald auch riechen kann #schnüffelimages
449869070998175744	Positive	attraktivität und gutes aussehen sind wichtig für das private wohlempfinden basis kann eine dauerhafte #enthaarung sein
449869444349972480	Positive	sich gegenstände in den bart stecken kann auch künstlerisch sein smiley
449869589087019008	Positive	#u12finals #jcapstigers das eis wurde gerade frisch prepariert jetzt aufwärmen und vollgas in spiel 3
449870756357611520	Positive	es gibt hier einen globus *froi (@ globus)
449870788129464321	Positive	vernunft und fairness
449871062294355969	Positive	mein letztstand ist sie (er) hat kein wahlrecht smiley
449871440855457792	Positive	rt im internet playful
449871591308918784	Positive	rt kein wochenende ist lang genug um all die vielen varianten von nichts zu tun die man geplant hat
449871804631638016	Positive	die geschichten von sind nach drei gläsern wein am besten
449872473128185856	Positive	stimmt freiheit ist keine uhr zu brauchen
449873029913669632	Positive	karmasin ist sich nicht ganz sicher spindeleggers zukunft betreffend aber sie wünscht es sich #ö1
449873648065994752	Positive	heute wieder ein produktiver dj workshop in der brunnenpassage mit guter musik an einem sonnigen samstag (chris)
449874001951600640	Positive	herzberg bleibeskopf marmorstein hard
449875137568210944	Positive	hahaaah ich hatte angst ondan sonra musste ich rauf wegen der schule hosuma gitdi jetzt liebe ich es d
449875446453534720	Positive	genau find ich auch
449875947324723200	Positive	^^ macht ja nix hauptsache wir dreamer haben das edle stück
449876406067937280	Positive	jetzt beim apple gewinnspiel auf notebookinfo de mitmachen und macbook pro iphone 5s ipad air und imac gewinnen
449876611861856256	Positive	toastbrot für alle mit nutella
449877482309971968	Positive	mag ich
449877643769692160	Positive	wer kann schon von sich sagen samstags mit kind in nur 15 min bei ikea eingekauft zu haben #fb
449877822879051776	Positive	viel spaß das richtige wetter haben wir ja
449878047022661633	Positive	ach 'die gute erde' ein wirklich schönes buch ❤️
449878074822516736	Positive	rt großer schritt #klitschko verzichtet auf kandidatur und setzt sich für #poroschenko ein klasse
449878388249870336	Positive	alles ist gut ich hab' schon mit der mama telefoniert ein bisschen schwindelig und wackelig auf den beinen
449879004565491712	Positive	da ist es sven maresch und alexander wieczerzak kämpfen um gold in 81kg #judosamsun2014 #wirfuerd _hessen
449879450122207232	Positive	falls eine karte übrig bleibt ich nehme sie gern sehr gern smiley
449879605923442688	Positive	passt zum tag )
449879801181261824	Positive	ab in den zug und zur releaseparty 😊
449880176475009024	Positive	_handwerk wenn ich mich eine stunde früher treffe und alle anderen auch kommen #done )
449881177072340994	Positive	vom mucha zum österr wählerverhalten in 3 tweets top )
449881631139323904	Positive	#u12finals #jcapstigers toooooor jcaps spielstand 2 3
449882032530022400	Positive	und wenn ich jetzt noch schreib dass wir einen eigenen xbox raum bei _at haben redet der auch mit
449882253070708736	Positive	going green #yummy @ lunzers maß greißlerei
449882331206410240	Positive	laufschuhe geschnürrt
449882476568399872	Positive	wenn du willst kannst meine anteile kaufen offert erbeten smiley
449882782513524736	Positive	gerade die baumärkte wie wollen wir nach dem crash denn alles wieder aufbauen
449883101754179584	Positive	bitte habe ich gerne gemacht smiley /no
449883190841196544	Positive	schon probiert
449883255429668864	Positive	hauptsache mal die fahrt nach berlin gebucht aber noch keine wirkliche ahnung haben wie ich nächste woche nach wildeck hönebach komme
449883451001286656	Positive	farbenfroh smiley das trägt man so ♡ schmuck folgt noch
449883649584803840	Positive	ich tu jetzt ein bisschen lustwandeln
449883821681672192	Positive	_a hummelalarm (lat name der hummel wie ich gestern gelernt hab bombus magnus)
449883868376858624	Positive	rt _palla sie kommen
449884263585181696	Positive	das meint der ja das angebot muss besser werden und der zugriff einfacher
449884437455839232	Positive	der rennt hier rum und schreit mit britischem akzent i'm so fucking fancy errmaagerrrd
449884528048218112	Positive	ich vermisse unsere grüne papiermüll tonne ich schleppe dann mal meine leeren kartons 2 straßen weiter zum container 😕
449884726275620864	Positive	rt afd und fdp deutlich jünger als groko
449885105272946688	Positive	rt die _ffm gratulieren als neuen vorsitzenden der _wi
449885258574352384	Positive	das e9n spielt oblomow zwei lieben und ein traum hinreißend ungewöhnlich ein muss für theaterfreunde und
449885486505803776	Positive	_oned willst du auch d vllt ohne zwiebel für dich
449886175411834880	Positive	ja mag sein trotzdem was sagt
449886906785234944	Positive	#u12finals wir melden uns wieder kurz vor dem nächsten spiel (18 20) sonnige grüsse aus innsbruck
449887018127228928	Positive	die sonne scheint
449887131591118849	Positive	unterstützt mal diesen jungen sympathischen kerl gitdat beats er hat unter anderem auch meine kommende single
449888082763198466	Positive	rt meine professorin hat vorhin incest is in the air gesagt was sich irgendwie nach einem weniger beliebten beatles lie…
449888490944466944	Positive	rt in #tychy präsentierte 6 punkte des europäischen #energieunion projektes 1/5
449889053572628480	Positive	ich bin echt gerne bei den zu gast die haben kekse und teamkultur danke für die einladung gerne auch im wahlkampf wieder #kw14
449889339611561984	Positive	rt da ist es sven maresch und alexander wieczerzak kämpfen um gold in 81kg #judosamsun2014 #wirfuerd _hessen
449889563482554369	Positive	heute 16 00 raveline vikings gegen panthers gibt's eine überraschung #sport360 #kickoff
449889621980504065	Positive	rt _dieter das wird was heute nacht muss _petzner die sonnenuhr vorstellen
449889890965393409	Positive	ich auch smiley bin optimistisch
449890060851478529	Positive	also wenn dann erdäpfelknödeln
449890878677860353	Positive	life goes on #sunshine @ wien / vienna
449890911288573952	Positive	aaaaaaaah wie ich mein neues pink grapefruit duschgel liebe 😍 🚿
449890993009995776	Positive	alt wien
449891215774076928	Positive	smiley ein stummes westfalen h zu viel hat leute schon hinter gitter gebracht
449891488814891008	Positive	zugfahren ein bisschen einnicken zwsichendurch (y)
449891766997491712	Positive	bluetooth low energy ibeacon ist mehr als ein leuchtfeuer golem de
449891885708890112	Positive	die lustige version von walking dead exklusiv auf der xbox one hier unser testbericht
449892137233305600	Positive	mithilfe gefragt beim citizen science projekt der #boku zum thema #roadkill (vom straßenverkehr getötete tiere)
449892406583132160	Positive	auch spannend die eigene session hinterher auf twitter nachlesen #gamification #scms14
449892651089674240	Positive	live #musik (2) am sa 05 04 14 20 00 ♥ cajun ( ) #rüsselsheim ★ festungskeller
449893107849768960	Positive	proteinsmoothie oder auch scheuermilch mit ananasgeschmack
449893174321119232	Positive	anne schaut auf ihrem neuen bild aus als ob sie nackt wäre x3 rawr
449893495189549057	Positive	westwood per freistoß zum 0 1 schlechte mauer davor auch united mit ziemlich bescheidenem anfang viele fehlpässe läuft #mufcavfc
449893745786646528	Positive	das modell d'orsy lo elastic ist einer der neuen highlights bei un diesen frühling wie gefallen euch die
449893832935473152	Positive	#verpoorten gewinn kam an honey love &amp like via
449894749865263104	Positive	#sonne #skygarden #frankfurt
449895024898342912	Positive	ja hatte ich schon gesehen wird eh nicht so durchkommen
449895092581855232	Positive	ausgleich durch united schöne vorlage von shinji #skypl
449895161590333440	Positive	das original ☺️
449895411718053888	Positive	fav nur fuers autos abschleppen smiley
449895516214534147	Positive	bus 15a (schickt uns eure meldungen )
449896418103541760	Positive	es ist sooo tolles wetter * * freu mich schon total gleich mit liberty nach frankfurt zu fahren &lt 3
449896530447990784	Positive	tooooor sv darmstadt 98 hallescher fc spielstand 1 0 #fussball #3liga
449896799793188864	Positive	auf zur letzten gemeinsamen jagd in wenigen stunden ist es soweit und das rudel formiert sich ein allerletztes
449896913962156032	Positive	hat einen runtastischen lauf über 7 11 km in 1h 0m 2s absolviert
449897804732071936	Positive	erkenntnisse aus einem halben jahr in andalusien feat herman melville deichkind uvm #gummiringerl
449898316017717250	Positive	die drei amigos in hamburg city
449898641751166977	Positive	um 16 30 uhr geht´s los einen aktuellen vorbericht findet ihr auf unserer home
449898710814973952	Positive	rt wer übrigens das spiel um 15 uhr vs verpasst der kann beim ab 17 uhr eine ausführliche zusam…
