450547111105667072	Positive	die grumpy leggins würd ich total anziehen
450547251354402816	Positive	maßnahmen haben zu solidarisierung der meisten mit der regierung geführt also kontraproduktiv fp verurteilung richtig
450547400068050944	Positive	dir wird bestimmt gaaaaaanz langweilig d
450547431805952000	Positive	_at _at danke für die zuversicht tut gut wenn man jeden tag die vielen barrieren sieht
450547745988694016	Positive	na habt ihr dieses wochenende auch so enspannt im freien verbacht
450547999832555520	Positive	dann fehlt ihnen halt ein stück ösi kultur ) _w
450548217059770368	Positive	katta nachwuchs im tiergarten
450548384626380800	Positive	das wiederum freut mich )
450548512078704640	Positive	guten morgen
450548694866472961	Positive	hätte gemeint es wäre diesmal enorm leicht sp zu wählen in schulz' kielwasser und mit prominentem gesicht presseabteilung
450548815096188928	Positive	toller 12 minuten kurzfilm des #ipcc zum heute in japan präsentierten weltklimabericht (siehe video on wg ii )
450548953822806016	Positive	dir auch einen guten morgen
450549027432849409	Positive	alternativ zu pizza/pasta gibts auch was vom inder #sepm #tuwien
450549086446702593	Positive	häkeln ist grundsätzlich immer entspannend auch wenn man nur zusieht #knitted #knitwear…
450549226892980224	Positive	ich finde ja es braucht mehr s großartiges interview mit eugen freund #warumgeradestraßburg
450550165200318464	Positive	4 april 2014 tag der offenen tür an der #fhwien der wkw von 10 19 uhr
450550294561042433	Positive	ich habe ein video positiv bewertet nicky romero ultra music festival 2014 full set mainstage
450550398181720064	Positive	rt _maurer ich finde ja es braucht mehr s großartiges interview mit eugen freund #warumgerades…
450550498505273344	Positive	rt der &amp ich sind im juni beim content strategy forum early bird ticktets gibt es noch
450550810204975104	Positive	*sicher schon gehört * #twitter update android app kommt nun mit foto tagging daher
450551356496285696	Positive	_san da sollten wir doch mal was machen
450551673698938880	Positive	top interaktive karte aller twitter accounts des _de #ep2014 via
450551745954213888	Positive	rt kinder für gemüse zu begeistern ist wie handeln auf einem bazar ( )
450552345664159744	Positive	gleich gibt's warme socken vom ofen *3* gleich ihr kalten fußis qq
450552743355097088	Positive	moin nach hamburg jan delay ist ein hiphop pionier und ich hab sehr viel respekt davor was er alles schon
450552917603680256	Positive	wozu büro es gibt doch db lounges smiley #bahn
450553091222671360	Positive	bad windsheim würzburg neue mitfahrgelegenheit / mitfahrangebote für euch
450553742791028737	Positive	danke das sind sie ich nehm projekte an von denen ich eig keine ahnung hab und lerns nebenbei xd ggn bezahlug
450554025692635136	Positive	das ist echt toll flow magazin ausgabe 02 | flow magazin de
450554243993595904	Positive	aus der filmschneiderei wurde gerade veröffentlicht
450554371508813824	Positive	_san tragen wir unser diffuses unwohlsein über alles &amp alte männer in grauen anzügen nach brüssel vorwärts
450554464572022784	Positive	du hast es erfasst d
450554697372696576	Positive	zugang zu allen täglichen live trading webinaren ihre kosten 0€ testen sie unser ausbildungsangebot #xtb
450554986205024256	Positive	ich habe ein video positiv bewertet graphene sketches of our future
450555059500494848	Positive	_b_ auf tour gegangen smiley
450555301771501568	Positive	(must read ) trojanisches pferd gender welches geschlecht soll's denn sein «
450555376682151936	Positive	klar das ist immer noch schöner aber gut dass es sowas gibt
450555451466592257	Positive	naja aus der amerikanischen distanz betrachtet )
450555642680729600	Positive	| thursday | saunieren statt studieren am donnerstag wird sauniert statt studiert der main floor wird von swing
450555819336404992	Positive	maßanzug enterprise cloud geschäftsprozesse und collaboration verschmelzen
450556068897492992	Positive	rt womit zum heutigen montag alles gesagt wäre
450556181682348032	Positive	meiner meinung nach sogar noch schlimmer und das heißt was
450556605663551488	Positive	brachialer bronchialtee gute besserung
450557306552717312	Positive	rt herrliches interview von mit
450557760850362368	Positive	rt _de geballtes licht wissen bei #lb14 zur _building zeigen wir vier neue licht wissen hefte
450557962486947841	Positive	immer wieder gerne smiley ich wünsche ihnen einen duften tag /st
450558131320279040	Positive	doppelte dröhnung in frankfurt
450558589900701697	Positive	the ska network news wurde gerade veröffentlicht vielen dank an _network
450559242781483008	Positive	dominic oley schuf den text und war auch für die regie verantwortlich und kann sich für beides ordentlich auf
450559311950127104	Positive	apples unite the world apfelwein sowieso am sonntag jahrgangspräsentation im palmengarten
450559446159486976	Positive	das denke ich mir halt auch aber du wirst in korea sicher die chance haben die zu sehen
450559573196558336	Positive	geht samstag 1 zum lgbti twens treffen in berlin
450559628875558912	Positive	_minus_11 ja jetzt wo dus sagst so n bisschen d
450559794676371456	Positive	_guitar komm auch mit xd
450559822975729664	Positive	sehr hilfreich danke
450560007562874880	Positive	rt super beitrag zu user engagement debatte mit &amp mir …
450560057722544128	Positive	nach einem tollen wochenende dauert es etwas länger sich am schreibtisch zu sortieren
450560087820869632	Positive	zu gut raspberry pi ist anscheinend stärker als die server der regierung der _onkeltom jubelt //via
450560258222850048	Positive	alles alles liebe und gute zum geburtstag feier schön smiley 🎉🎁🎊🎈
450560385096368128	Positive	wenn denken einen beipackzettel bekäme würde er wohl so aussehen
450560623903256576	Positive	ist schon flip flop zeit #geil
450560853004546048	Positive	nasenbärchen o smiley selber nasenbärchen &lt 3
450561312721231872	Positive	zwei monate nach dem ersten tierarztbesuch sind die harnprobleme meines 12 jährigen katers endlich vorbei möge es so bleiben
450561430258212864	Positive	des gfoit da wieder a stund länger schlafen smiley
450561745590161408	Positive	my top 3 #lastfm artists sharon van etten (51) the antlers (43) &amp cœur de pirate (11) #mm
450561763386589184	Positive	rt +++ bringen heute ihr neues album dreams mit ins vorgeschmack auf orf at +++ #w…
450561868344877056	Positive	_san fesch
450561889920360448	Positive	_ meine fa empfahl mir femibion weil andere vitamin präparate für schwangere von manchem zu viel enthalten nicht so gut fürs baby
450562011169325056	Positive	rt _de von wo schoss marco reus bei #vfbbvb aufs tor erstelle deine #spielmatrix und verschick sie htt…
450562630969995264	Positive	arbö die wilden 70er 80er und 90er jahre des rallyesports #apa #ots #bot
450562878278742016	Positive	nächste sitzung der renminbi initiativgruppe am mittwoch im vierten quartal wird es eine weitere delegationsreise geben
450562917209890817	Positive	reminder öamtc/äkvö symposium unaufmerksam und abgelenkt im straßenverkehr am 2 april 2014 in wien
450563324531322880	Positive	putin propaganda und patriotismus 6 lehren aus der krim krise tlw kritisch insgesamt aber sehr interessant
450563370580987904	Positive	am ersten messetag stieg die besucherzahl im vergleich zum vorjahr um rund 12% danke allen besuchern #lb14
450563580111618048	Positive	mein letzter urlaubs tag smiley
450564103871156224	Positive	wir wünschen viel spaß und gute gespräche #lb14
450564410818703360	Positive	wir sind kräftig bei den vorbereitungen für die messe am wochenende bist du auch dabei am wochenende
450565016853708800	Positive	fmf präsident raettig frankfurt bietet mit bundesbank und boerse die perfekte infrastruktur
450565350607052800	Positive	_san naja aber 0 8 prozent sind die fakten ) euch wählt niemand
450565579460849664	Positive	da gebe ich ihnen von ganzem herzen recht
450565794091769856	Positive	rt schönen guten morgen wir starten in die derbywoche #wienistviolett
450566160183209984	Positive	als nächstes soll jeb bush für die us präsidentschaft kanditieren anscheinend geben sie uns immer nur 8 jahre verschnaufpause
450566555592822784	Positive	rt ich verspreche heute nur dinge von denen ich weiß dass ich sie erfüllen kann #happinez #inspiration
450566927002660864	Positive	weitwegwohnende freundin* kommt in wien vorbei und ich werd sie sehen ohne so viel zeit mit ihr zu verbringen dass wir streiten könnten \o/
450566985559310336	Positive	wow scheitern als chance macht muss nicht alles sein von katja kraus _days #x_days
450567061081952256	Positive	was mag das wohl sein #lb14
450567112902586368	Positive	da kommen frühlingsgefühle auf seidentops des wiener labels ferrari zöchling #ferrarizoechling #fuernshop
450567532248723457	Positive	dortmund interhomes hat logenplätze mit bvb aussicht zu vergeben
450567574225707008	Positive	dieses wochenende verbringe ich wieder im seminar von gabriele fischer war letztes mal ausgesprochen spannend freue mich schon ^_^
450567594467393536	Positive	rt _buch das gefährlichste an einer schönen buchhandlung ist die ec karte
450567826689241088	Positive	champions league + el gibt wieder spannende spiele und hohe quoten bei mit _inside etc &gt
450568791907647488	Positive	dass das präteritum von tro trodde ist gefällt mir total sonst ist das immer so ein ernstes graues wort
450569261971300352	Positive	zu zweit gegen löw us trainer klinsmann holt vogts als wm berater
450569881294217216	Positive	rt der zaun um die neue #ezb ist jetzt aber hübsch geworden #notroika #blockupy
450569983740104704	Positive	rt rt eugen freund ist mutig wie heinz fischer das sollte man nicht vergessen | und is' net schle…
450570033731612672	Positive	sehr gelungener slogan aber ist die övp jetzt täter oder opfer playful
450570063645388800	Positive	ja ich denke auch ) jeder reicht dann bitte einen eigenen antrag ein /no
450570183329853440	Positive	unhackme ist die beste anti rootkit software bild at
450570230012452864	Positive	danke jetzt muss ich mich nicht mehr opfern
450570278834540544	Positive	rt mein computer hatte eine out of memory exception verstehe den armen vollkommen bei uns nennt man so etwas alkoholindu…
450570441359257600	Positive	fifa wm jubilar schnellinger ich hoffe auf wm duell gegen italien
450570720360538112	Positive	coole sache „garteln“ mitten in wien von baumpatenschaften bis selbsternteparzellen
450570778476818432	Positive	tv tipp des tages geheimnisvoller #garten (1/2) frühlingserwachen 19 30 uhr bis 20 15 uhr #arte
450570869312868352	Positive	rt ich suche noch immer dringend einen job im onlinebereich in wien gerne auch bezahlte vollzeitpraktika bitte rt ich da…
450571041178660864	Positive	#real #trends #funny #eat24 lieferdienst plattform schreibt facebook abschiedsbrief on
450571546877120512	Positive	wir grillen morgen beans burger alarm
450571736472641536	Positive	_triforcer kommt zwar etwas spät aber danke für's folgen ＼(*t▽t*)／
450571757544415232	Positive	bitte und ich hoffe es klappt /no
450571949421260800	Positive	ob uns dirk the pixeleye behlau paar döschen hell yeah beer mitbringt
450572144691646464	Positive	man kann ja sagen was man will aber dieses edm zeug ist echt geil *rums rums rums*
450572730350714880	Positive	unglaublich
450572797656711168	Positive	meine veilchen eiswürfel sind in einem schweizer online magazin zu sehen &lt 3
450573138254778368	Positive	mit adwmagazin und piaggio gewinnen testen sie einen tag lang einen neuen piaggio kultroller auf einem
450573217380720640	Positive	audi a4 allroad quattro 2 0 tdi avant aus 2010 mit 118 000km und einer traumausstattung weitere infos unter
450573249597149184	Positive	vll gibts bei dir irgendwo ne firma die auch social media werbung macht oder ne kleine zeitung die ne onlineredaktion hat
450573422506942464	Positive	#lego kommt ins kino 17 spannende fakten über die dänische kult marke via
450573532612030464	Positive	rt wem ich die schuld gebe gebe ich die macht
450573684046958592	Positive	#kickthetrash wie _deutschland zur fußball wm mit mülltonnen einen treffer landen will
450573727072518145	Positive	rt vielen dank an fuer den tollen guerillabeamer mit allen drum und dran u seine unterstuetzung bei der mah…
450573795267719168	Positive	enormer schub richtung europa
450574089733038081	Positive	rt mt @_bjv_ alle wahlinfos jugendcheck der parteien &amp die dialogveranstaltungen finden sich auf
450574357430272000	Positive	netzpolitik der groko unser experte michael herfert lobt e mail made in germany und schlägt verbesserungen vor
450574392305922048	Positive	wichtiger #erfolg gegen #walfang via _wissen
450574519338418176	Positive	wir haben wieder spannende neue beiträge zu unserer #blogparade #teamarbeit dazu bekommen
450574746745593856	Positive	hallo deutschland
450574804165201920	Positive	wieder zurück nach 2 wochen urlaub schmeckt distel kaffee noch besser smiley (@ distel biomarkt) on #yelp
450575065059692544	Positive	rt #ttip mahnwache di 1 4 20 23h #frankfurt ostend helfer willkommen smiley infos #piraten
450575488067846144	Positive	springer und funke haben offenbar ein modell für den verkauf der programmies gefunden das das kartellamt überzeugt
450575516509032448	Positive	stehst du auf dicke frauen bist du ein liebhaber von rubensfrauen magst du keine studios und profis dann bist
450575615381368832	Positive	rt für die nächsten 7 jahre hat creative europe ein budget von 1 46 milliarden euro #scms14
450576176571236352	Positive	schon 2004 hat seinen klassiker über the vanishing newspaper geschrieben im juni 2014 ist er in wien freude #mid_14
450576286218735616	Positive	kicker online wichtiger dreier für spitzenreiter fortuna
450576543752781824	Positive	282 und kein bisschen leise happy new ears joseph haydn
450577202313457664	Positive	rt ich habe eine wassermelone gestapelt
450577272613765120	Positive	_tichar vielen dank für die info ich gebe es an unsere fachabteilung weiter /no
450578579017826304	Positive	beste vorbild beste lehrer selbst bewusst sein es leben vorleben
450578667190886400	Positive	meine mutter hat ubuntu ich kann mit ssh und vnc auf desktop zugreifen und sie unterstützen alles problemlos
450578917040996352	Positive	diva gewinnspiel auflösung diva bedankt sich bei allen fürs mitmachen und gratuliert der gewinnerin zuzana mento
450579146029408257	Positive	rt durchbruch für tierschützer un gericht stoppt japans jagd auf wale
450579195262144512	Positive	rt stadt wien ist vorreiterin von beginn an verpartnerung am standesamt möglich #lgbt #stadtwien
450579255735640064	Positive	auf mail hinweisen und freundlich bitten dich arbeiten zu lassen smiley
450579610359853056	Positive	rabatte in der #hollerei #vegetarisch #veggie #wien #essen
450579756099305472	Positive	rt schönen guten morgen wir starten in die derbywoche #wienistviolett
450579891780460545	Positive	wirtschaftskammer will matura mit lehre leitl ein intensivjahr bis zur lehrabschlussprüfung reicht
450579997208903680	Positive	neuer trailer für #allerwelt
450580053752311808	Positive	rt special offer beim 3b festival freikarten für jeden tweet mit oder hashtag #3bfest smiley
450580515897507840	Positive	die _san kann sich nicht entscheiden ob sie don quijote oder michael(a) kohlhaas sein will )
450580610084786176	Positive	bitte nicht nur wirtschaftlich sondern auch politisch besser nutzen
450580695698931712	Positive	_u_x wenn mir jemand schnell sagen kann wo der bilder cache für twitter am mac ist schick ich es dir
450580998850637824	Positive	rt die bisherigen unterschriften hätten bei nr wahl umgerechnet 6 mandate klub ergeben weiter machen weiter sagen
450581262411894784	Positive	4 4 2014 mach platz von barbara hassler (31 03 2014 10 29) in gruppe austrian desk treffpunk #österreich
450581526666031105	Positive	deus ex lässt grüßen cybathlon schweizer richten turnier für cyberathleten aus
450581638221537280	Positive	jetzt ist es soweit der adidas zx flux ab sofort im black &amp white shop oder unter
450581843608604672	Positive	wunderschöner satz danke
450581904832860160	Positive	so einen tweet kann man natürlich nicht faven solidarität muss sich anders in worten äußern
450581938135240705	Positive	anuuuuuu wie süßßß &lt 3
450581994548654080	Positive	wenn du immer schon mehr über dich erfahren wolltest der workshop dazu
450582420967133184	Positive	das wadi rum eine kulisse die man sehen muss höhepunkte jordanien macht mit #botrostours
450582456455155712	Positive	grossartig #whale #japan
450582916519559168	Positive	webscalesql mysql im großen stil mitarbeiter von facebook google linkedin und twitter arbeiten im rahmen d
450583159407906816	Positive	rt _posch wie im casino man bezahlt spieler nicht nur das was er verloren hat sondern auch was er gewonnen hätte #düringer #h…
450583633678860288	Positive	rt _jukic am 31 03 2011 bist du von uns gegangen claudschi du fehlst uns r i p
450583737542410240	Positive	extra nachgeschaut ja bin also eher so der klassische typ ) (bis jetzt fehler nicht gefunden immer überlesen) #alt
450584182079909888	Positive	einzelhandelsumsätze auf den guten januar folgte ein ebenso erfreulicher februar für die händler meldet destatis
450584292100276225	Positive	bitte diese woche für netzneutralität abstimmen danke
450584756590489600	Positive	heroische mutter im 21 jh krebskranke mutter opfert sich für baby stirbt wochen nach der geburt
450584963738791937	Positive	rapid sportdirektor müller 'wollen unbedingt mit zoki weitermachen'
450585541860274176	Positive	häää smiley mehr davon gibt es hier → witze sprüche und lustige bilder #lustig #bilder
450586134704562176	Positive	15 unglaubliche raspberry pi projekte #raspberrypi
450586241675710465	Positive	meduni/akh mit stammzellen die toleranz transplantierter organe steigern #wissenschaft #news
450586501584547840	Positive	rt _bekannt die wiener küche ist die einzige weltweit die nach einer stadt benannt ist
450586603401261056	Positive	erster tipp oben
450586904585445376	Positive	@_badmaxx_ unternehmensbekleidung smiley /st
450586982901489664	Positive	rt _austria glawischnig zu weltklimabericht warnung ernst nehmen endlich raus aus öl und gas
450587128242524160	Positive	ich nehme an barcamp köln teil wer ist noch dabei via
450587607647670272	Positive	screenwriting news wurde gerade veröffentlicht vielen dank an
450588227519660032	Positive	ein tag zum feiern uno gericht versenkt japans walfangflotte zu viele wale getötet das ist keine wissenschaft
450588301012242432	Positive	gesundheit bewertungsportal als ärzte wegweiser für patienten
450588589400027136	Positive	ein sadist der sich bemüht ein guter wenn auch ein guter sadistischer freund zu sein ist auch ein guter mensch wir sind was wir sind
450589094960451584	Positive	und jetzt wo ich wieder zugenommen hab kann ich auch wieder trainieren ich freu mich grad so fang gleich heute abend an
450589225923407872	Positive	rt übergriffe und sachbeschädigungen in kirchen dürfen in toleranter gesellschaft nicht passieren #juraczka
450589391677714432	Positive	alles gute wünsch ich dir glasscheiben die zu bruch gehen via
450589981443362816	Positive	in meiner welt na klar
450590249409056768	Positive	toll geamcht nur hat der akteur michael spindelegger im 4 akt einen falschen text
450590862120984576	Positive	jep die runde war gar nix hab auch ein spiel weniger getippt weil ich fast drauf vergaß
450590918148907008	Positive	ja so in etwa war's bei mir auch grad very problematic smiley
450591555964116992	Positive	hallelujah jetzt sind sie weg
450591633290321920	Positive	oh cool d töchterchen liebt die wimmelbücher besonders den herbst
450592707120234496	Positive	freu mich über das positive feedback das ich bekomm motiviert mich den blog noch professioneller besser u abwechslungsreicher zu gestalten
450592736911974402	Positive	neu bei #newcarz | vw golf feiert 40 geburtstag eine klasse für sich |
450593460295172097	Positive	der geburtstag des großen österreichischen komponisten joseph haydn jährt sich heute zum 282 mal
450593615904276480	Positive	ein videoclip anbieter hat einen imagefilm für eine firma gemacht – ganz ohne firma
450593674184122368	Positive	warum )
450593973015687168	Positive	rt schon 2004 hat seinen klassiker über the vanishing newspaper geschrieben im juni 2014 ist er in wien freud…
450594058302668800	Positive	die aktuelle lehrabschlussquote lag am bfi wien bei 93 4% um 12 4% über dem wien schnitt #wirsindstolz
450594228138438657	Positive	große vorfreude auf das neue video smiley
450594627159355392	Positive	“das geheimnis des vorwärtskommens besteht darin den ersten schritt zu tun ” (mark twain)
450594750048260096	Positive	silent place @ heiligenkreuzerhof
450594939299061761	Positive	endlich wurde #battlefield4 #navalstrike veröffentlicht d gleich lossuchten #nichtsbessereszutun d
450595048850460672	Positive	_ ich schaue es mir an danke
450595400433803264	Positive	ja klar #apple ist ja viel gefährlicher als #google *lol*
450595724569640960	Positive	_gap neben eurem büro gibt es guten kaffe
450595958943150081	Positive	forschung zum teilen wie veranstalter und teilnehmer von #tweetups profitieren können via
450596045077352448	Positive	ist kein muss smiley
450596211234729984	Positive	noch 2 tage #paris
450596635228524544	Positive	guck mal die neue karte liegt ab morgen im #dellago auf smiley kannst dann nach eurer rückkehr so bestellen
450597069234135040	Positive	rt die neuen an schläge sind zu euch unterwegs schwerpunkt abtreibung/schwangerschaftsabbruch
450597125555236864	Positive	super danke
450597399187443712	Positive	ich war dabei yipiieeee “ trial ist geil ein trialtraining bei elmar heuer
450597512823709696	Positive	großartige sendung am samstag in #oe1 über fritz molden
450597700258775040	Positive	ne das kam bei mir auch nicht so an smiley
450597911290990592	Positive	das ist eine sensationelle idee )
450598055021408256	Positive	hihi d schön dann hoffe ich aber mal dass du nur eine wahl sonnenallergie hast und nicht wie ich wirklich juckende pusteln
450598160231309312	Positive	ist aber auch spannend wenn jemand anderes über die konzerte berichtet auf denen man auch war
450598708304830464	Positive	brandneu silber sandaletten von primafila #shoetation
450598885086732288	Positive	einer an vergiftung einer an der narkose während ner op hoffe der jetige schaffts länger alles wunderschöne huskys btw #lasttweet
450599005094178816	Positive	haha fefe gestern am späten nachmittag gab es in hessen ein
450599064833642496	Positive	pm pitney bowes erfindet sich neu
450599141744578560	Positive	geschafft gurkengesöff
450599723058364416	Positive	artis saal 2 irgendwie landen wir immer da )
450600171135827968	Positive	aber hübsch 😍
450600640902078464	Positive	rt kluger kommentar des kollegen rainer hank zum karlsruher urteil staatsfernes staatsfernsehen #faz
450600975443980288	Positive	wenn ich jetzt dieses amazon prime hätte könnte ich morgen den ganzen tag #got gucken ich glaube ich muss es kaufen
450601015348563968	Positive	parken like a boss (ich war's nicht) #mutig
450601232655450112	Positive	2015 mach ich definitiv wieder mehr cons mit als dieses jahr
450601321717321728	Positive	_w vielleicht alles auch nur ein guter reminder dafür dass man die breitenwirkung von twitter richtig einordnen sollte
450601423684653057	Positive	für den montag zwischendurch suv für alle einfach zum nachbasteln smiley #fb
450601708478291968	Positive	dann reden wir von jedi anakin skywalker also mir ist die trennung schon wichtig )
450601902267723777	Positive	_daniel hinterfragen kannst du ja problemlos auch ohne anzuweisen und abzuwerten
450602036808400896	Positive	haha #möhrenmilieu ist ja ein super hashtag d
450602065400975360	Positive	vorbildliche und auch laien nachvollziehbare er/aufklärungsarbeit in sachen #hypo
450602237732352000	Positive	danke für eine tolle party im orange peel hier fidnet ihr noch mehr bilder von der party
450602308616093696	Positive	vielleicht können wir und ja eine fahrgemeinschaft bilden smiley
450602718298918912	Positive	good news weiter so der aktive offene stil ist positiv für die politische kultur
450602733671026688	Positive	rt _weber unglaublich aber wahr schafft es tatsächlich das zu rehabilitieren (läuft er am ende gar noch…
450603101029158912	Positive	da waren wir wohl schnell genug )
450603257396994048	Positive	rt geschafft gurkengesöff
450603520962863104	Positive	und das schönste am freien tag es gibt mittagsschlaf 😴😄👍
450604026376486912	Positive	rt duden liste »schwierige wörter« diffizil steht darauf oh the irony aber auch so zauberhafte exoten wie amurtiger h…
450604181989392384	Positive	sehr erfreulich nur eine kleine anmerkung am rande um ziele überzeugt zu verankern formuliert man sie als erledigt
450604271323869184	Positive	da testet grundnahrungsmittel im @_horizont pizza burger bzw pizzaburger #lol wobei lt definition kommt es sogar hin
450604365020418048	Positive	rt _building in der kategorie zweckbau gewinnt den energieeffizienzpreis elektro hering für ein intelligentes hotel #lb14
450604510512447489	Positive	rt vorbildliche und auch laien nachvollziehbare er/aufklärungsarbeit in sachen #hypo
450604804847697921	Positive	boliviens präsident empfielt koka kauen
450604901685407745	Positive	ist es nicht toll naturkosmetik findet langsam aber sicher immer mehr auch den weg in hotels hier z b
450605061685932032	Positive	2x okympiagold 1xsilber 3x wmgold 1x bronze 1x emgold 1x silver 1x bronze 15 weltcup siege 1x weltcup gesamtsieg #lingerbrüder #rodeln
450605207131811841	Positive	rt _zeitung #geldanlage tipps kostenlos morgen (11 13h) können sie unsere experten im live chat befragen
450605217177149440	Positive	endlich nach unzähligen hackangriffen im letzten jahr ist die kilez more website wieder online
