434829552742068224	Positive	pass bloß auf )
434830497274142720	Positive	endlich mal wieder eine herrlich spaßige diskussion hier so macht das doch spaß smiley
434830574491271168	Positive	nacht
434830668624060416	Positive	so schlafe er gut
434832360295907328	Positive	mein held smiley
434833423942057984	Positive	ach mach es trotzdem winter ist ja vorbei )
434835380580663296	Positive	rt man sollte niemals beim einkaufen twittern jetzt steh ich an der kasse und im wagen habe ich milch und ein unbekanntes ba…
434835899361554432	Positive	tschuldigung ich war zu früh du warst ja noch nicht fertig 😊
434836050570379264	Positive	bin gerade dicht vom taxi gekommen von wegen clean d
434836362228170752	Positive	ich weiß die erfahrung habe ich auch schon gemacht 😏
434836814680305664	Positive	wenn du das dann noch mit humor nimmst alle achtung 😁
434837378780651520	Positive	stimmt und weise bist du auch noch
434840421249081346	Positive	alles gute dear ratte d
434842075637379072	Positive	@ zentrum der galaxie liftoff
434842177890689026	Positive	sind wir sweet #hahaha #süßekids #peace #lol #drunk #inlove #voll #vollgewesentollgewesen…
434843600547880961	Positive	rt meine frau wollte eine katze ich wollte keine kompromiss geschlossen wir haben jetzt ne katze
434844302326652929	Positive	linden #beste
434844944940163072	Positive	rt männer haben keinen kleiderschrank sondern einen stuhl neben dem bett
434845541332418560	Positive	ich stehe mit einem müllsack bekleidet auf der straße telefoniere und die polizei fragt mich ob bei mir alles ok ist
434856581843681280	Positive	ich habe ein video von positiv bewertet gemüse lasagne von einfachkochen rezept für
434857290932707328	Positive	ich habe ein video positiv bewertet leckere
434858768040726528	Positive	cheers #mädelsabend #fun #cocktails #hannover mit _traege
434862317717979136	Positive	tide session nervling sonntag 16 02 2014 um 23 30 uhr | tv programm | 6215641 | tvmovie de
434867513802117120	Positive	auf einer skala von 1 10 bin ich bei einer 3 5 würde ich sagen wenn es um den status des betrunkenseins geht
434869146963431424	Positive	ja sicher das klappt auch bei einer 8 aber heute war es wirklich unproblematisch
434882938824830976	Positive	schlaf gut smiley
434892314176389121	Positive	danke 2013 hallo 2014 danke wünsche motivation liebe ziele zusammenhalt ich freue mich auf sie
434895847311298560	Positive	ich liebe dich einfach hart
434910139767087104	Positive	keine sorge carlos ich arbeite gleich wieder dann kann ich nicht lesen )
434913717579292673	Positive	wir zieh’n durch die straßen und die clubs dieser stadt das ist unsre‘ nacht wie für uns gemacht oho oho ich
434932125394305024	Positive	rekord eingestellt „jetzt ist jürgen klopp endgültig eine legende “ good read
434932387567247360	Positive	die ts großburgwedel hat das spiel in der 3 liga nord gegen den oranienburger hc nach 45 sehr starken minuten sicher mit 29 25 gewonnen
434933117619818496	Positive	was für ein großartiger abend smiley danke herzlichst für die einladung
434934513723269120	Positive	ich habe ein video von positiv bewertet titanfall smart pistol double pilot kill
434934686146887680	Positive	guten morgen ich wuensche euch einen schoenen sonntag )♡
434935113915588608	Positive	seit 2001 verfolg ich immer wieder was du anstellst sonnyblack ein muss in jeder sammlung #zersägt
434935130604732416	Positive	hii kannst du mich aus dem sitzplan löschen ( ) ich hatte ein ticket für oberrang 136 jetzt grüne zone d x
434936507087192064	Positive	grillenchor zum sonntag
434936701509971968	Positive	ich habe ein video von positiv bewertet badgerfield 4 the cookie crumbles
434938723294531584	Positive	_next das genie beherrscht eben das chaos 😜
434938918308675584	Positive	problem #fachkräftemangel eine lösung #jugendberufsagenturen soll flächendeckend umgesetzt werden #guteidee
434940150607396865	Positive	guten morgen
434941100978372608	Positive	wow jansrud
434946455531687936	Positive	ah wohl doch nur was am knie #olafsen #boardercross
434951632745680897	Positive	morgens elmex abends aronal das hat sich seit kindertagen in mein hirn gebrannt keine gefahr
434953081865129984	Positive	montagsmotivation² – mal verrückt und außergewöhnlich sein alte muster aufbrechen und neue wege gehen
434955493266968576	Positive	hört sich vom sound her zwar scheisse an aber über das video muss ich immer lachen d
434955690818666496	Positive	geiler schwanz würde ihn gern mal spühren
434956615255879680	Positive	guten morgen good morning bonjour gunaydin buongiorno buenos días ohayoo gozaimasu namastē доброе утро ~
434960106740908032	Positive	twitter / wwf_deutschland heute ist welt schuppentier tag see more
434960162646786049	Positive	guten morgen nach 6km laufen habe ich mir nen capu verdient 🔥#maschsee #hannover
434960475831697408	Positive	omega 3 fettsäuren verbessern die kognitiven fähigkeiten bei erwachsenen
434960631373250560	Positive	hab das bild vergessen ♥♥♥
434961471680700417	Positive	3 neuanfang beim #hsv diese saison vll kann #slomka die richtigen impulse setzen wir hoffen das beste #nurderhsv
434962980644462593	Positive	in #h96 hat er auch viele gute dinge bewirkt hoffnung ist da vll hungrige spieler einsetzen
434963280541392896	Positive	zweitewelle de hvb überrascht im eichsfeld via
434964155100311552	Positive	veganes protein aus erbsen artischocken und braunem reis
434964992249839616	Positive	_de glückwunsch zu deinem 250★ tweet oh ihr wart heut nacht fleißig
434965844616290304	Positive	das erste guten morgen aus der neuen wohnung smiley
434966191808204800	Positive	3 liga ost punktgewinn für die msg nach den zuletzt �u�erst schwachen leistungen stand die #handball »
434966430396977152	Positive	war definitiv ein glückliches tier
434966990852472832	Positive	ich habe ein video positiv bewertet portal a day in the life of a turret (machinima)
434967179709403136	Positive	_6foot3 haha nein da gabs zwei szenen die mir völlig neu waren einmal mit dem lächeln und dann wo sarah ihm die cpu entfernt
434967417371258880	Positive	aso ein messenger ok war mal wieder zu faul für google smiley
434967913754161152	Positive	aufstehen wie die profis wakeup dein wecker der dich ganz entspannt durch den sonntag bringt &lt 3 10 00 uhr
434968723267801088	Positive	ich glaube heute muß ich selber zu kaffeemaschine robben bis später dann
434970462226231297	Positive	sexy blonde red lips ein duftkuss voller lebendigkeit
434972116593958912	Positive	guten morgen liebe fb freunde♥♥♥ nach dem sonntagsfrühstück geht's ins funkhaus am maschsee was steht bei euch
434973017425575936	Positive	_erl ich bleib lieber oldschool 2 plattenspieler 1 mic
434977619185266689	Positive	geade aufgestand und worauf hab ich hunger pizza und smoothie normal d
434977855181967360	Positive	rt #protein plus mit lebensnotwendigen nährstoffen für den aktiven menschen
434980112493461504	Positive	ich habe ein video von positiv bewertet arven rainsong
434982983272235008	Positive	_lite glückwunsch dann gibt es ja jetzt law &amp order twitter town
434983026465189888	Positive	veganes superfood mit kürbiskernprotein
434984298400460800	Positive	glückwunsch es sei ihnen von herzen gegönnt
434984530479710208	Positive	#synovia 2000® granulat das wertvolle und zugleich leckere #proteingranulat
434984545327513600	Positive	freundin liegt im bett guckt mir in den laptop mit rein und fummelt an sich rum… d
434984970772578304	Positive	der _whtvr und ich haben heute quasi unser zweijähriges twiter jubiläum ich habe so tolle follower d
434985190038183936	Positive	_hh die deutsche ist nur nicht dabei weil nur 24 starten dürfen 11
434985844672589824	Positive	das ist verdammt nochmal auch gut so
434986396747841536	Positive	rt #hover css coole css3 hover effekte für deine seite
434986773257920512	Positive	preisupdate diesel 1 37⁹€ super e10 1 49⁹€ super e5 1 53⁹€
434992017131995136	Positive	wer findet die ersten krokusse im hermann löns park
434993682157432832	Positive	schokolade erzeugt keine pickel jugend erzeugt pickel #radioeins #hach smiley
434994971947847680	Positive	gefällt mir
434998954221387776	Positive	bester bf царь кристоф бумс hat mir einen baby freien tag im aspria hannover geschenkt so wars
435002424890511360	Positive	ahhh okay smiley gar nicht mitbekommen * *
435002722627371008	Positive	lass es dir schmecken #kaffee #dopa
435002776444477440	Positive	sushi sonntag so gefällt mir das smiley
435002939082801152	Positive	auch bei leichtem kater das beste mittel um wieder 100% klar zu werden der spaziergang am kanal bei so einem genialen wetter
435003084994273280	Positive	sehr schöne texte 👍
435003227344764929	Positive	#dreiklassenmedizin wurde gerade veröffentlicht vielen dank an
435003383997804544	Positive	später zu den recken sehen wie flensburg handewitt verliert
435003494227927040	Positive	die sumatra tiger brauchen unsere unterstützung tiger manifest unterzeichnen &gt &gt &gt #palmöl
435004354828177408	Positive	rt das schönste ist ja wir lachen alle in der selben sprache )
435004529848107008	Positive	rt liebst du sie oder willst du nur nicht allein' sein
435005238744190976	Positive	stimme ich zu
435005697504604161	Positive	tui hat dieser tage neues personal für kreuzfahrtschiffe gecastet bildschöne rezeptionistinnen die zu den jeweiligen häfen angeflogen werden
435006548503715840	Positive	da ist was dran oder )
435006911734611968	Positive	lasst den #sushi sonntag beginnen smiley (@ ichiban grill restaurant)
435007261736710144	Positive	einer meiner kleinen zeichentrickfilme für ein #startup aus hannover smiley
435007608001683456	Positive	love
435007681712386048	Positive	seo für bilder so klettern sie in den google serps nach oben
435008822462394368	Positive	frühstücken – wie jeden sonntag (@ finesse)
435009784027545600	Positive	ich habe ein video positiv bewertet summer overture lotr remix
435010747408867328	Positive	female dominance celo mit einer delikaten orientalischen note voll sprühender energie
435010752626585600	Positive	mit tim bilder gemacht &amp gequatscht schrei battle mit daniel &amp fabian kommt im konzert zu uns kniet sich hin &amp gibt uns seine hände omg 💕
435010896226967552	Positive	rt mit tim bilder gemacht &amp gequatscht schrei battle mit daniel &amp fabian kommt im konzert zu uns kniet sich hin &amp gibt uns s…
435011348733231104	Positive	ich habe ein video von positiv bewertet barthezz on the move (cesar remix)
435011442429816833	Positive	ich habe ein video von positiv bewertet neon hitch bad dog (easy does it dubstep
435011555705778176	Positive	ein glück muss das immer was heißen wenn manager irgendwas sagen )
435011923873382400	Positive	_90 _svw slomka+schmadtke war perfekt leider mochten sie sich (wohl )nicht trotzdem respektiere ich beider leistung
435011944232153088	Positive	ich habe ein video von positiv bewertet dj khaled all i do is win feat t pain ludacris
435012021440876544	Positive	ich habe ein video positiv bewertet miley cyrus wrecking ball (caked up remix)
435012233634914304	Positive	ich habe ein video positiv bewertet akcent my passion ( official video )
435012544525115392	Positive	ich habe ein video von positiv bewertet don diablo silent shadows (mind vortex remix)
435012575894306816	Positive	ich habe ein video positiv bewertet kriya emelee i wanna ride (original mix)
435012638297190401	Positive	ich habe ein video positiv bewertet wolfgang gartner clap (original mix)
435012683201802240	Positive	ihr solltet mich mal sehen wenn ich ein richtig schönes liebeslied finde welches so ganz ohne boa dein arsch is mörda auskommt
435012730873864193	Positive	ich habe ein video positiv bewertet martin polska &amp ma z ft archie es ist vorbei (videoclip)
435012800700628993	Positive	ich habe ein video positiv bewertet will sparks ah yeah
435013056737705984	Positive	ich habe ein video positiv bewertet summer cem feat kc rebell dein ex [ prod by prodycem ]
435013108780654592	Positive	vegan und lecker
435013182281633792	Positive	ich habe ein video positiv bewertet giorni dispari ludovico einaudi
435013185830420480	Positive	diese vielen tweets sind ein ergebnis meiner vorbereitung zur moderation des zukunftskongresses von mp weil morgen jetzt erstmal joggen )
435013448573788161	Positive	ich habe ein video positiv bewertet tjr ode to oi (original mix)
435013479611629569	Positive	ich habe ein video positiv bewertet avicii you make me lyrics
435013664308203521	Positive	unsere facebook fanpage performance 30 tage im überblick die fanpage erzeugt mächtig traffic handwerker
435013789910433792	Positive	ich habe ein video positiv bewertet denzal park i'm a drum machine
435013803005050880	Positive	und dies ist auch cool (splash)
435013894084366337	Positive	ich habe ein video positiv bewertet ton c lead the way (feat erick gold) (official video)
435014197961711616	Positive	ich habe ein video positiv bewertet rob &amp chris geil (dj k96 hands up bootleg)
435014294845923329	Positive	ich habe ein video positiv bewertet the partysquad &amp boaz oh my (nylez bootleg)
435014623452880896	Positive	ich habe ein video positiv bewertet sycess engel in high heels (official music video) hd
435014682181517313	Positive	ich habe ein video von positiv bewertet pj simas just a dream (remix)
435015055340359680	Positive	haha stimmt d
435015170549493760	Positive	ich habe ein video positiv bewertet niki &amp the dove mother's protect (goldroom remix)
435015231958302720	Positive	ich habe ein video positiv bewertet metric sick muse (imij dubstep remix)
435015296147943425	Positive	ich habe ein video positiv bewertet kc rebell feat moe phoenix sieh es endlich ein (official hd
435015650717622272	Positive	ich habe ein video positiv bewertet daniall dance floor ( club sax 2011 ) хит зимы
435016086145482752	Positive	heute nur mini muskelkater vom laufen gestern und morgen wiege tag bin optimistischer als die fans des hsv
435016154982014976	Positive	ich habe ein video positiv bewertet cassey doreen nightclub kings (extended mix)
435016290613207042	Positive	ich habe ein video positiv bewertet dan balan lonely (hot single 2013)
435016377825361921	Positive	ich habe ein video von positiv bewertet dan balan lendo calendo (ft tany vander &amp
435016494997438464	Positive	ich habe ein video positiv bewertet dan mädchen macht die lauscher auf
435016561292627968	Positive	ich habe ein video positiv bewertet dvbbs &amp borgeous tsunami (radio edit)
435016609355157504	Positive	ich habe ein video von positiv bewertet marteria kids (2 finger an den kopf)
435016914775965696	Positive	ich habe ein video positiv bewertet farid bang lutsch [ official video ] prod by juh dee
435017204451405824	Positive	ich habe ein video positiv bewertet jaysus seh ich gut aus
435017287586705408	Positive	ich habe ein video positiv bewertet milky chance stolen dance (album version)
435017310114295808	Positive	ich habe ein video positiv bewertet olexesh purple haze (offizielles video) | nu eta da am
435017705502953472	Positive	ich habe ein video positiv bewertet of the night bastille (lyrics)
435017847006191616	Positive	ich habe ein video positiv bewertet t zon ''wir beide'' official hd video prod by topic
435018232773480448	Positive	preisupdate diesel 1 34⁹€ super e10 1 46⁹€ super e5 1 50⁹€
435019500812259328	Positive	ich sag dann auch mal guten morgen
435020856415506432	Positive	#schöne #haut sieht #sexy aus
435020881510019072	Positive	fiery affair madra johannisbeere jasmin rose und süße myrrhe verschmelzen zu einem modernen dufttraum
435021098972086272	Positive	_west empfehlung michael stuhr sideshow buchregal
435021216571600897	Positive	supi scheint das jahr der neuen brillen zu werden )
435021811693395968	Positive	ich hätte es eher von _hh erwartet rt russisches damen curling team groupie
435022031307145216	Positive	_pj _das ist nun mal echt witzig smiley
435022231434186752	Positive	hab über nen monat gebraucht um nen passendes sofa zu finden xd
435023255888756737	Positive	auch die 3 folge von marvels agents of #shield kann überzeugen und gleich hinterher staffelfinale von #boardwalkempire smiley #skyanytime
435025161771679746	Positive	wenn filme wie software produziert werden hast du schon das neue update von … gesehen nächste woche kommt ein fix von … in die kinos
435025394434338816	Positive	best pickup line ever
435025549489369088	Positive	_status danke hat auch bei mir geholfen seit wann ist das so zuvor ging es doch auch mit stun
435026538619105281	Positive	abschied und neuanfang starbariton thomas #quasthoff begeistert als rezitator im großen sendesaal des #klassik
435028329507598336	Positive	veganes superfood mit kürbiskernprotein
435029280175947776	Positive	rt lass das mal den papa machen der papa macht das gut 🎵🎵🎵
435029394412019712	Positive	ich würde dich immer wollen
435029811208396800	Positive	rt nur wenige #niedersachsen machen #bildungsurlaub dabei lohnt es sich #arbeitnehmer #bildung #weiterbildung
435030223046725632	Positive	so spielen unsere roten schmidt teichgräber blume surma prokoph ernst herrmann pietler rusteberg behrens pläschke
435031193793601536	Positive	ich musste lachen
435032477825249280	Positive	was wünscht du dir momentan am meisten im leben — nichts alles so wie es sein soll d❤️
435034693948301313	Positive	der gast der spielt ohne unseren ex keeper fabian lucassen
435035736073838592	Positive	rt lass das mal den papa machen der papa macht das gut 🎵🎵🎵
435035830415925249	Positive	die mannschaften betreten den rasen mit leichter verzögerung geht es hier gleich los
435036135501230080	Positive	erhan yilmaz und torben deppe werden gleich anstoßen dann startet das heimspieljahr 2014 endlich
435036196914606080	Positive	gänsehaut ☛ wie ein schwarzer spiegel ☚ #ff
435036244025049089	Positive	ein sonntag eigentlich zum jetzt wieder schlafen gehen nur leider erlaubt das mein terminplan nicht naja nichts neues auf geht’s
435036649588678656	Positive	'2 erstes heimspiel seit über einem halben jahr übrigens für unsere nummer eins alex meyer willkommen zurück im tor
435038373271445504	Positive	'9 plate legt bikmaz an der sechzehner grenze und sieht gelb gute position
435039334744739840	Positive	nach der arbeit das vergnügen ) technikobst spielt hearthstone live auf twitch jetzt
435039731722641408	Positive	'14 pfosten eichedes huseni haut den ball ans aluminium meyer war chancenlos durchatmen
435040088989634560	Positive	#siri hat den sinn des lebens entdeckt und wie recht es hat
435040355625746432	Positive	tränengas auf dem spielfeld vllt wäre das ja mal ne idee für unsere defensive #hsv
435040649814241280	Positive	stelle mir gerade vor wie cool ein 2 teil von sudden death mit vandamme wäre der beim curling match spielt und nicht beim eishockey
435041462754222080	Positive	_fq urlaub ist schon was feines smiley
435042460562386944	Positive	rt nichts los auf dem #schnellweg ( dafür lockt das gute wetter genießt es (foto dillenberg)
435042901618601984	Positive	rt glücklicher durch nikotinverzicht rauchstopp hebt die laune – lifeline
435043580902920192	Positive	#ww das reißt den leser glatt vom stuhl der k a t z von zipfel ist halt cool #detektivroman
435045722094723072	Positive	'38 wieder gefahr vorm garbsener tor heidenreichs eckstoß verpasst meyer issahaku köpft drüber
435046007056117761	Positive	ich liebe dieses t shirt so sehr *_*
435046034348466176	Positive	unsere u23 spielt zur stunde gegen den goslaer sc und führt prokoph traf eben (32 ) zum 1 0
435046412183539712	Positive	regenerationswoche oder degenerationswoche auftanken für die ersten harten intervalle
435047130584317952	Positive	_d guter trainer halt smiley
435047549934637057	Positive	lorde mit team bitte smiley #wunschhits
435048087044640768	Positive	lorde team ♥ #wunschhits
435048931412955136	Positive	aber du doch auch smiley
435049559694508032	Positive	___romy wusstest du dass ich dein neues bild als home bildschirm habe
435049688203411456	Positive	kico im tv strassensound interview checkt das interview ab und teilt es wenn es euch gefällt #kico
435049809360486400	Positive	15 jahre alt und olympiateilnehmerin wahnsinn #sotschi #annaseidel
435050082296401920	Positive	foto hellyeahkpaustria für den notfall 😜 das notfallpaket für’s nächste konzert smiley
435050928082014208	Positive	ja sehr interessant das sind großmeister der gamification
435051519445336064	Positive	sieg slowakei gegen russland (40min 0 0) und sieg slowenien gegen usa wäre zu groß aber leider haben amis was dagegen )
435052298143023104	Positive	sonntagsspaziergang in der leinemasch sonne satt @ hanover laatzen grasdorf
435052366111715328	Positive	schlafen auf steuergeld ministerin schwesig spart sich eigene berliner wohnung sympathische frau
435052897366073344	Positive	der erste artikel auf polytopes ist fertig #frax hd für das ipad ist das fraktal programm
435052909718679552	Positive	auf geht's
435053242389913600	Positive	mit zfsonlinux bist du zufrieden läuft es stabil hast du crypto im einsatz
435053782431723520	Positive	das ist mal schön und spiegelt meinen zustand wieder “ kw 7 verbindung #fotoprojekt2014
435053912601927680	Positive	nach der vorrunde habe ich ganz dick die schweiz und die usa aufm zettel skandinavier (swe + fin) muss ich noch genauer beobachten
435054557702283264	Positive	'58 nächster guter pass von bildirici auf deppe der aber knapp im abseits steht
435055435465228288	Positive	'62 der ausgleich ist vollkommen verdient
435056661716553728	Positive	ich mag menschen die mein schreibtempo haben d
435057537394941952	Positive	noch zu lina &lt 3 (@ gross buchholz)
435058660692078592	Positive	'75 zweiter wechsel beim tsv deppe geht vom feld beismann ist neu im spiel voller angriff
435058828942770176	Positive	boo yah jack
435058987692593152	Positive	ich hätte gerne für den sommer einen süßen kurzen an mir gut aussehenden overrall
435059272582725632	Positive	hahaha ja ich weiß 😂😍
435059419911839745	Positive	#geocaching erfolgreich hinter uns gebracht
435060340007899137	Positive	tor für die u23 behrens gelingt in der 74 minute der 2 3 anschlusstreffer
435060382492016642	Positive	rt tor für die u23 behrens gelingt in der 74 minute der 2 3 anschlusstreffer
435060458433675264	Positive	ich bin auch am start hahaha d voooooten &lt 3
435060587778035713	Positive	das rogenbrötchen beim neuen burger von #mcdonalds ist eindeutig gesünder sagt meine mama genau so wird's sein
435060787242340353	Positive	sich als neutraler fußballfan auf #fcafcn freuen zeiten ändern sich smiley
435061110409281537	Positive	rt das ist meine definition von service
435061695833051136	Positive	'87 katz und maus im gäste strafraum aber der sv steht mit zehn mann da und so kommt der tsv nicht zum schuss
435062060674985984	Positive	rt wenn ihr heute nur einen text lest dann diesen sexualität und gesellschaft das ende der toleranz
435062196276854784	Positive	#bommes deutschland hat im eishockey das endspiel erreicht leider das um den abstieg d #eishockeyladies #wirfuerd
435062502003466241	Positive	'90 wieder bikmaz posipal legt den ball in den fünfmeterraum zurück bikmaz schiebt ein 2 1
435063317259124736	Positive	im erste hilfe kurs lernt man also wo man das warndreieck aufstellen muss gut zu wissen smiley
435066463955980288	Positive	rt e commerce mehr umsatz mit guten danke seiten
435066678016491520	Positive	&lt 3 &lt 3 (aber lass mich ruhig vorher nochmal bei meinem getränkemarkt vorbeischauen)
435066834799194113	Positive	linktausch für dich sogar kostenlos auch schön du schreibst einen artikel auf unserem blog und musst nix dafür zahlen
435067006631829504	Positive	_lounge hahaha ja genau wie gütig
435067431862931456	Positive	wir gratulieren natalie fischer und allen anderen genossinnen zur wahl ins la präsidium der jusos niedersachsen /mv
435068748735995904	Positive	gerade von meiner besten freundin dieses bild bekommen #hameln du bist so schön
435068886011379712	Positive	_fox guck mal )
435069235057131520	Positive	nun ist es offiziell #slomka ist #hsv coach good luck
435069587118637056	Positive	alles gute herr slomka #hsv
435070218294292480	Positive	frühling
435070968432975872	Positive	d37 es wird frühling #100happydays
435071306120572928	Positive	hauptsache er wird nicht aufs kreuz gelegt
435071778357260288	Positive	rt nichts los auf dem #schnellweg ( dafür lockt das gute wetter genießt es (foto dillenberg)
435071833348780032	Positive	hübsch hier (@ maschsee w/ 6 others) [pic]
435072591238549504	Positive	was zusammengehört wird früher oder später auch wieder zusammenfinden😌☝️
435073190508105729	Positive	und natürlich hertha wob
435073325728284672	Positive	das wünsch ich dir smiley
435073694927708160	Positive	rt #baden – #entspannung pur mit #badesalz und #duschgel ohne #konservierungsstoffe
435073717845364736	Positive	wünsche unserem mirko #slomka für seine neue station beim viel kraft und geduld der #hsv hat nun einen sehr guten trainer
435074391756775424	Positive	montagsmotivation² – chancen nutzen lohnt sich wenn chancen anklopfen einfach mal die tür öffnen hallo
435074743809875969	Positive	das beispiel mit der sahnetorte ist ja mal der hammer d💕
435076138294329345	Positive	#zuckerrohrmelasse das #schwarze #wunder
435079184810274816	Positive	weiter gehts jäger ball
435079666895159296	Positive	bin gespannt was das wird habe irgendwie gar kein gefühl dazu
435080085478334464	Positive	es ist gleich 17 uhr und es ist noch tageshell
435080358279651328	Positive	glaube einfach nicht das er sich das antut #slomka #hsv für´s portfolio ) aber bei 10 weitern klatschen weiß nich find´s witzig
435081138499891200	Positive	würde ich so springen können wie die ladies beim cross snowboarden &lt 3 #olympia2014
435081717238726656	Positive	an die männerwelt da draußen folgt mal dem _max_199 auch wenn sein wohnort scheisse ist ist er beautiful 💕 #ff
