435494195734671360	Positive	fu** you *sing und dabei im hackfleisch rumhack* xd
435494267814166528	Positive	_barfuss völlig wurscht der kann warten )
435494315570499585	Positive	_of_chaos oh ja gabriel kann einpacken d
435494451667304448	Positive	ein schummelmodul bin schon auf den weg
435494472248729600	Positive	dankeschön 💕
435494473964204032	Positive	deutsche zeit und sotchi zeit wow ganze drei stunden unterschied
435494496437293056	Positive	danke für beitrag zur #blogparade von _kkundk social adoption use case rules #e20 #socbiz
435494588325695488	Positive	_chat sorry das tut mir leid benötigen sie noch eine info für die weiterfahrt /si
435494751690055680	Positive	redundanz \o/
435494821307105280	Positive	und ich aufs spiel ))))
435494896213180416	Positive	_barfuss scheint hungrig zu sein dein abwasch stell was zu essen daneben dann hungert er nicht mehr )
435495032989433856	Positive	pollack versteht es komplexe befragungswerte anschaulich zu machen &amp religionssoziologie in nur 2 silben auszusprechen #kirchevorort
435495251449741313	Positive	das achte gold für deutschland danke andreas wank marinus kraus andreas wellinger und severin freund #sochi2014
435495272001863680	Positive	d ja sag mal bist du auch wrestling fan
435495376783548416	Positive	log horizon ist besser als digimon
435495399085060096	Positive	rt ich finde und @_numbed ziemlich cool fällt mir auf 👌
435495692573110273	Positive	ehhhhh was für nachrichten hahahahaha
435495958248718337	Positive	_bvb1909 jaaa smiley willkommen im club
435496050607284224	Positive	ja sachsenhausen ist gut du suchst sicher was schönes raus für mich dann heimspiel beim #bildungsäppler )
435496066335932417	Positive	erstmal eine rauchen 🚬
435496925509742593	Positive	@_blackdawn_ aber gerne 😃
435497033722384384	Positive	herzlichen glückwunsch an andreas wank gold im team skispringen
435497077398073344	Positive	rt @_moshkito jauch was soll ich sagen… opa ja sollen sie sagen d #wwm
435497091176349696	Positive	haha der alte mann rockt gerade das studio bei #wwm #grandios
435497308822982656	Positive	an die dichter und denker betreff auf in die dichterschlacht auf in den poetry slam hallo liebe poeten
435497339353305088	Positive	das tolle an lydia benecke sie redet angenehm schnell &lt 3
435497407552299008	Positive	kann ich vorbei kommen d bringe auch bier mit
435497821622775808	Positive	hihi er ist doch noch gar kein ehemann verlobte haben ab und zu noch recht )
435497979475394560	Positive	rt _de herzlichen glückwunsch an andreas wank gold im team skispringen
435498209600106496	Positive	rt schenk ich euch #rt #los #penis
435498327480610816	Positive	komm an mein herz mein kind smiley
435498449682042880	Positive	du solltest das recherchieren nao sie ist soooooooo episch
435498528128114688	Positive	welcome rt so und den restlichen abend noch ein wenig r2g bin ja mal gespannt
435498968127393792	Positive	schöne grüße nächstes mal aber #r2g okay )
435499446546071552	Positive	letztes jahr hat mir der an der kasse nicht geglaubt dass ich über 15 bin
435499466138083328	Positive	ich hab spaß mit #clumsyninja für ipod spiele kostenlos mit
435499564066689024	Positive	hallo meine lieben diese woche gibt es ein paar änderungen der öffnungszeiten di 12 00 16 00 uhr mi und do
435499568034512896	Positive	ich hab spaß mit #clumsyninja für ipod spiele kostenlos mit
435499872750698496	Positive	am wochenende ordentlich saufen gehen läuft
435500063885103104	Positive	ja mir geht es gut und das quäppchen in meinem bauch entwickelt sich prima
435500480211726336	Positive	yes wir haben die neue wohnung happydance am 1 5 ziehe ich mit meinem mann zusammen ❤️ ich raste aus vor freude natürlich
435500615926841344	Positive	und das beste katzies sind doch erlaubt awww
435500725775659008	Positive	auf jeden fall und die waren auch alle so schön badass endlich mal wieder daryl maggie glenn &lt 3
435500873980968961	Positive	fotos entwickeln und dabei die alten sachen von den ärzten hören guter abend
435501119717244930	Positive	lass diesen tag süß verklinkeln lassen )
435501219852070912	Positive	das war sehr stark ich habe schon vergebens nach diesem kurs gesucht das snowboard fahren war dafür ja sehr gut 😊
435502195300401152	Positive	großer andrang xd
435502364389556224	Positive	rt ich zeige statt dessen lieber dieses bild
435502391883206656	Positive	manche momente sind so geil man will nicht das sie aufhören
435502594450931712	Positive	du willst mich küüüüüüüüüüüüüüüüüssen doch das geht mir zu schnell … *sing*
435502634024583168	Positive	9 4 abflug nach chicago wir haben es uns verdient
435502909544210432	Positive	abendessen und nebenher surfen und einen film über horizon tv app von unitymedia schauen (@ daniels home base)
435502924765356032	Positive	_de bald kommt ein noch besserer editor für mehr programmiersprachen )
435502955803209729	Positive	cooler rentner #sowillichimalterauchsein #wwm
435503065857536000	Positive	single bleiben stress vermeiden 😂
435503103753060354	Positive	außerdem hat tw dylan der schlägt momentan eh alles xd
435503451242762241	Positive	es soll ja auch am main sehr schön sein *fg*
435503485237604352	Positive	ich habe ein video von positiv bewertet things we hate
435503519571783680	Positive	rt _de falls jemand gerade unterwegs ist smiley #singapore #uitp #lta training programme on public transport fundamentals http /…
435503570260348928	Positive	herr reher 86 alt hat eben 125 000 euros bei wer wird millionär gewonnen respekt
435503941942779904	Positive	kaufwahn ich war mal wieder im hugendubel und bin wie nicht anders zu erwarten fündig geworden #kafka #marx
435504066756870144	Positive	#survivalkit #nudelauflauf
435504191285788672	Positive	hjaaaaa &lt 3 ich steh halt immer noch auf evil stiles xd
435504242808610817	Positive	gleich geht's los neue folge #thewalkingdead
435504301348118528	Positive	ja das dürfen sie smiley /si
435504346068172800	Positive	jaja schon kla xd ich bin still xd
435504380809576448	Positive	wenigstens kein englisch dann wünsche ich noch einen schönen abend leider pist du nicht gesprächig
435504828215988224	Positive	ich feiere deine mukke richtig hart — dankö ((
435505029844586496	Positive	kein geocaching im tv aber toller lp 23 40 geheimnisvolle orte heute | ard | 23 40 00 25 | dokureihe prora
435505053039079424	Positive	rt _west empfehlung michael stuhr sideshow buchregal
435505475397124096	Positive	guck was vernünftiges meine kleine fuchsia smiley
435505581655588864	Positive	_news mich würde wirklich mal das gesicht von hr rummenigge interessieren wenn _official wechseln würde #bauernpack
435505829689970688	Positive	gilt ein fav als freuen ) glückwunsch
435505844961435648	Positive	geh selber einkaufen d
435505965052731392	Positive	geduscht nun komme ich dazu mir endlich was zu essen zu machen ) mahlzeit
435505994073112576	Positive	der gute cm hat seine ische am flughafen in chicago abgeholt das muss liebe sein
435506053103771648	Positive	nachher suchbild finde das meeri smiley
435506112784502784	Positive	prinzessin popcorn
435506221366259712	Positive	lieber gott mach mich fromm
435506368314114048	Positive	danke fürs folgen _deu und _de
435506474433785856	Positive	geheiligt werden deine früchte
435506897069019136	Positive	eindeutig darwinismus (falls ein auto kam logisch)
435507112261988352	Positive	clarins base mal sehen ob's was bringt bei mir d
435507129529925632	Positive	mehrere und beim kunden kaffee und kippe hab ja nette kunden
435507154297315328	Positive	_ns_hn bestes meerschweinchen ^ ^
435507191483613184	Positive	gute neuigkeiten zum frauenhofer institut in hanau
435507253450637312	Positive	und wieder in frankfurt in 5h das ging echt flott
435507575707426817	Positive	ps kognitive dissonanz haben pur schon so schön definiert als ich könnte wenn ich wollte doch wollen können kann ich nicht
435507659819982849	Positive	_g super spannend achja hier ist ein hörer der olympia gespannt verfolgt im web per live ticker und im tv
435507731597119489	Positive	rt sprechen sie mich ab 28 02 nicht mehr an dann kommt die 3 staffel game of thrones und ich werde vor meinem fernseher leben
435507772617408512	Positive	wünsche euch einen tollen abend smiley ich unterstütze einen verein der hilfsbedürftigen menschen hilft hier ein
435508414022561792	Positive	nein bitte nicht ich bin vor zwei jahren über dieses lied weg gekommen das video dazu ist noch viel besser d
435508432649863168	Positive	sehr gut smiley
435508657443577856	Positive	na das ist doch bestimmt praktisch so zum bierflaschenöffnen
435508673754836992	Positive	_hilft alles klar ich bin gespannt
435508844123652096	Positive	sheldon hammer kerl d
435508967222304768	Positive	und das ist gut so )
435509161963847680	Positive	nein das bin ich nicht ich bin single #lasttweet
435509486863015937	Positive	ich habe ein video positiv bewertet landing gear banged to its limits
435509515749191680	Positive	_g gute besserung erhol dich smiley
435509686885171200	Positive	_ikono kommt sofort )
435509830368120833	Positive	die kombi carol / tyrese ist großartig #thewalkingdead
435509921229312000	Positive	noch besser
435510178252079104	Positive	ich war auch grad da sonst trifft man sich doch immer unverhofft der zufall war früher auch irgendwie verlässlicher
435510205707980801	Positive	10 punkte nach wuppertal
435510393679933440	Positive	rt egal wie cool du bist wenn ein kind weint weil ihm die nase geklaut wurde dann greifst du in deine tasche und holst die …
435510554321367040	Positive	die kannte ich noch nicht danke schön
435510699289096192	Positive	@_guisi also ich lese da dallas playful
435510865832722432	Positive	aber dann hast du den sinn von twitter nicht verstanden d
435510916910960640	Positive	falls du lust hast kannst du gerne in die beta schreib mich mal an dann klären wir den rest smiley
435511068635713537	Positive	ich hatte schon die befürchtung dass ich allein sei )
435511202354311168	Positive	so leute es tut mir grad übelst leid euch so zugespamt zu haben / sry dafür ♡
435511261129097216	Positive	##andieapes war für euch der geilste telefonstreich ever
435511391412584448	Positive	der name prinzessin popcorn ist gerechtfertigt oder d
435511479576850432	Positive	jetzt gerade die die kenn ich schon d
435511566579269633	Positive	ich habe ein video positiv bewertet snowpiercer trailer mit deutschen untertiteln
435511592902742016	Positive	hi schön dass wir uns hier nun auch folgen 😊
435512026233069568	Positive	_karyu was hast du denn für n blau genommen xd
435512209628622848	Positive	falls nicht schon gesehen trailer 2 zur vierten staffel got
435512233997914112	Positive	#bombergate müsste es nicht piratisch korrekt gegendert #bomberingate heißen
435512242637778944	Positive	das habe ich jetzt auch gesehen d ich hoffe es spritzt sich locker aufs hemd geht's gut von der hand das eisen ^^
435512401287331842	Positive	bin ab mai für 2 monate in hamburg wer hat lust mich zu entertainen
435512578333507584	Positive	deine hammer tollen videos anschauen * * ♥
435512664991604736	Positive	na dann flutscht das ding ja ganz von alleine vor und und zurück lass bloß nichts anbrennen playful
435512706263969793	Positive	mich würde wirklich mal das gesicht von hr rummenigge interessieren wenn _official wechseln würde #bauernpack
435513025953427457	Positive	ne heiße schokolade schlurfen und mib2 gucken #perfecto smiley
435513106639228930	Positive	danke schön d
435513117913931776	Positive	wieder katzenmamis gefragt smiley _eti rt the cat who thought he was a penguin
435513329541738496	Positive	ja wunderbar 😳 möchte ich aber nicht täglich haben 😉
435513384382259200	Positive	_74 lass es dir schmecken
435513547830079488	Positive	es gibt filme da weiß man durch die häufung des wortes scheiße dass wir dem finale näher kommen …
435513591505358848	Positive	nur noch eine runde 1 1/2 stunden später xd #titanfall
435513840764481536	Positive	glen packt das immer
435514014617985024	Positive	dann sollte ich vielleicht doch das o wie otto statt dem i wie ida kaufen d
435514194772127744	Positive	i liked a video fifa 14 top 5 tore der woche #19 hd
435514277517340672	Positive	_de oki passt auf euch auf
435514379753508864	Positive	xavier #naidoo dieser weg mein #abi lied &lt 3 bin immer noch auf meinem weg
435514447420219393	Positive	wart ab smiley
435514755517001728	Positive	die coolste stadt deutschlands ist #frankfurt sag' ich doch
435515078755246080	Positive	und wer so was twittert macht sich auch verdächtig unterstützenswert
435515143150370817	Positive	danke an _kopp für das analytics warm up heute
435515272511094784	Positive	das waren doch zwei schöne sachen carol und abraham's army )
435515511896829952	Positive	#frankfurt rocks so ist es
435515760329654272	Positive	nein glen ist sauber smiley
435515963996262400	Positive	___ das ist ein anagramm für schumi
435516213368979456	Positive	i liked a video fifa 14 next gen abos wissen wer ibarbo ist #21 dänemark
435516306881003521	Positive	außer die tomb raider )
435516375663378432	Positive	cooles porträt über die macher
435516468948926464	Positive	ok alles klar ab 3 bin ich ca in der stadt vllt sieht man sich
435516727687147520	Positive	rt #ivanpah so sieht das riesige solarwärmekraftwerk von google aus
435516824298717184	Positive	geht klar ich bring dir was richtig behindertes mit xddddd
435516884533133312	Positive	„the fear“ und „ripper street“ auf zdfneo keine angst der mörder hat längst alles vergessen
435517190977388544	Positive	ich bin dabei #ccffm bin schon gespannt wie wir dem sozialwerk main taunus bei der online kommunikation helfen
435517251605647360	Positive	danke schön werde ich mal ausgiebig unter die lupe nehmen
435517271243776000	Positive	rt wenn das mit der schlagzahl so weiter geht gibt es ein grandioses finale der 4 staffel #thewalkingdead #noch6folgen
435517471844745216	Positive	wusstet ihr eigentlich dass es eine fledermausart gibt die schokoladen fruchtzwerg heißt nein guckt ihr hier
435517485765259264	Positive	___ du kannst auch gerne weiter in die vergangenheit gehen d
435517554401239040	Positive	wenn du noch wen brauchst ich wäre dabei d
435517600681164800	Positive	montag abend wir hätten viel spaß
435517885394325504	Positive	spannende videos über spannende menschen und deren spannende (medien )berufe
435518067901489152	Positive	suchti aber genialer film uk kann das rt und weiter geht's mit zombies 28 days later gleich zum einschlafen smiley #kabel1
435518106099011584	Positive	möge die rache des pistolenkrebses euch verfolgen piu piu piu
435518256867459072	Positive	tut mir leid für dich
435518355814903808	Positive	40% frühbucher rabatt bei aidu zusätzlich mit gutschein camcorder kostenlos abstauben
435518393559822336	Positive	bild d
435518519556333568	Positive	rt ich hab's doch gewusst unfassbar jungs so verdient #wirfuerd
435518642022019072	Positive	_alulu _gan_g das nennt man fan smiley ❤️
435518994997448704	Positive	_juergen und ich dachte die #piraten existieren nur noch bei twitter… )
435519022889582592	Positive	wie heißt es richtig schissel to the dissel from the hissel to the dissel d
435519350661853184	Positive	i love it d
435519717517062144	Positive	ich gründe jetzt eine fußball partei nicht links nicht rechts sondern tor
435519788690210816	Positive	nachti smiley
435519857715863552	Positive	lol wen interessiert es worauf du hinweist
435519978021064705	Positive	vergiss tyrese nicht der hammermann ist ja wohl der hammer (achtung billiges wortspiel ) smiley
435520118853226496	Positive	mein süßling du ❤️😘🐶 #sweet #doggy @ leinhausen
435520241641086976	Positive	ich habe einen iphone tick und mache nun den ebay klick
435520247093673984	Positive	ggeiiill ist das günstig ipad als ebay auktion
435520440774438912	Positive	ich sage feierabend für heute #gutenacht #twoff
435520815325773824	Positive	klasse (spannendes) spiel #auefck (1 0)
435521146906476544	Positive	sauber aue mein geheimer aufstiegsfavorit punktet mal wieder wird wohl am ende trotzdem nicht reichen smiley
435521922701742080	Positive	_gonzo _ffm86 euch beiden eine gute reise
435522037252378624	Positive	nein sie schafft das habe tag 10 hinter mir durchatmen macht spaß
435522127606059009	Positive	brauch schoki
435522402735648768	Positive	so bin dann auch mal online d
435522406657314816	Positive	ich lästere immer ein bisschen über das saarland aber das ist ja nicht so böse gemeint ) mit dialekt wäre es schöner
435522413510791168	Positive	schulz in the box das guck ich jetzt
435522421819314177	Positive	i liked a video joomla 2 5 installieren tutorial deutsch/german [hd] tutorialchannel
435522568565837824	Positive	jetzt #schulzinthebox auch #schulzbox gucken
435522585624072192	Positive	ja smiley du etwa auch das wär ja super
435522645397110784	Positive	gute nacht welt oder auch guten morgen je nach zeitzone
435523385490415616	Positive	sag mir nur was genau du brauchst oder wie du dir das vorgestellt hast smiley
435523436325388288	Positive	hat ja schon was diese folge #schulzbox
435523448853762048	Positive	prima dann sehen wir uns ja am freitag smiley freu mich dörfer haben ja auch was für sich )
435523530617520130	Positive	deine mudda läuft nackt durch kik und schreit das ist spartaaaa
435523560929382400	Positive	empfehlung offener online kurs kinderzimmer productions von start so 23 02 #edchatde
435524395998904320	Positive	wurde mal wieder zeit reinzuhören #diedrei
435524466819743745	Positive	und das um die uhrzeit smiley
435524980114485248	Positive	an so einer dose fisch snackt man doch gern #schulzinthebox
435525072468852736	Positive	_ nicht so schlimm und hey wir haben am letzten spieltag wiedermal einen punkt geholt und das in allerletzter minute \o/
435525271194988545	Positive	hihi ich hab scheide gesagt
435525715224567809	Positive	lulz das ist eine seite für konzert termine
435525809500323840	Positive	o)))
435525956036354048	Positive	wie die ossies in berlin vor dem apple store sehen und schreien es war nicht alles schlecht in ios6
435526102581145600	Positive	öhm du hast gerade erzählt dass du dich an die möglichkeiten der technik gewöhnen musst ich darf lachen xd
435526132205879296	Positive	jep das ist das problem d
435526220541734912	Positive	oh es gibt doch deutsche youtube channel die cool sind
435526236194873344	Positive	_ist schlaf gut smiley
435526474905296896	Positive	soweit so gut seelisch soweit auf dem damm toll dass sich die andere teilnehmer gekümmert haben smiley
435526539896438784	Positive	es ist fast beängstigend wirklich großes kino #schulzbox
435527131582705664	Positive	klarheit in der online pr wurde gerade veröffentlicht vielen dank an
435527183092948992	Positive	_tgbutch aah okay ) konnte deine favorisieren grad nicht einordnen
435527492498366464	Positive	#schulzinthebox doku ohne langeweile einfach genial gemacht
435527674589491200	Positive	na wenn das kein argument ist mein opa hält mich seit team viewer auch für ein genie playful
435527793917837312	Positive	die ausrede gilt nicht smiley es gibt doch #livestreaming
435528076345507841	Positive	rt so sehen flieger aus unsere gold adler #wirfuerd *jb
435528176736169984	Positive	türkei gehört zu eu
435528393161854976	Positive	du tust meinem ego nicht gut wegen dir bekomme ich noch höhenflüge
435528537991557120	Positive	wie es aussieht findet olli heute eine haltung zum thema #schulzinthebox
435528620371505152	Positive	guten abend schön dass sie wieder einmal bei uns sind ^ka
435528944964866048	Positive	das beste das ich seid langem im tv gesehen habe #schulzbox
435529470762840064	Positive	so was von hammergeil das habt ihr euch verdient #lassteskrachen
435529902671282176	Positive	teilen ist was gutes
435530166417510400	Positive	2 staffel house of cards durch jetzt noch mal alle folgen mit der mitbewohnerin gucken smiley #houseofcards
435530284747206658	Positive	3 tage babe dann ist der physische teil geschafft psychisch kann das 1 jahr dauern verändere deine verhaltensmuster
435530427428663296	Positive	via linksjugend hamburg kommt am 1 3 zu der großdemo und auf den jugendblock
435531055366672384	Positive	aber gerade sorgen teilen ist wichtig die guten momente teilt eh niemand mit dir
435531277073395713	Positive	aber man hat getötet und nicht eine pusteblume am gehwegrand
435531571589050368	Positive	du warst gerade bei rtl extra * *♥♥
435531712744128512	Positive	blogs sind wieder auf dem technisch neuesten stand
435531786471235584	Positive	ha archivfoto vom _2000 genommen aber ein sehr dynamisches smiley
435531893543796736	Positive	olli ist einfach besser in der jva als im oligarchen palast #schulzbox
435532411997523968	Positive	#gavtheterrier we love you hamburg we do #hsv#unabsteigbar#nurderhsv
435532881163603968	Positive	_ppde ich finde schon dass einige der entwürfe (mind 2) echt gut geworden sind smiley
435532934171602944	Positive	rt leute mit einer neuen idee gelten so lange als spinner bis sich die sache verkaufen läßt
435532966673281024	Positive	10 minuten vor ladenschluss noch ne pizza bestellt jaaaa ich kann menschen den feierabend versauen
435533182650179584	Positive	sowas von krass purlitzer verdächtig
435533519402438657	Positive	ja wer weiß was ich auf katzisch bewegendes gesagt habe o o ^^
435533670318088193	Positive	wie auch immer donnerstag gibt es dicke töne &lt 3
435533873519153152	Positive	okaaaay das notiere ich mir das will ich nicht wissen alles klar also weiter im text d
435534020857053186	Positive	rt okaaaay das notiere ich mir das will ich nicht wissen alles klar also weiter im text d
435534376336916480	Positive	rt wär ich boxer wär mein kampfname red bull und der slogan red bull verteilt prügel
435534415834648577	Positive	für mich die entscheidende frage der heutigen sendung d
435534537796251648	Positive	doch habe ich x'd ich hab es im herbst angefangen zu kaufen
435534578552692736	Positive	suchti playful
435534635104501761	Positive	bin ja da smiley
435534805040889856	Positive	frau und kinder )
435534971319877632	Positive	rt #schulzbox im knast eine amüsante tiefgründige und sozialkritische folge krass was privatfernsehen auch kann
435535022322647040	Positive	love u too xx
435535049015197696	Positive	rt #schulzbox im knast eine amüsante tiefgründige und sozialkritische folge krass was privatfernsehen auch kann
435535200752500736	Positive	warum kriege ich das mit dem #bombergate kram erst jetzt mit wo das popcorn alle ist
435535222348976128	Positive	@_hellov per dm macht er wenigstens nicht dick ok ich nehme auch ein stück )
435535308021837825	Positive	leider nein smiley aber ich finde es großartig
435535779490955264	Positive	was olli schulz da gerade macht ist ein lehrstück für journalisten absolut bewegend ganz großes fernsehen #schulzinthebox
435535826915958784	Positive	da funktioniert mein management… 😉
435536037020839937	Positive	_kater dann gönne ich euch diese ehre von herzen wie z b diesem carsten schulz aus nds einige fehlen noch
435536097121026048	Positive	musst du mir mal beibringen p
435536183352119296	Positive	selbstironie bringt _lindner sympathiepunkte die regenbogenfahne “to russia with love” auch #akv
435536217745399808	Positive	win win lenkt von meinen ab und rotwein ist ein tolles gesöff smiley
435536357964791808	Positive	epischen ohrwurm von boy in luv ~~
435536625381040128	Positive	olli schulz spielt koks &amp nutten in der jva #hannover bizarr und berührend irre #nowplaying #schulzbox #schulzinthebox #folsomprison
435536754901536768	Positive	wenn ich dir sage dass du gehen sollst will ich nur dass du bei mir bleibst und merkst dass ich dich gerade so verdammt brauche
435536756898037760	Positive	verdammt gute ausgabe von #schulzbox vermittelt einen durchaus anderen blick ganz ohne vorurteile
435536958774075394	Positive	i ❤️ adrenaline
435537081000275969	Positive	ich möchte eine kritik zu #schulzbox
435537566196961281	Positive	was bist du denn für ein putziger depp d begriffe wie alte jungfer seid ihr rechte noch so drauf d
435538160622518272	Positive	ich steh parat bin dann im mutterschutz smiley
435538180897382401	Positive	ich pöbele gerne doch das war wirklich ne gute sendung #schulzbox
435538225050816512	Positive	genmais bei farmville dann spiele ich mit
435538508829433857	Positive	die beste ausgabe #schulzinthebox der staffel wird schwer zu toppen
435538590966497281	Positive	mein gesamter musikgeschmack ist tot ^^
435538763167457282	Positive	hallo johanna nein kein problem ich leite das weiter sehr schade dass du nicht kommen kannst
435538819325370368	Positive	alles andere macht dir nur kopfweh sinn verpufft australien hat auch tolle weine in der preislage sehr fruchtig
435539799379042304	Positive	und schön ladenwarm aufmachen 15 min offen ziehen lassen dann in ein großbauchiges glas rotwein will leben
435539921760432128	Positive	da biste ja noch nicht smiley
435540056636674048	Positive	astra für euch *rüberschieb*
435540181350105088	Positive	endlich schreibt's mal jemand ich bin also dran schuld dass mein wunderbarer bruder diese tolle musik macht
435540308437504000	Positive	meine timeline lieb ich ja nur 1x das ist immer smiley
435540383045791744	Positive	so muss das
435540667935113217	Positive	schlaaaf guuuut smiley
435540762416414720	Positive	_kock es ist alles auch anders möglich
435541497266839553	Positive	hey gefüllt smiley
435541918403919872	Positive	_tw die zahlungsavise da hab ich 'ne idee wenn es mal vorbereitet und die mailadressen drin dann sind die avis kaum arbeit mehr smiley
435541932753059840	Positive	never ever ever smiley
435542137367982080	Positive	rt beim schluss von winnetou iii weine ich immer aus (ewigen jagd)gründen
435542357615058944	Positive	heute war das wetter schon viel besser so kann es bis ende der woche ruhig bleiben 😀
435542679775375360	Positive	rt letzter kraut drehtag die maske hat ganze arbeit geleistet
